tuning_records/yolox-tiny-cuda-autotuner-records-3000-3.json
{"input": ["cuda -keys=cuda,gpu -arch=sm_86 -max_num_threads=1024 -thread_warp_size=32", "conv2d_nchw.cuda", [["TENSOR", [1, 12, 208, 208], "float32"], ["TENSOR", [24, 12, 3, 3], "float32"], [1, 1], [1, 1, 1, 1], [1, 1], "float32"], {}], "config": {"index": 179481574, "code_hash": null, "entity": [["tile_f", "sp", [-1, 4, 2, 3]], ["tile_y", "sp", [-1, 2, 4, 1]], ["tile_x", "sp", [-1, 1, 13, 2]], ["tile_rc", "sp", [-1, 1]], ["tile_ry", "sp", [-1, 3]], ["tile_rx", "sp", [-1, 3]], ["auto_unroll_max_step", "ot", 512], ["unroll_explicit", "ot", 1]]}, "result": [[8.825069674547984e-05], 0, 4.260754823684692, 1674271449.6866584], "version": 0.2, "tvm_version": "0.11.dev0"}
{"input": ["cuda -keys=cuda,gpu -arch=sm_86 -max_num_threads=1024 -thread_warp_size=32", "conv2d_nchw.cuda", [["TENSOR", [1, 12, 208, 208], "float32"], ["TENSOR", [24, 12, 3, 3], "float32"], [1, 1], [1, 1, 1, 1], [1, 1], "float32"], {}], "config": {"index": 66585574, "code_hash": null, "entity": [["tile_f", "sp", [-1, 4, 2, 3]], ["tile_y", "sp", [-1, 2, 4, 1]], ["tile_x", "sp", [-1, 1, 13, 2]], ["tile_rc", "sp", [-1, 1]], ["tile_ry", "sp", [-1, 3]], ["tile_rx", "sp", [-1, 3]], ["auto_unroll_max_step", "ot", 512], ["unroll_explicit", "ot", 0]]}, "result": [[8.807736883415657e-05], 0, 2.6506009101867676, 1674271451.3065095], "version": 0.2, "tvm_version": "0.11.dev0"}
{"input": ["cuda -keys=cuda,gpu -arch=sm_86 -max_num_threads=1024 -thread_warp_size=32", "conv2d_nchw.cuda", [["TENSOR", [1, 12, 208, 208], "float32"], ["TENSOR", [24, 12, 3, 3], "float32"], [1, 1], [1, 1, 1, 1], [1, 1], "float32"], {}], "config": {"index": 217113574, "code_hash": null, "entity": [["tile_f", "sp", [-1, 4, 2, 3]], ["tile_y", "sp", [-1, 2, 4, 1]], ["tile_x", "sp", [-1, 1, 13, 2]], ["tile_rc", "sp", [-1, 1]], ["tile_ry", "sp", [-1, 3]], ["tile_rx", "sp", [-1, 3]], ["auto_unroll_max_step", "ot", 1500], ["unroll_explicit", "ot", 1]]}, "result": [[8.760328309708478e-05], 0, 3.087134838104248, 1674271453.5757198], "version": 0.2, "tvm_version": "0.11.dev0"}
{"input": ["cuda -keys=cuda,gpu -arch=sm_86 -max_num_threads=1024 -thread_warp_size=32", "conv2d_nchw.cuda", [["TENSOR", [1, 12, 208, 208], "float32"], ["TENSOR", [24, 12, 3, 3], "float32"], [1, 1], [1, 1, 1, 1], [1, 1], "float32"], {}], "config": {"index": 104217574, "code_hash": null, "entity": [["tile_f", "sp", [-1, 4, 2, 3]], ["tile_y", "sp", [-1, 2, 4, 1]], ["tile_x", "sp", [-1, 1, 13, 2]], ["tile_rc", "sp", [-1, 1]], ["tile_ry", "sp", [-1, 3]], ["tile_rx", "sp", [-1, 3]], ["auto_unroll_max_step", "ot", 1500], ["unroll_explicit", "ot", 0]]}, "result": [[8.803916510609633e-05], 0, 2.587050676345825, 1674271455.8603969], "version": 0.2, "tvm_version": "0.11.dev0"}
{"input": ["cuda -keys=cuda,gpu -arch=sm_86 -max_num_threads=1024 -thread_warp_size=32", "conv2d_nchw.cuda", [["TENSOR", [1, 12, 208, 208], "float32"], ["TENSOR", [24, 12, 3, 3], "float32"], [1, 1], [1, 1, 1, 1], [1, 1], "float32"], {}], "config": {"index": 179525734, "code_hash": null, "entity": [["tile_f", "sp", [-1, 4, 2, 3]], ["tile_y", "sp", [-1, 2, 2, 1]], ["tile_x", "sp", [-1, 1, 26, 2]], ["tile_rc", "sp", [-1, 1]], ["tile_ry", "sp", [-1, 3]], ["tile_rx", "sp", [-1, 3]], ["auto_unroll_max_step", "ot", 512], ["unroll_explicit", "ot", 1]]}, "result": [[8.56086347703465e-05], 0, 2.9335875511169434, 1674271457.484086], "version": 0.2, "tvm_version": "0.11.dev0"}
{"input": ["cuda -keys=cuda,gpu -arch=sm_86 -max_num_threads=1024 -thread_warp_size=32", "conv2d_nchw.cuda", [["TENSOR", [1, 12, 208, 208], "float32"], ["TENSOR", [24, 12, 3, 3], "float32"], [1, 1], [1, 1, 1, 1], [1, 1], "float32"], {}], "config": {"index": 66629734, "code_hash": null, "entity": [["tile_f", "sp", [-1, 4, 2, 3]], ["tile_y", "sp", [-1, 2, 2, 1]], ["tile_x", "sp", [-1, 1, 26, 2]], ["tile_rc", "sp", [-1, 1]], ["tile_ry", "sp", [-1, 3]], ["tile_rx", "sp", [-1, 3]], ["auto_unroll_max_step", "ot", 512], ["unroll_explicit", "ot", 0]]}, "result": [[8.435918219650171e-05], 0, 2.61307954788208, 1674271459.1246786], "version": 0.2, "tvm_version": "0.11.dev0"}
{"input": ["cuda -keys=cuda,gpu -arch=sm_86 -max_num_threads=1024 -thread_warp_size=32", "conv2d_nchw.cuda", [["TENSOR", [1, 12, 208, 208], "float32"], ["TENSOR", [24, 12, 3, 3], "float32"], [1, 1], [1, 1, 1, 1], [1, 1], "float32"], {}], "config": {"index": 217157734, "code_hash": null, "entity": [["tile_f", "sp", [-1, 4, 2, 3]], ["tile_y", "sp", [-1, 2, 2, 1]], ["tile_x", "sp", [-1, 1, 26, 2]], ["tile_rc", "sp", [-1, 1]], ["tile_ry", "sp", [-1, 3]], ["tile_rx", "sp", [-1, 3]], ["auto_unroll_max_step", "ot", 1500], ["unroll_explicit", "ot", 1]]}, "result": [[8.547520504752978e-05], 0, 2.9297986030578613, 1674271461.3238451], "version": 0.2, "tvm_version": "0.11.dev0"}
{"input": ["cuda -keys=cuda,gpu -arch=sm_86 -max_num_threads=1024 -thread_warp_size=32", "conv2d_nchw.cuda", [["TENSOR", [1, 12, 208, 208], "float32"], ["TENSOR", [24, 12, 3, 3], "float32"], [1, 1], [1, 1, 1, 1], [1, 1], "float32"], {}], "config": {"index": 104261734, "code_hash": null, "entity": [["tile_f", "sp", [-1, 4, 2, 3]], ["tile_y", "sp", [-1, 2, 2, 1]], ["tile_x", "sp", [-1, 1, 26, 2]], ["tile_rc", "sp", [-1, 1]], ["tile_ry", "sp", [-1, 3]], ["tile_rx", "sp", [-1, 3]], ["auto_unroll_max_step", "ot", 1500], ["unroll_explicit", "ot", 0]]}, "result": [[8.458999484058736e-05], 0, 2.5741889476776123, 1674271462.9402995], "version": 0.2, "tvm_version": "0.11.dev0"}
{"input": ["cuda -keys=cuda,gpu -arch=sm_86 -max_num_threads=1024 -thread_warp_size=32", "conv2d_nchw.cuda", [["TENSOR", [1, 12, 208, 208], "float32"], ["TENSOR", [24, 12, 3, 3], "float32"], [1, 1], [1, 1, 1, 1], [1, 1], "float32"], {}], "config": {"index": 218350526, "code_hash": null, "entity": [["tile_f", "sp", [-1, 2, 6, 2]], ["tile_y", "sp", [-1, 1, 2, 4]], ["tile_x", "sp", [-1, 1, 26, 1]], ["tile_rc", "sp", [-1, 2]], ["tile_ry", "sp", [-1, 3]], ["tile_rx", "sp", [-1, 3]], ["auto_unroll_max_step", "ot", 1500], ["unroll_explicit", "ot", 1]]}, "result": [[6.750117042456822e-05], 0, 2.6715381145477295, 1674271465.237511], "version": 0.2, "tvm_version": "0.11.dev0"}
{"input": ["cuda -keys=cuda,gpu -arch=sm_86 -max_num_threads=1024 -thread_warp_size=32", "conv2d_nchw.cuda", [["TENSOR", [1, 12, 208, 208], "float32"], ["TENSOR", [24, 12, 3, 3], "float32"], [1, 1], [1, 1, 1, 1], [1, 1], "float32"], {}], "config": {"index": 105454526, "code_hash": null, "entity": [["tile_f", "sp", [-1, 2, 6, 2]], ["tile_y", "sp", [-1, 1, 2, 4]], ["tile_x", "sp", [-1, 1, 26, 1]], ["tile_rc", "sp", [-1, 2]], ["tile_ry", "sp", [-1, 3]], ["tile_rx", "sp", [-1, 3]], ["auto_unroll_max_step", "ot", 1500], ["unroll_explicit", "ot", 0]]}, "result": [[6.740761649391618e-05], 0, 2.4535648822784424, 1674271467.5254905], "version": 0.2, "tvm_version": "0.11.dev0"}
{"input": ["cuda -keys=cuda,gpu -arch=sm_86 -max_num_threads=1024 -thread_warp_size=32", "conv2d_nchw.cuda", [["TENSOR", [1, 12, 208, 208], "float32"], ["TENSOR", [24, 12, 3, 3], "float32"], [1, 1], [1, 1, 1, 1], [1, 1], "float32"], {}], "config": {"index": 180718526, "code_hash": null, "entity": [["tile_f", "sp", [-1, 2, 6, 2]], ["tile_y", "sp", [-1, 1, 2, 4]], ["tile_x", "sp", [-1, 1, 26, 1]], ["tile_rc", "sp", [-1, 2]], ["tile_ry", "sp", [-1, 3]], ["tile_rx", "sp", [-1, 3]], ["auto_unroll_max_step", "ot", 512], ["unroll_explicit", "ot", 1]]}, "result": [[6.757427852483693e-05], 0, 2.6597795486450195, 1674271469.207353], "version": 0.2, "tvm_version": "0.11.dev0"}
{"input": ["cuda -keys=cuda,gpu -arch=sm_86 -max_num_threads=1024 -thread_warp_size=32", "conv2d_nchw.cuda", [["TENSOR", [1, 12, 208, 208], "float32"], ["TENSOR", [24, 12, 3, 3], "float32"], [1, 1], [1, 1, 1, 1], [1, 1], "float32"], {}], "config": {"index": 67822526, "code_hash": null, "entity": [["tile_f", "sp", [-1, 2, 6, 2]], ["tile_y", "sp", [-1, 1, 2, 4]], ["tile_x", "sp", [-1, 1, 26, 1]], ["tile_rc", "sp", [-1, 2]], ["tile_ry", "sp", [-1, 3]], ["tile_rx", "sp", [-1, 3]], ["auto_unroll_max_step", "ot", 512], ["unroll_explicit", "ot", 0]]}, "result": [[6.761470457725364e-05], 0, 2.50742244720459, 1674271471.543929], "version": 0.2, "tvm_version": "0.11.dev0"}
{"input": ["cuda -keys=cuda,gpu -arch=sm_86 -max_num_threads=1024 -thread_warp_size=32", "conv2d_nchw.cuda", [["TENSOR", [1, 12, 208, 208], "float32"], ["TENSOR", [24, 12, 3, 3], "float32"], [1, 1], [1, 1, 1, 1], [1, 1], "float32"], {}], "config": {"index": 218350524, "code_hash": null, "entity": [["tile_f", "sp", [-1, 3, 4, 2]], ["tile_y", "sp", [-1, 1, 2, 4]], ["tile_x", "sp", [-1, 1, 26, 1]], ["tile_rc", "sp", [-1, 2]], ["tile_ry", "sp", [-1, 3]], ["tile_rx", "sp", [-1, 3]], ["auto_unroll_max_step", "ot", 1500], ["unroll_explicit", "ot", 1]]}, "result": [[7.163612527185733e-05], 0, 2.7946887016296387, 1674271473.1938841], "version": 0.2, "tvm_version": "0.11.dev0"}
{"input": ["cuda -keys=cuda,gpu -arch=sm_86 -max_num_threads=1024 -thread_warp_size=32", "conv2d_nchw.cuda", [["TENSOR", [1, 12, 208, 208], "float32"], ["TENSOR", [24, 12, 3, 3], "float32"], [1, 1], [1, 1, 1, 1], [1, 1], "float32"], {}], "config": {"index": 141849574, "code_hash": null, "entity": [["tile_f", "sp", [-1, 4, 2, 3]], ["tile_y", "sp", [-1, 2, 4, 1]], ["tile_x", "sp", [-1, 1, 13, 2]], ["tile_rc", "sp", [-1, 1]], ["tile_ry", "sp", [-1, 3]], ["tile_rx", "sp", [-1, 3]], ["auto_unroll_max_step", "ot", 0], ["unroll_explicit", "ot", 1]]}, "result": [[9.272687994473532e-05], 0, 2.280103921890259, 1674271474.8248558], "version": 0.2, "tvm_version": "0.11.dev0"}
{"input": ["cuda -keys=cuda,gpu -arch=sm_86 -max_num_threads=1024 -thread_warp_size=32", "conv2d_nchw.cuda", [["TENSOR", [1, 12, 208, 208], "float32"], ["TENSOR", [24, 12, 3, 3], "float32"], [1, 1], [1, 1, 1, 1], [1, 1], "float32"], {}], "config": {"index": 28953574, "code_hash": null, "entity": [["tile_f", "sp", [-1, 4, 2, 3]], ["tile_y", "sp", [-1, 2, 4, 1]], ["tile_x", "sp", [-1, 1, 13, 2]], ["tile_rc", "sp", [-1, 1]], ["tile_ry", "sp", [-1, 3]], ["tile_rx", "sp", [-1, 3]], ["auto_unroll_max_step", "ot", 0], ["unroll_explicit", "ot", 0]]}, "result": [[9.270162602780684e-05], 0, 2.341679573059082, 1674271477.045215], "version": 0.2, "tvm_version": "0.11.dev0"}
{"input": ["cuda -keys=cuda,gpu -arch=sm_86 -max_num_threads=1024 -thread_warp_size=32", "conv2d_nchw.cuda", [["TENSOR", [1, 12, 208, 208], "float32"], ["TENSOR", [24, 12, 3, 3], "float32"], [1, 1], [1, 1, 1, 1], [1, 1], "float32"], {}], "config": {"index": 179148374, "code_hash": null, "entity": [["tile_f", "sp", [-1, 4, 2, 3]], ["tile_y", "sp", [-1, 2, 2, 2]], ["tile_x", "sp", [-1, 1, 26, 1]], ["tile_rc", "sp", [-1, 1]], ["tile_ry", "sp", [-1, 3]], ["tile_rx", "sp", [-1, 3]], ["auto_unroll_max_step", "ot", 512], ["unroll_explicit", "ot", 1]]}, "result": [[8.36144312624992e-05], 0, 2.7876815795898438, 1674271479.333724], "version": 0.2, "tvm_version": "0.11.dev0"}
{"input": ["cuda -keys=cuda,gpu -arch=sm_86 -max_num_threads=1024 -thread_warp_size=32", "conv2d_nchw.cuda", [["TENSOR", [1, 12, 208, 208], "float32"], ["TENSOR", [24, 12, 3, 3], "float32"], [1, 1], [1, 1, 1, 1], [1, 1], "float32"], {}], "config": {"index": 66252374, "code_hash": null, "entity": [["tile_f", "sp", [-1, 4, 2, 3]], ["tile_y", "sp", [-1, 2, 2, 2]], ["tile_x", "sp", [-1, 1, 26, 1]], ["tile_rc", "sp", [-1, 1]], ["tile_ry", "sp", [-1, 3]], ["tile_rx", "sp", [-1, 3]], ["auto_unroll_max_step", "ot", 512], ["unroll_explicit", "ot", 0]]}, "result": [[9.090293970114268e-05], 0, 3.646390199661255, 1674271483.7204695], "version": 0.2, "tvm_version": "0.11.dev0"}
{"input": ["cuda -keys=cuda,gpu -arch=sm_86 -max_num_threads=1024 -thread_warp_size=32", "conv2d_nchw.cuda", [["TENSOR", [1, 12, 208, 208], "float32"], ["TENSOR", [24, 12, 3, 3], "float32"], [1, 1], [1, 1, 1, 1], [1, 1], "float32"], {}], "config": {"index": 216780374, "code_hash": null, "entity": [["tile_f", "sp", [-1, 4, 2, 3]], ["tile_y", "sp", [-1, 2, 2, 2]], ["tile_x", "sp", [-1, 1, 26, 1]], ["tile_rc", "sp", [-1, 1]], ["tile_ry", "sp", [-1, 3]], ["tile_rx", "sp", [-1, 3]], ["auto_unroll_max_step", "ot", 1500], ["unroll_explicit", "ot", 1]]}, "result": [[8.391266785876846e-05], 0, 2.7681403160095215, 1674271485.3371246], "version": 0.2, "tvm_version": "0.11.dev0"}
{"input": ["cuda -keys=cuda,gpu -arch=sm_86 -max_num_threads=1024 -thread_warp_size=32", "conv2d_nchw.cuda", [["TENSOR", [1, 12, 208, 208], "float32"], ["TENSOR", [24, 12, 3, 3], "float32"], [1, 1], [1, 1, 1, 1], [1, 1], "float32"], {}], "config": {"index": 218684366, "code_hash": null, "entity": [["tile_f", "sp", [-1, 2, 6, 2]], ["tile_y", "sp", [-1, 2, 2, 2]], ["tile_x", "sp", [-1, 1, 13, 2]], ["tile_rc", "sp", [-1, 2]], ["tile_ry", "sp", [-1, 3]], ["tile_rx", "sp", [-1, 3]], ["auto_unroll_max_step", "ot", 1500], ["unroll_explicit", "ot", 1]]}, "result": [[7.546081330984315e-05], 0, 2.9869375228881836, 1674271487.6091049], "version": 0.2, "tvm_version": "0.11.dev0"}
{"input": ["cuda -keys=cuda,gpu -arch=sm_86 -max_num_threads=1024 -thread_warp_size=32", "conv2d_nchw.cuda", [["TENSOR", [1, 12, 208, 208], "float32"], ["TENSOR", [24, 12, 3, 3], "float32"], [1, 1], [1, 1, 1, 1], [1, 1], "float32"], {}], "config": {"index": 180718524, "code_hash": null, "entity": [["tile_f", "sp", [-1, 3, 4, 2]], ["tile_y", "sp", [-1, 1, 2, 4]], ["tile_x", "sp", [-1, 1, 26, 1]], ["tile_rc", "sp", [-1, 2]], ["tile_ry", "sp", [-1, 3]], ["tile_rx", "sp", [-1, 3]], ["auto_unroll_max_step", "ot", 512], ["unroll_explicit", "ot", 1]]}, "result": [[7.154868968483135e-05], 0, 2.6213812828063965, 1674271489.086162], "version": 0.2, "tvm_version": "0.11.dev0"}
{"input": ["cuda -keys=cuda,gpu -arch=sm_86 -max_num_threads=1024 -thread_warp_size=32", "conv2d_nchw.cuda", [["TENSOR", [1, 12, 208, 208], "float32"], ["TENSOR", [24, 12, 3, 3], "float32"], [1, 1], [1, 1, 1, 1], [1, 1], "float32"], {}], "config": {"index": 103884374, "code_hash": null, "entity": [["tile_f", "sp", [-1, 4, 2, 3]], ["tile_y", "sp", [-1, 2, 2, 2]], ["tile_x", "sp", [-1, 1, 26, 1]], ["tile_rc", "sp", [-1, 1]], ["tile_ry", "sp", [-1, 3]], ["tile_rx", "sp", [-1, 3]], ["auto_unroll_max_step", "ot", 1500], ["unroll_explicit", "ot", 0]]}, "result": [[8.999172341328805e-05], 0, 2.47115159034729, 1674271491.3130789], "version": 0.2, "tvm_version": "0.11.dev0"}
{"input": ["cuda -keys=cuda,gpu -arch=sm_86 -max_num_threads=1024 -thread_warp_size=32", "conv2d_nchw.cuda", [["TENSOR", [1, 12, 208, 208], "float32"], ["TENSOR", [24, 12, 3, 3], "float32"], [1, 1], [1, 1, 1, 1], [1, 1], "float32"], {}], "config": {"index": 218350522, "code_hash": null, "entity": [["tile_f", "sp", [-1, 4, 3, 2]], ["tile_y", "sp", [-1, 1, 2, 4]], ["tile_x", "sp", [-1, 1, 26, 1]], ["tile_rc", "sp", [-1, 2]], ["tile_ry", "sp", [-1, 3]], ["tile_rx", "sp", [-1, 3]], ["auto_unroll_max_step", "ot", 1500], ["unroll_explicit", "ot", 1]]}, "result": [[6.903961499066418e-05], 0, 2.9853203296661377, 1674271492.9731083], "version": 0.2, "tvm_version": "0.11.dev0"}
{"input": ["cuda -keys=cuda,gpu -arch=sm_86 -max_num_threads=1024 -thread_warp_size=32", "conv2d_nchw.cuda", [["TENSOR", [1, 12, 208, 208], "float32"], ["TENSOR", [24, 12, 3, 3], "float32"], [1, 1], [1, 1, 1, 1], [1, 1], "float32"], {}], "config": {"index": 105454524, "code_hash": null, "entity": [["tile_f", "sp", [-1, 3, 4, 2]], ["tile_y", "sp", [-1, 1, 2, 4]], ["tile_x", "sp", [-1, 1, 26, 1]], ["tile_rc", "sp", [-1, 2]], ["tile_ry", "sp", [-1, 3]], ["tile_rx", "sp", [-1, 3]], ["auto_unroll_max_step", "ot", 1500], ["unroll_explicit", "ot", 0]]}, "result": [[7.1344659191357e-05], 0, 2.492917060852051, 1674271494.6373332], "version": 0.2, "tvm_version": "0.11.dev0"}
{"input": ["cuda -keys=cuda,gpu -arch=sm_86 -max_num_threads=1024 -thread_warp_size=32", "conv2d_nchw.cuda", [["TENSOR", [1, 12, 208, 208], "float32"], ["TENSOR", [24, 12, 3, 3], "float32"], [1, 1], [1, 1, 1, 1], [1, 1], "float32"], {}], "config": {"index": 141893734, "code_hash": null, "entity": [["tile_f", "sp", [-1, 4, 2, 3]], ["tile_y", "sp", [-1, 2, 2, 1]], ["tile_x", "sp", [-1, 1, 26, 2]], ["tile_rc", "sp", [-1, 1]], ["tile_ry", "sp", [-1, 3]], ["tile_rx", "sp", [-1, 3]], ["auto_unroll_max_step", "ot", 0], ["unroll_explicit", "ot", 1]]}, "result": [[9.888018458319923e-05], 0, 2.3473570346832275, 1674271496.831137], "version": 0.2, "tvm_version": "0.11.dev0"}
{"input": ["cuda -keys=cuda,gpu -arch=sm_86 -max_num_threads=1024 -thread_warp_size=32", "conv2d_nchw.cuda", [["TENSOR", [1, 12, 208, 208], "float32"], ["TENSOR", [24, 12, 3, 3], "float32"], [1, 1], [1, 1, 1, 1], [1, 1], "float32"], {}], "config": {"index": 28997734, "code_hash": null, "entity": [["tile_f", "sp", [-1, 4, 2, 3]], ["tile_y", "sp", [-1, 2, 2, 1]], ["tile_x", "sp", [-1, 1, 26, 2]], ["tile_rc", "sp", [-1, 1]], ["tile_ry", "sp", [-1, 3]], ["tile_rx", "sp", [-1, 3]], ["auto_unroll_max_step", "ot", 0], ["unroll_explicit", "ot", 0]]}, "result": [[9.891432741075754e-05], 0, 2.2935948371887207, 1674271498.981295], "version": 0.2, "tvm_version": "0.11.dev0"}
{"input": ["cuda -keys=cuda,gpu -arch=sm_86 -max_num_threads=1024 -thread_warp_size=32", "conv2d_nchw.cuda", [["TENSOR", [1, 12, 208, 208], "float32"], ["TENSOR", [24, 12, 3, 3], "float32"], [1, 1], [1, 1, 1, 1], [1, 1], "float32"], {}], "config": {"index": 105454522, "code_hash": null, "entity": [["tile_f", "sp", [-1, 4, 3, 2]], ["tile_y", "sp", [-1, 1, 2, 4]], ["tile_x", "sp", [-1, 1, 26, 1]], ["tile_rc", "sp", [-1, 2]], ["tile_ry", "sp", [-1, 3]], ["tile_rx", "sp", [-1, 3]], ["auto_unroll_max_step", "ot", 1500], ["unroll_explicit", "ot", 0]]}, "result": [[7.051463375034751e-05], 0, 2.579369306564331, 1674271500.6240153], "version": 0.2, "tvm_version": "0.11.dev0"}
{"input": ["cuda -keys=cuda,gpu -arch=sm_86 -max_num_threads=1024 -thread_warp_size=32", "conv2d_nchw.cuda", [["TENSOR", [1, 12, 208, 208], "float32"], ["TENSOR", [24, 12, 3, 3], "float32"], [1, 1], [1, 1, 1, 1], [1, 1], "float32"], {}], "config": {"index": 181052366, "code_hash": null, "entity": [["tile_f", "sp", [-1, 2, 6, 2]], ["tile_y", "sp", [-1, 2, 2, 2]], ["tile_x", "sp", [-1, 1, 13, 2]], ["tile_rc", "sp", [-1, 2]], ["tile_ry", "sp", [-1, 3]], ["tile_rx", "sp", [-1, 3]], ["auto_unroll_max_step", "ot", 512], ["unroll_explicit", "ot", 1]]}, "result": [[7.546854862913235e-05], 0, 2.7560856342315674, 1674271502.9072778], "version": 0.2, "tvm_version": "0.11.dev0"}
{"input": ["cuda -keys=cuda,gpu -arch=sm_86 -max_num_threads=1024 -thread_warp_size=32", "conv2d_nchw.cuda", [["TENSOR", [1, 12, 208, 208], "float32"], ["TENSOR", [24, 12, 3, 3], "float32"], [1, 1], [1, 1, 1, 1], [1, 1], "float32"], {}], "config": {"index": 105788366, "code_hash": null, "entity": [["tile_f", "sp", [-1, 2, 6, 2]], ["tile_y", "sp", [-1, 2, 2, 2]], ["tile_x", "sp", [-1, 1, 13, 2]], ["tile_rc", "sp", [-1, 2]], ["tile_ry", "sp", [-1, 3]], ["tile_rx", "sp", [-1, 3]], ["auto_unroll_max_step", "ot", 1500], ["unroll_explicit", "ot", 0]]}, "result": [[7.459871505106311e-05], 0, 2.521324872970581, 1674271505.2248507], "version": 0.2, "tvm_version": "0.11.dev0"}
{"input": ["cuda -keys=cuda,gpu -arch=sm_86 -max_num_threads=1024 -thread_warp_size=32", "conv2d_nchw.cuda", [["TENSOR", [1, 12, 208, 208], "float32"], ["TENSOR", [24, 12, 3, 3], "float32"], [1, 1], [1, 1, 1, 1], [1, 1], "float32"], {}], "config": {"index": 179525814, "code_hash": null, "entity": [["tile_f", "sp", [-1, 4, 2, 3]], ["tile_y", "sp", [-1, 4, 2, 1]], ["tile_x", "sp", [-1, 1, 26, 2]], ["tile_rc", "sp", [-1, 1]], ["tile_ry", "sp", [-1, 3]], ["tile_rx", "sp", [-1, 3]], ["auto_unroll_max_step", "ot", 512], ["unroll_explicit", "ot", 1]]}, "result": [[9.279965062974262e-05], 0, 2.7807233333587646, 1674271506.755021], "version": 0.2, "tvm_version": "0.11.dev0"}
{"input": ["cuda -keys=cuda,gpu -arch=sm_86 -max_num_threads=1024 -thread_warp_size=32", "conv2d_nchw.cuda", [["TENSOR", [1, 12, 208, 208], "float32"], ["TENSOR", [24, 12, 3, 3], "float32"], [1, 1], [1, 1, 1, 1], [1, 1], "float32"], {}], "config": {"index": 68156366, "code_hash": null, "entity": [["tile_f", "sp", [-1, 2, 6, 2]], ["tile_y", "sp", [-1, 2, 2, 2]], ["tile_x", "sp", [-1, 1, 13, 2]], ["tile_rc", "sp", [-1, 2]], ["tile_ry", "sp", [-1, 3]], ["tile_rx", "sp", [-1, 3]], ["auto_unroll_max_step", "ot", 512], ["unroll_explicit", "ot", 0]]}, "result": [[7.814911242427842e-05], 0, 2.4214718341827393, 1674271509.0292978], "version": 0.2, "tvm_version": "0.11.dev0"}
{"input": ["cuda -keys=cuda,gpu -arch=sm_86 -max_num_threads=1024 -thread_warp_size=32", "conv2d_nchw.cuda", [["TENSOR", [1, 12, 208, 208], "float32"], ["TENSOR", [24, 12, 3, 3], "float32"], [1, 1], [1, 1, 1, 1], [1, 1], "float32"], {}], "config": {"index": 180718522, "code_hash": null, "entity": [["tile_f", "sp", [-1, 4, 3, 2]], ["tile_y", "sp", [-1, 1, 2, 4]], ["tile_x", "sp", [-1, 1, 26, 1]], ["tile_rc", "sp", [-1, 2]], ["tile_ry", "sp", [-1, 3]], ["tile_rx", "sp", [-1, 3]], ["auto_unroll_max_step", "ot", 512], ["unroll_explicit", "ot", 1]]}, "result": [[7.654378716660687e-05], 0, 2.781541109085083, 1674271510.6482606], "version": 0.2, "tvm_version": "0.11.dev0"}
{"input": ["cuda -keys=cuda,gpu -arch=sm_86 -max_num_threads=1024 -thread_warp_size=32", "conv2d_nchw.cuda", [["TENSOR", [1, 12, 208, 208], "float32"], ["TENSOR", [24, 12, 3, 3], "float32"], [1, 1], [1, 1, 1, 1], [1, 1], "float32"], {}], "config": {"index": 143086526, "code_hash": null, "entity": [["tile_f", "sp", [-1, 2, 6, 2]], ["tile_y", "sp", [-1, 1, 2, 4]], ["tile_x", "sp", [-1, 1, 26, 1]], ["tile_rc", "sp", [-1, 2]], ["tile_ry", "sp", [-1, 3]], ["tile_rx", "sp", [-1, 3]], ["auto_unroll_max_step", "ot", 0], ["unroll_explicit", "ot", 1]]}, "result": [[8.350738254640184e-05], 0, 2.2979166507720947, 1674271512.2722478], "version": 0.2, "tvm_version": "0.11.dev0"}
{"input": ["cuda -keys=cuda,gpu -arch=sm_86 -max_num_threads=1024 -thread_warp_size=32", "conv2d_nchw.cuda", [["TENSOR", [1, 12, 208, 208], "float32"], ["TENSOR", [24, 12, 3, 3], "float32"], [1, 1], [1, 1, 1, 1], [1, 1], "float32"], {}], "config": {"index": 217157814, "code_hash": null, "entity": [["tile_f", "sp", [-1, 4, 2, 3]], ["tile_y", "sp", [-1, 4, 2, 1]], ["tile_x", "sp", [-1, 1, 26, 2]], ["tile_rc", "sp", [-1, 1]], ["tile_ry", "sp", [-1, 3]], ["tile_rx", "sp", [-1, 3]], ["auto_unroll_max_step", "ot", 1500], ["unroll_explicit", "ot", 1]]}, "result": [[8.770936972187482e-05], 0, 4.61062479019165, 1674271517.4537237], "version": 0.2, "tvm_version": "0.11.dev0"}
{"input": ["cuda -keys=cuda,gpu -arch=sm_86 -max_num_threads=1024 -thread_warp_size=32", "conv2d_nchw.cuda", [["TENSOR", [1, 12, 208, 208], "float32"], ["TENSOR", [24, 12, 3, 3], "float32"], [1, 1], [1, 1, 1, 1], [1, 1], "float32"], {}], "config": {"index": 103886522, "code_hash": null, "entity": [["tile_f", "sp", [-1, 4, 3, 2]], ["tile_y", "sp", [-1, 1, 2, 4]], ["tile_x", "sp", [-1, 1, 26, 1]], ["tile_rc", "sp", [-1, 1]], ["tile_ry", "sp", [-1, 3]], ["tile_rx", "sp", [-1, 3]], ["auto_unroll_max_step", "ot", 1500], ["unroll_explicit", "ot", 0]]}, "result": [[6.922023842359306e-05], 0, 2.311192035675049, 1674271519.1107855], "version": 0.2, "tvm_version": "0.11.dev0"}
{"input": ["cuda -keys=cuda,gpu -arch=sm_86 -max_num_threads=1024 -thread_warp_size=32", "conv2d_nchw.cuda", [["TENSOR", [1, 12, 208, 208], "float32"], ["TENSOR", [24, 12, 3, 3], "float32"], [1, 1], [1, 1, 1, 1], [1, 1], "float32"], {}], "config": {"index": 30190526, "code_hash": null, "entity": [["tile_f", "sp", [-1, 2, 6, 2]], ["tile_y", "sp", [-1, 1, 2, 4]], ["tile_x", "sp", [-1, 1, 26, 1]], ["tile_rc", "sp", [-1, 2]], ["tile_ry", "sp", [-1, 3]], ["tile_rx", "sp", [-1, 3]], ["auto_unroll_max_step", "ot", 0], ["unroll_explicit", "ot", 0]]}, "result": [[8.358485051043632e-05], 0, 2.1312179565429688, 1674271520.7322965], "version": 0.2, "tvm_version": "0.11.dev0"}
{"input": ["cuda -keys=cuda,gpu -arch=sm_86 -max_num_threads=1024 -thread_warp_size=32", "conv2d_nchw.cuda", [["TENSOR", [1, 12, 208, 208], "float32"], ["TENSOR", [24, 12, 3, 3], "float32"], [1, 1], [1, 1, 1, 1], [1, 1], "float32"], {}], "config": {"index": 179525825, "code_hash": null, "entity": [["tile_f", "sp", [-1, 2, 3, 4]], ["tile_y", "sp", [-1, 4, 2, 1]], ["tile_x", "sp", [-1, 1, 26, 2]], ["tile_rc", "sp", [-1, 1]], ["tile_ry", "sp", [-1, 3]], ["tile_rx", "sp", [-1, 3]], ["auto_unroll_max_step", "ot", 512], ["unroll_explicit", "ot", 1]]}, "result": [[8.66675627533295e-05], 0, 2.580728054046631, 1674271522.2791572], "version": 0.2, "tvm_version": "0.11.dev0"}
{"input": ["cuda -keys=cuda,gpu -arch=sm_86 -max_num_threads=1024 -thread_warp_size=32", "conv2d_nchw.cuda", [["TENSOR", [1, 12, 208, 208], "float32"], ["TENSOR", [24, 12, 3, 3], "float32"], [1, 1], [1, 1, 1, 1], [1, 1], "float32"], {}], "config": {"index": 209519322, "code_hash": null, "entity": [["tile_f", "sp", [-1, 4, 3, 2]], ["tile_y", "sp", [-1, 2, 2, 1]], ["tile_x", "sp", [-1, 1, 13, 4]], ["tile_rc", "sp", [-1, 2]], ["tile_ry", "sp", [-1, 1]], ["tile_rx", "sp", [-1, 3]], ["auto_unroll_max_step", "ot", 1500], ["unroll_explicit", "ot", 1]]}, "result": [[0.0001019486260862157], 0, 3.8216054439544678, 1674271523.825502], "version": 0.2, "tvm_version": "0.11.dev0"}
{"input": ["cuda -keys=cuda,gpu -arch=sm_86 -max_num_threads=1024 -thread_warp_size=32", "conv2d_nchw.cuda", [["TENSOR", [1, 12, 208, 208], "float32"], ["TENSOR", [24, 12, 3, 3], "float32"], [1, 1], [1, 1, 1, 1], [1, 1], "float32"], {}], "config": {"index": 179761562, "code_hash": null, "entity": [["tile_f", "sp", [-1, 4, 3, 2]], ["tile_y", "sp", [-1, 2, 4, 1]], ["tile_x", "sp", [-1, 1, 26, 4]], ["tile_rc", "sp", [-1, 1]], ["tile_ry", "sp", [-1, 3]], ["tile_rx", "sp", [-1, 3]], ["auto_unroll_max_step", "ot", 512], ["unroll_explicit", "ot", 1]]}, "result": [[0.00010312028513761467], 0, 2.5648903846740723, 1674271525.3055983], "version": 0.2, "tvm_version": "0.11.dev0"}
{"input": ["cuda -keys=cuda,gpu -arch=sm_86 -max_num_threads=1024 -thread_warp_size=32", "conv2d_nchw.cuda", [["TENSOR", [1, 12, 208, 208], "float32"], ["TENSOR", [24, 12, 3, 3], "float32"], [1, 1], [1, 1, 1, 1], [1, 1], "float32"], {}], "config": {"index": 218684367, "code_hash": null, "entity": [["tile_f", "sp", [-1, 1, 12, 2]], ["tile_y", "sp", [-1, 2, 2, 2]], ["tile_x", "sp", [-1, 1, 13, 2]], ["tile_rc", "sp", [-1, 2]], ["tile_ry", "sp", [-1, 3]], ["tile_rx", "sp", [-1, 3]], ["auto_unroll_max_step", "ot", 1500], ["unroll_explicit", "ot", 1]]}, "result": [[7.730705901545508e-05], 0, 2.5677855014801025, 1674271526.984694], "version": 0.2, "tvm_version": "0.11.dev0"}
{"input": ["cuda -keys=cuda,gpu -arch=sm_86 -max_num_threads=1024 -thread_warp_size=32", "conv2d_nchw.cuda", [["TENSOR", [1, 12, 208, 208], "float32"], ["TENSOR", [24, 12, 3, 3], "float32"], [1, 1], [1, 1, 1, 1], [1, 1], "float32"], {}], "config": {"index": 171887322, "code_hash": null, "entity": [["tile_f", "sp", [-1, 4, 3, 2]], ["tile_y", "sp", [-1, 2, 2, 1]], ["tile_x", "sp", [-1, 1, 13, 4]], ["tile_rc", "sp", [-1, 2]], ["tile_ry", "sp", [-1, 1]], ["tile_rx", "sp", [-1, 3]], ["auto_unroll_max_step", "ot", 512], ["unroll_explicit", "ot", 1]]}, "result": [[0.00010738804703217035], 0, 2.809589385986328, 1674271528.5270073], "version": 0.2, "tvm_version": "0.11.dev0"}
{"input": ["cuda -keys=cuda,gpu -arch=sm_86 -max_num_threads=1024 -thread_warp_size=32", "conv2d_nchw.cuda", [["TENSOR", [1, 12, 208, 208], "float32"], ["TENSOR", [24, 12, 3, 3], "float32"], [1, 1], [1, 1, 1, 1], [1, 1], "float32"], {}], "config": {"index": 66629814, "code_hash": null, "entity": [["tile_f", "sp", [-1, 4, 2, 3]], ["tile_y", "sp", [-1, 4, 2, 1]], ["tile_x", "sp", [-1, 1, 26, 2]], ["tile_rc", "sp", [-1, 1]], ["tile_ry", "sp", [-1, 3]], ["tile_rx", "sp", [-1, 3]], ["auto_unroll_max_step", "ot", 512], ["unroll_explicit", "ot", 0]]}, "result": [[9.921292321383166e-05], 0, 2.4451658725738525, 1674271530.0319662], "version": 0.2, "tvm_version": "0.11.dev0"}
{"input": ["cuda -keys=cuda,gpu -arch=sm_86 -max_num_threads=1024 -thread_warp_size=32", "conv2d_nchw.cuda", [["TENSOR", [1, 12, 208, 208], "float32"], ["TENSOR", [24, 12, 3, 3], "float32"], [1, 1], [1, 1, 1, 1], [1, 1], "float32"], {}], "config": {"index": 179481016, "code_hash": null, "entity": [["tile_f", "sp", [-1, 2, 4, 3]], ["tile_y", "sp", [-1, 4, 2, 1]], ["tile_x", "sp", [-1, 1, 13, 2]], ["tile_rc", "sp", [-1, 1]], ["tile_ry", "sp", [-1, 3]], ["tile_rx", "sp", [-1, 3]], ["auto_unroll_max_step", "ot", 512], ["unroll_explicit", "ot", 1]]}, "result": [[8.108121442590775e-05], 0, 2.9251043796539307, 1674271531.7012234], "version": 0.2, "tvm_version": "0.11.dev0"}
{"input": ["cuda -keys=cuda,gpu -arch=sm_86 -max_num_threads=1024 -thread_warp_size=32", "conv2d_nchw.cuda", [["TENSOR", [1, 12, 208, 208], "float32"], ["TENSOR", [24, 12, 3, 3], "float32"], [1, 1], [1, 1, 1, 1], [1, 1], "float32"], {}], "config": {"index": 67822522, "code_hash": null, "entity": [["tile_f", "sp", [-1, 4, 3, 2]], ["tile_y", "sp", [-1, 1, 2, 4]], ["tile_x", "sp", [-1, 1, 26, 1]], ["tile_rc", "sp", [-1, 2]], ["tile_ry", "sp", [-1, 3]], ["tile_rx", "sp", [-1, 3]], ["auto_unroll_max_step", "ot", 512], ["unroll_explicit", "ot", 0]]}, "result": [[7.854522630885348e-05], 0, 2.440032720565796, 1674271533.3510706], "version": 0.2, "tvm_version": "0.11.dev0"}
{"input": ["cuda -keys=cuda,gpu -arch=sm_86 -max_num_threads=1024 -thread_warp_size=32", "conv2d_nchw.cuda", [["TENSOR", [1, 12, 208, 208], "float32"], ["TENSOR", [24, 12, 3, 3], "float32"], [1, 1], [1, 1, 1, 1], [1, 1], "float32"], {}], "config": {"index": 66629825, "code_hash": null, "entity": [["tile_f", "sp", [-1, 2, 3, 4]], ["tile_y", "sp", [-1, 4, 2, 1]], ["tile_x", "sp", [-1, 1, 26, 2]], ["tile_rc", "sp", [-1, 1]], ["tile_ry", "sp", [-1, 3]], ["tile_rx", "sp", [-1, 3]], ["auto_unroll_max_step", "ot", 512], ["unroll_explicit", "ot", 0]]}, "result": [[9.058888378316385e-05], 0, 2.3101282119750977, 1674271534.8771868], "version": 0.2, "tvm_version": "0.11.dev0"}
{"input": ["cuda -keys=cuda,gpu -arch=sm_86 -max_num_threads=1024 -thread_warp_size=32", "conv2d_nchw.cuda", [["TENSOR", [1, 12, 208, 208], "float32"], ["TENSOR", [24, 12, 3, 3], "float32"], [1, 1], [1, 1, 1, 1], [1, 1], "float32"], {}], "config": {"index": 217157825, "code_hash": null, "entity": [["tile_f", "sp", [-1, 2, 3, 4]], ["tile_y", "sp", [-1, 4, 2, 1]], ["tile_x", "sp", [-1, 1, 26, 2]], ["tile_rc", "sp", [-1, 1]], ["tile_ry", "sp", [-1, 3]], ["tile_rx", "sp", [-1, 3]], ["auto_unroll_max_step", "ot", 1500], ["unroll_explicit", "ot", 1]]}, "result": [[8.270337387199777e-05], 0, 2.9842824935913086, 1674271536.396391], "version": 0.2, "tvm_version": "0.11.dev0"}
{"input": ["cuda -keys=cuda,gpu -arch=sm_86 -max_num_threads=1024 -thread_warp_size=32", "conv2d_nchw.cuda", [["TENSOR", [1, 12, 208, 208], "float32"], ["TENSOR", [24, 12, 3, 3], "float32"], [1, 1], [1, 1, 1, 1], [1, 1], "float32"], {}], "config": {"index": 66865562, "code_hash": null, "entity": [["tile_f", "sp", [-1, 4, 3, 2]], ["tile_y", "sp", [-1, 2, 4, 1]], ["tile_x", "sp", [-1, 1, 26, 4]], ["tile_rc", "sp", [-1, 1]], ["tile_ry", "sp", [-1, 3]], ["tile_rx", "sp", [-1, 3]], ["auto_unroll_max_step", "ot", 512], ["unroll_explicit", "ot", 0]]}, "result": [[0.00010730150841543515], 0, 2.1211326122283936, 1674271537.794417], "version": 0.2, "tvm_version": "0.11.dev0"}
{"input": ["cuda -keys=cuda,gpu -arch=sm_86 -max_num_threads=1024 -thread_warp_size=32", "conv2d_nchw.cuda", [["TENSOR", [1, 12, 208, 208], "float32"], ["TENSOR", [24, 12, 3, 3], "float32"], [1, 1], [1, 1, 1, 1], [1, 1], "float32"], {}], "config": {"index": 217393562, "code_hash": null, "entity": [["tile_f", "sp", [-1, 4, 3, 2]], ["tile_y", "sp", [-1, 2, 4, 1]], ["tile_x", "sp", [-1, 1, 26, 4]], ["tile_rc", "sp", [-1, 1]], ["tile_ry", "sp", [-1, 3]], ["tile_rx", "sp", [-1, 3]], ["auto_unroll_max_step", "ot", 1500], ["unroll_explicit", "ot", 1]]}, "result": [[9.632354086879435e-05], 0, 2.8693530559539795, 1674271539.2048159], "version": 0.2, "tvm_version": "0.11.dev0"}
{"input": ["cuda -keys=cuda,gpu -arch=sm_86 -max_num_threads=1024 -thread_warp_size=32", "conv2d_nchw.cuda", [["TENSOR", [1, 12, 208, 208], "float32"], ["TENSOR", [24, 12, 3, 3], "float32"], [1, 1], [1, 1, 1, 1], [1, 1], "float32"], {}], "config": {"index": 218328122, "code_hash": null, "entity": [["tile_f", "sp", [-1, 4, 3, 2]], ["tile_y", "sp", [-1, 1, 2, 4]], ["tile_x", "sp", [-1, 1, 16, 1]], ["tile_rc", "sp", [-1, 2]], ["tile_ry", "sp", [-1, 3]], ["tile_rx", "sp", [-1, 3]], ["auto_unroll_max_step", "ot", 1500], ["unroll_explicit", "ot", 1]]}, "result": [[6.348264505525914e-05], 0, 3.080214023590088, 1674271540.8897433], "version": 0.2, "tvm_version": "0.11.dev0"}
{"input": ["cuda -keys=cuda,gpu -arch=sm_86 -max_num_threads=1024 -thread_warp_size=32", "conv2d_nchw.cuda", [["TENSOR", [1, 12, 208, 208], "float32"], ["TENSOR", [24, 12, 3, 3], "float32"], [1, 1], [1, 1, 1, 1], [1, 1], "float32"], {}], "config": {"index": 179481025, "code_hash": null, "entity": [["tile_f", "sp", [-1, 2, 3, 4]], ["tile_y", "sp", [-1, 4, 2, 1]], ["tile_x", "sp", [-1, 1, 13, 2]], ["tile_rc", "sp", [-1, 1]], ["tile_ry", "sp", [-1, 3]], ["tile_rx", "sp", [-1, 3]], ["auto_unroll_max_step", "ot", 512], ["unroll_explicit", "ot", 1]]}, "result": [[9.128450404487748e-05], 0, 3.790083885192871, 1674271545.8682387], "version": 0.2, "tvm_version": "0.11.dev0"}
{"input": ["cuda -keys=cuda,gpu -arch=sm_86 -max_num_threads=1024 -thread_warp_size=32", "conv2d_nchw.cuda", [["TENSOR", [1, 12, 208, 208], "float32"], ["TENSOR", [24, 12, 3, 3], "float32"], [1, 1], [1, 1, 1, 1], [1, 1], "float32"], {}], "config": {"index": 104261814, "code_hash": null, "entity": [["tile_f", "sp", [-1, 4, 2, 3]], ["tile_y", "sp", [-1, 4, 2, 1]], ["tile_x", "sp", [-1, 1, 26, 2]], ["tile_rc", "sp", [-1, 1]], ["tile_ry", "sp", [-1, 3]], ["tile_rx", "sp", [-1, 3]], ["auto_unroll_max_step", "ot", 1500], ["unroll_explicit", "ot", 0]]}, "result": [[8.940617904191618e-05], 0, 2.627936601638794, 1674271547.4296787], "version": 0.2, "tvm_version": "0.11.dev0"}
{"input": ["cuda -keys=cuda,gpu -arch=sm_86 -max_num_threads=1024 -thread_warp_size=32", "conv2d_nchw.cuda", [["TENSOR", [1, 12, 208, 208], "float32"], ["TENSOR", [24, 12, 3, 3], "float32"], [1, 1], [1, 1, 1, 1], [1, 1], "float32"], {}], "config": {"index": 105432122, "code_hash": null, "entity": [["tile_f", "sp", [-1, 4, 3, 2]], ["tile_y", "sp", [-1, 1, 2, 4]], ["tile_x", "sp", [-1, 1, 16, 1]], ["tile_rc", "sp", [-1, 2]], ["tile_ry", "sp", [-1, 3]], ["tile_rx", "sp", [-1, 3]], ["auto_unroll_max_step", "ot", 1500], ["unroll_explicit", "ot", 0]]}, "result": [[6.517458730314478e-05], 0, 2.491849422454834, 1674271549.1153364], "version": 0.2, "tvm_version": "0.11.dev0"}
{"input": ["cuda -keys=cuda,gpu -arch=sm_86 -max_num_threads=1024 -thread_warp_size=32", "conv2d_nchw.cuda", [["TENSOR", [1, 12, 208, 208], "float32"], ["TENSOR", [24, 12, 3, 3], "float32"], [1, 1], [1, 1, 1, 1], [1, 1], "float32"], {}], "config": {"index": 104261825, "code_hash": null, "entity": [["tile_f", "sp", [-1, 2, 3, 4]], ["tile_y", "sp", [-1, 4, 2, 1]], ["tile_x", "sp", [-1, 1, 26, 2]], ["tile_rc", "sp", [-1, 1]], ["tile_ry", "sp", [-1, 3]], ["tile_rx", "sp", [-1, 3]], ["auto_unroll_max_step", "ot", 1500], ["unroll_explicit", "ot", 0]]}, "result": [[8.403216784452297e-05], 0, 2.452732801437378, 1674271550.6302612], "version": 0.2, "tvm_version": "0.11.dev0"}
{"input": ["cuda -keys=cuda,gpu -arch=sm_86 -max_num_threads=1024 -thread_warp_size=32", "conv2d_nchw.cuda", [["TENSOR", [1, 12, 208, 208], "float32"], ["TENSOR", [24, 12, 3, 3], "float32"], [1, 1], [1, 1, 1, 1], [1, 1], "float32"], {}], "config": {"index": 66864842, "code_hash": null, "entity": [["tile_f", "sp", [-1, 4, 3, 2]], ["tile_y", "sp", [-1, 1, 2, 1]], ["tile_x", "sp", [-1, 1, 26, 4]], ["tile_rc", "sp", [-1, 1]], ["tile_ry", "sp", [-1, 3]], ["tile_rx", "sp", [-1, 3]], ["auto_unroll_max_step", "ot", 512], ["unroll_explicit", "ot", 0]]}, "result": [[8.202111861082996e-05], 0, 2.3342814445495605, 1674271552.2574282], "version": 0.2, "tvm_version": "0.11.dev0"}
{"input": ["cuda -keys=cuda,gpu -arch=sm_86 -max_num_threads=1024 -thread_warp_size=32", "conv2d_nchw.cuda", [["TENSOR", [1, 12, 208, 208], "float32"], ["TENSOR", [24, 12, 3, 3], "float32"], [1, 1], [1, 1, 1, 1], [1, 1], "float32"], {}], "config": {"index": 96623322, "code_hash": null, "entity": [["tile_f", "sp", [-1, 4, 3, 2]], ["tile_y", "sp", [-1, 2, 2, 1]], ["tile_x", "sp", [-1, 1, 13, 4]], ["tile_rc", "sp", [-1, 2]], ["tile_ry", "sp", [-1, 1]], ["tile_rx", "sp", [-1, 3]], ["auto_unroll_max_step", "ot", 1500], ["unroll_explicit", "ot", 0]]}, "result": [[0.00010180238678846317], 0, 2.4999523162841797, 1674271553.8184326], "version": 0.2, "tvm_version": "0.11.dev0"}
{"input": ["cuda -keys=cuda,gpu -arch=sm_86 -max_num_threads=1024 -thread_warp_size=32", "conv2d_nchw.cuda", [["TENSOR", [1, 12, 208, 208], "float32"], ["TENSOR", [24, 12, 3, 3], "float32"], [1, 1], [1, 1, 1, 1], [1, 1], "float32"], {}], "config": {"index": 104497562, "code_hash": null, "entity": [["tile_f", "sp", [-1, 4, 3, 2]], ["tile_y", "sp", [-1, 2, 4, 1]], ["tile_x", "sp", [-1, 1, 26, 4]], ["tile_rc", "sp", [-1, 1]], ["tile_ry", "sp", [-1, 3]], ["tile_rx", "sp", [-1, 3]], ["auto_unroll_max_step", "ot", 1500], ["unroll_explicit", "ot", 0]]}, "result": [[9.904801476463436e-05], 0, 2.3365039825439453, 1674271555.2928474], "version": 0.2, "tvm_version": "0.11.dev0"}
{"input": ["cuda -keys=cuda,gpu -arch=sm_86 -max_num_threads=1024 -thread_warp_size=32", "conv2d_nchw.cuda", [["TENSOR", [1, 12, 208, 208], "float32"], ["TENSOR", [24, 12, 3, 3], "float32"], [1, 1], [1, 1, 1, 1], [1, 1], "float32"], {}], "config": {"index": 217113025, "code_hash": null, "entity": [["tile_f", "sp", [-1, 2, 3, 4]], ["tile_y", "sp", [-1, 4, 2, 1]], ["tile_x", "sp", [-1, 1, 13, 2]], ["tile_rc", "sp", [-1, 1]], ["tile_ry", "sp", [-1, 3]], ["tile_rx", "sp", [-1, 3]], ["auto_unroll_max_step", "ot", 1500], ["unroll_explicit", "ot", 1]]}, "result": [[8.208732397269096e-05], 0, 2.9111649990081787, 1674271556.906985], "version": 0.2, "tvm_version": "0.11.dev0"}
{"input": ["cuda -keys=cuda,gpu -arch=sm_86 -max_num_threads=1024 -thread_warp_size=32", "conv2d_nchw.cuda", [["TENSOR", [1, 12, 208, 208], "float32"], ["TENSOR", [24, 12, 3, 3], "float32"], [1, 1], [1, 1, 1, 1], [1, 1], "float32"], {}], "config": {"index": 181052367, "code_hash": null, "entity": [["tile_f", "sp", [-1, 1, 12, 2]], ["tile_y", "sp", [-1, 2, 2, 2]], ["tile_x", "sp", [-1, 1, 13, 2]], ["tile_rc", "sp", [-1, 2]], ["tile_ry", "sp", [-1, 3]], ["tile_rx", "sp", [-1, 3]], ["auto_unroll_max_step", "ot", 512], ["unroll_explicit", "ot", 1]]}, "result": [[7.739702231225749e-05], 0, 2.5432188510894775, 1674271558.608414], "version": 0.2, "tvm_version": "0.11.dev0"}
{"input": ["cuda -keys=cuda,gpu -arch=sm_86 -max_num_threads=1024 -thread_warp_size=32", "conv2d_nchw.cuda", [["TENSOR", [1, 12, 208, 208], "float32"], ["TENSOR", [24, 12, 3, 3], "float32"], [1, 1], [1, 1, 1, 1], [1, 1], "float32"], {}], "config": {"index": 179727336, "code_hash": null, "entity": [["tile_f", "sp", [-1, 2, 4, 3]], ["tile_y", "sp", [-1, 2, 2, 1]], ["tile_x", "sp", [-1, 1, 13, 4]], ["tile_rc", "sp", [-1, 1]], ["tile_ry", "sp", [-1, 3]], ["tile_rx", "sp", [-1, 3]], ["auto_unroll_max_step", "ot", 512], ["unroll_explicit", "ot", 1]]}, "result": [[9.089116482891086e-05], 0, 2.7290709018707275, 1674271560.229073], "version": 0.2, "tvm_version": "0.11.dev0"}
{"input": ["cuda -keys=cuda,gpu -arch=sm_86 -max_num_threads=1024 -thread_warp_size=32", "conv2d_nchw.cuda", [["TENSOR", [1, 12, 208, 208], "float32"], ["TENSOR", [24, 12, 3, 3], "float32"], [1, 1], [1, 1, 1, 1], [1, 1], "float32"], {}], "config": {"index": 141516374, "code_hash": null, "entity": [["tile_f", "sp", [-1, 4, 2, 3]], ["tile_y", "sp", [-1, 2, 2, 2]], ["tile_x", "sp", [-1, 1, 26, 1]], ["tile_rc", "sp", [-1, 1]], ["tile_ry", "sp", [-1, 3]], ["tile_rx", "sp", [-1, 3]], ["auto_unroll_max_step", "ot", 0], ["unroll_explicit", "ot", 1]]}, "result": [[9.647834378585088e-05], 0, 2.293748140335083, 1674271561.8316607], "version": 0.2, "tvm_version": "0.11.dev0"}
{"input": ["cuda -keys=cuda,gpu -arch=sm_86 -max_num_threads=1024 -thread_warp_size=32", "conv2d_nchw.cuda", [["TENSOR", [1, 12, 208, 208], "float32"], ["TENSOR", [24, 12, 3, 3], "float32"], [1, 1], [1, 1, 1, 1], [1, 1], "float32"], {}], "config": {"index": 28620374, "code_hash": null, "entity": [["tile_f", "sp", [-1, 4, 2, 3]], ["tile_y", "sp", [-1, 2, 2, 2]], ["tile_x", "sp", [-1, 1, 26, 1]], ["tile_rc", "sp", [-1, 1]], ["tile_ry", "sp", [-1, 3]], ["tile_rx", "sp", [-1, 3]], ["auto_unroll_max_step", "ot", 0], ["unroll_explicit", "ot", 0]]}, "result": [[9.650976054286154e-05], 0, 2.1971259117126465, 1674271563.4282818], "version": 0.2, "tvm_version": "0.11.dev0"}
{"input": ["cuda -keys=cuda,gpu -arch=sm_86 -max_num_threads=1024 -thread_warp_size=32", "conv2d_nchw.cuda", [["TENSOR", [1, 12, 208, 208], "float32"], ["TENSOR", [24, 12, 3, 3], "float32"], [1, 1], [1, 1, 1, 1], [1, 1], "float32"], {}], "config": {"index": 218272122, "code_hash": null, "entity": [["tile_f", "sp", [-1, 4, 3, 2]], ["tile_y", "sp", [-1, 1, 2, 4]], ["tile_x", "sp", [-1, 1, 13, 1]], ["tile_rc", "sp", [-1, 2]], ["tile_ry", "sp", [-1, 3]], ["tile_rx", "sp", [-1, 3]], ["auto_unroll_max_step", "ot", 1500], ["unroll_explicit", "ot", 1]]}, "result": [[7.264154239983585e-05], 0, 2.9721572399139404, 1674271565.1656575], "version": 0.2, "tvm_version": "0.11.dev0"}
{"input": ["cuda -keys=cuda,gpu -arch=sm_86 -max_num_threads=1024 -thread_warp_size=32", "conv2d_nchw.cuda", [["TENSOR", [1, 12, 208, 208], "float32"], ["TENSOR", [24, 12, 3, 3], "float32"], [1, 1], [1, 1, 1, 1], [1, 1], "float32"], {}], "config": {"index": 13134185, "code_hash": null, "entity": [["tile_f", "sp", [-1, 1, 8, 1]], ["tile_y", "sp", [-1, 1, 2, 8]], ["tile_x", "sp", [-1, 104, 1, 2]], ["tile_rc", "sp", [-1, 3]], ["tile_ry", "sp", [-1, 3]], ["tile_rx", "sp", [-1, 1]], ["auto_unroll_max_step", "ot", 0], ["unroll_explicit", "ot", 0]]}, "result": [[0.006600372707792207], 0, 3.267124652862549, 1674271566.578741], "version": 0.2, "tvm_version": "0.11.dev0"}
{"input": ["cuda -keys=cuda,gpu -arch=sm_86 -max_num_threads=1024 -thread_warp_size=32", "conv2d_nchw.cuda", [["TENSOR", [1, 12, 208, 208], "float32"], ["TENSOR", [24, 12, 3, 3], "float32"], [1, 1], [1, 1, 1, 1], [1, 1], "float32"], {}], "config": {"index": 180693976, "code_hash": null, "entity": [["tile_f", "sp", [-1, 2, 4, 3]], ["tile_y", "sp", [-1, 2, 2, 2]], ["tile_x", "sp", [-1, 1, 16, 1]], ["tile_rc", "sp", [-1, 2]], ["tile_ry", "sp", [-1, 3]], ["tile_rx", "sp", [-1, 3]], ["auto_unroll_max_step", "ot", 512], ["unroll_explicit", "ot", 1]]}, "result": [[6.350513195312037e-05], 0, 1.9921767711639404, 1674271759.783466], "version": 0.2, "tvm_version": "0.11.dev0"}
{"input": ["cuda -keys=cuda,gpu -arch=sm_86 -max_num_threads=1024 -thread_warp_size=32", "conv2d_nchw.cuda", [["TENSOR", [1, 12, 208, 208], "float32"], ["TENSOR", [24, 12, 3, 3], "float32"], [1, 1], [1, 1, 1, 1], [1, 1], "float32"], {}], "config": {"index": 67797976, "code_hash": null, "entity": [["tile_f", "sp", [-1, 2, 4, 3]], ["tile_y", "sp", [-1, 2, 2, 2]], ["tile_x", "sp", [-1, 1, 16, 1]], ["tile_rc", "sp", [-1, 2]], ["tile_ry", "sp", [-1, 3]], ["tile_rx", "sp", [-1, 3]], ["auto_unroll_max_step", "ot", 512], ["unroll_explicit", "ot", 0]]}, "result": [[6.371419673395327e-05], 0, 2.077768325805664, 1674271761.5321524], "version": 0.2, "tvm_version": "0.11.dev0"}
{"input": ["cuda -keys=cuda,gpu -arch=sm_86 -max_num_threads=1024 -thread_warp_size=32", "conv2d_nchw_winograd.cuda", [["TENSOR", [1, 12, 208, 208], "float32"], ["TENSOR", [24, 12, 3, 3], "float32"], [1, 1], [1, 1, 1, 1], [1, 1], "float32"], {}], "config": {"index": 133578, "code_hash": null, "entity": [["tile_b", "sp", [-1, 1, 1, 1]], ["tile_y", "sp", [-1, 1, 1, 4]], ["tile_x", "sp", [-1, 1, 4, 26]], ["tile_rc", "sp", [-1, 6]], ["auto_unroll_max_step", "ot", 0], ["unroll_explicit", "ot", 0]]}, "result": [[0.00031224851105651107], 0, 8.321065902709961, 1674271784.0930715], "version": 0.2, "tvm_version": "0.11.dev0"}
{"input": ["cuda -keys=cuda,gpu -arch=sm_86 -max_num_threads=1024 -thread_warp_size=32", "conv2d_nchw_winograd.cuda", [["TENSOR", [1, 12, 208, 208], "float32"], ["TENSOR", [24, 12, 3, 3], "float32"], [1, 1], [1, 1, 1, 1], [1, 1], "float32"], {}], "config": {"index": 83600, "code_hash": null, "entity": [["tile_b", "sp", [-1, 1, 1, 1]], ["tile_y", "sp", [-1, 1, 1, 1]], ["tile_x", "sp", [-1, 1, 4, 676]], ["tile_rc", "sp", [-1, 3]], ["auto_unroll_max_step", "ot", 0], ["unroll_explicit", "ot", 0]]}, "result": [[0.0027356546535433073], 0, 7.222369194030762, 1674271785.527248], "version": 0.2, "tvm_version": "0.11.dev0"}
{"input": ["cuda -keys=cuda,gpu -arch=sm_86 -max_num_threads=1024 -thread_warp_size=32", "conv2d_nchw_winograd.cuda", [["TENSOR", [1, 12, 208, 208], "float32"], ["TENSOR", [24, 12, 3, 3], "float32"], [1, 1], [1, 1, 1, 1], [1, 1], "float32"], {}], "config": {"index": 743515, "code_hash": null, "entity": [["tile_b", "sp", [-1, 1, 1, 1]], ["tile_y", "sp", [-1, 1, 3, 8]], ["tile_x", "sp", [-1, 13, 2, 8]], ["tile_rc", "sp", [-1, 3]], ["auto_unroll_max_step", "ot", 128], ["unroll_explicit", "ot", 1]]}, "result": [[0.0021432143927813166], 0, 8.167912721633911, 1674271786.8810098], "version": 0.2, "tvm_version": "0.11.dev0"}
{"input": ["cuda -keys=cuda,gpu -arch=sm_86 -max_num_threads=1024 -thread_warp_size=32", "conv2d_nchw_winograd.cuda", [["TENSOR", [1, 12, 208, 208], "float32"], ["TENSOR", [24, 12, 3, 3], "float32"], [1, 1], [1, 1, 1, 1], [1, 1], "float32"], {}], "config": {"index": 53217, "code_hash": null, "entity": [["tile_b", "sp", [-1, 1, 1, 1]], ["tile_y", "sp", [-1, 8, 3, 1]], ["tile_x", "sp", [-1, 8, 1, 169]], ["tile_rc", "sp", [-1, 2]], ["auto_unroll_max_step", "ot", 0], ["unroll_explicit", "ot", 0]]}, "result": [[0.007228312755395683], 0, 7.36507248878479, 1674271788.2885408], "version": 0.2, "tvm_version": "0.11.dev0"}
{"input": ["cuda -keys=cuda,gpu -arch=sm_86 -max_num_threads=1024 -thread_warp_size=32", "conv2d_nchw_winograd.cuda", [["TENSOR", [1, 12, 208, 208], "float32"], ["TENSOR", [24, 12, 3, 3], "float32"], [1, 1], [1, 1, 1, 1], [1, 1], "float32"], {}], "config": {"index": 701816, "code_hash": null, "entity": [["tile_b", "sp", [-1, 1, 1, 1]], ["tile_y", "sp", [-1, 2, 4, 3]], ["tile_x", "sp", [-1, 104, 2, 1]], ["tile_rc", "sp", [-1, 2]], ["auto_unroll_max_step", "ot", 128], ["unroll_explicit", "ot", 1]]}, "result": [[0.0024099021322115384], 0, 8.03560996055603, 1674271789.6653934], "version": 0.2, "tvm_version": "0.11.dev0"}
{"input": ["cuda -keys=cuda,gpu -arch=sm_86 -max_num_threads=1024 -thread_warp_size=32", "conv2d_nchw_winograd.cuda", [["TENSOR", [1, 12, 208, 208], "float32"], ["TENSOR", [24, 12, 3, 3], "float32"], [1, 1], [1, 1, 1, 1], [1, 1], "float32"], {}], "config": {"index": 410895, "code_hash": null, "entity": [["tile_b", "sp", [-1, 1, 1, 1]], ["tile_y", "sp", [-1, 2, 3, 1]], ["tile_x", "sp", [-1, 16, 13, 13]], ["tile_rc", "sp", [-1, 3]], ["auto_unroll_max_step", "ot", 1500], ["unroll_explicit", "ot", 0]]}, "result": [[0.0008643439915754001], 0, 9.138736724853516, 1674271791.0735304], "version": 0.2, "tvm_version": "0.11.dev0"}
{"input": ["cuda -keys=cuda,gpu -arch=sm_86 -max_num_threads=1024 -thread_warp_size=32", "conv2d_nchw_winograd.cuda", [["TENSOR", [1, 12, 208, 208], "float32"], ["TENSOR", [24, 12, 3, 3], "float32"], [1, 1], [1, 1, 1, 1], [1, 1], "float32"], {}], "config": {"index": 339105, "code_hash": null, "entity": [["tile_b", "sp", [-1, 1, 1, 1]], ["tile_y", "sp", [-1, 2, 3, 4]], ["tile_x", "sp", [-1, 13, 8, 1]], ["tile_rc", "sp", [-1, 1]], ["auto_unroll_max_step", "ot", 1500], ["unroll_explicit", "ot", 0]]}, "result": [[0.00011970397144194757], 0, 7.237390518188477, 1674271792.4250863], "version": 0.2, "tvm_version": "0.11.dev0"}
{"input": ["cuda -keys=cuda,gpu -arch=sm_86 -max_num_threads=1024 -thread_warp_size=32", "conv2d_nchw_winograd.cuda", [["TENSOR", [1, 12, 208, 208], "float32"], ["TENSOR", [24, 12, 3, 3], "float32"], [1, 1], [1, 1, 1, 1], [1, 1], "float32"], {}], "config": {"index": 901876, "code_hash": null, "entity": [["tile_b", "sp", [-1, 1, 1, 1]], ["tile_y", "sp", [-1, 1, 2, 2]], ["tile_x", "sp", [-1, 1, 169, 1]], ["tile_rc", "sp", [-1, 3]], ["auto_unroll_max_step", "ot", 1500], ["unroll_explicit", "ot", 1]]}, "result": [[0.0001661673294532088], 0, 6.792289972305298, 1674271793.8833888], "version": 0.2, "tvm_version": "0.11.dev0"}
{"input": ["cuda -keys=cuda,gpu -arch=sm_86 -max_num_threads=1024 -thread_warp_size=32", "conv2d_nchw_winograd.cuda", [["TENSOR", [1, 12, 208, 208], "float32"], ["TENSOR", [24, 12, 3, 3], "float32"], [1, 1], [1, 1, 1, 1], [1, 1], "float32"], {}], "config": {"index": 773332, "code_hash": null, "entity": [["tile_b", "sp", [-1, 1, 1, 1]], ["tile_y", "sp", [-1, 1, 2, 3]], ["tile_x", "sp", [-1, 4, 2, 13]], ["tile_rc", "sp", [-1, 4]], ["auto_unroll_max_step", "ot", 128], ["unroll_explicit", "ot", 1]]}, "result": [[0.00032591295956192084], 0, 7.150593519210815, 1674271795.4279292], "version": 0.2, "tvm_version": "0.11.dev0"}
{"input": ["cuda -keys=cuda,gpu -arch=sm_86 -max_num_threads=1024 -thread_warp_size=32", "conv2d_nchw_winograd.cuda", [["TENSOR", [1, 12, 208, 208], "float32"], ["TENSOR", [24, 12, 3, 3], "float32"], [1, 1], [1, 1, 1, 1], [1, 1], "float32"], {}], "config": {"index": 358418, "code_hash": null, "entity": [["tile_b", "sp", [-1, 1, 1, 1]], ["tile_y", "sp", [-1, 1, 4, 1]], ["tile_x", "sp", [-1, 2, 26, 26]], ["tile_rc", "sp", [-1, 1]], ["auto_unroll_max_step", "ot", 1500], ["unroll_explicit", "ot", 0]]}, "result": [[0.000291496258679196], 0, 7.240581512451172, 1674271796.9000611], "version": 0.2, "tvm_version": "0.11.dev0"}
{"input": ["cuda -keys=cuda,gpu -arch=sm_86 -max_num_threads=1024 -thread_warp_size=32", "conv2d_nchw_winograd.cuda", [["TENSOR", [1, 12, 208, 208], "float32"], ["TENSOR", [24, 12, 3, 3], "float32"], [1, 1], [1, 1, 1, 1], [1, 1], "float32"], {}], "config": {"index": 601157, "code_hash": null, "entity": [["tile_b", "sp", [-1, 1, 1, 1]], ["tile_y", "sp", [-1, 2, 2, 2]], ["tile_x", "sp", [-1, 338, 2, 4]], ["tile_rc", "sp", [-1, 4]], ["auto_unroll_max_step", "ot", 0], ["unroll_explicit", "ot", 1]]}, "result": [[0.01217564373493976], 0, 7.486721515655518, 1674271798.398386], "version": 0.2, "tvm_version": "0.11.dev0"}
{"input": ["cuda -keys=cuda,gpu -arch=sm_86 -max_num_threads=1024 -thread_warp_size=32", "conv2d_nchw_winograd.cuda", [["TENSOR", [1, 12, 208, 208], "float32"], ["TENSOR", [24, 12, 3, 3], "float32"], [1, 1], [1, 1, 1, 1], [1, 1], "float32"], {}], "config": {"index": 952851, "code_hash": null, "entity": [["tile_b", "sp", [-1, 1, 1, 1]], ["tile_y", "sp", [-1, 8, 1, 3]], ["tile_x", "sp", [-1, 208, 1, 1]], ["tile_rc", "sp", [-1, 6]], ["auto_unroll_max_step", "ot", 1500], ["unroll_explicit", "ot", 1]]}, "result": [[0.020979871236842106], 0, 11.823903322219849, 1674271811.874675], "version": 0.2, "tvm_version": "0.11.dev0"}
{"input": ["cuda -keys=cuda,gpu -arch=sm_86 -max_num_threads=1024 -thread_warp_size=32", "conv2d_nchw_winograd.cuda", [["TENSOR", [1, 12, 208, 208], "float32"], ["TENSOR", [24, 12, 3, 3], "float32"], [1, 1], [1, 1, 1, 1], [1, 1], "float32"], {}], "config": {"index": 602382, "code_hash": null, "entity": [["tile_b", "sp", [-1, 1, 1, 1]], ["tile_y", "sp", [-1, 1, 2, 4]], ["tile_x", "sp", [-1, 13, 52, 4]], ["tile_rc", "sp", [-1, 4]], ["auto_unroll_max_step", "ot", 0], ["unroll_explicit", "ot", 1]]}, "result": [[0.00016949478842898907], 0, 7.142422199249268, 1674271813.2857702], "version": 0.2, "tvm_version": "0.11.dev0"}
{"input": ["cuda -keys=cuda,gpu -arch=sm_86 -max_num_threads=1024 -thread_warp_size=32", "conv2d_nchw_winograd.cuda", [["TENSOR", [1, 12, 208, 208], "float32"], ["TENSOR", [24, 12, 3, 3], "float32"], [1, 1], [1, 1, 1, 1], [1, 1], "float32"], {}], "config": {"index": 243322, "code_hash": null, "entity": [["tile_b", "sp", [-1, 1, 1, 1]], ["tile_y", "sp", [-1, 4, 3, 2]], ["tile_x", "sp", [-1, 4, 26, 13]], ["tile_rc", "sp", [-1, 3]], ["auto_unroll_max_step", "ot", 128], ["unroll_explicit", "ot", 0]]}, "result": [[0.0014221007605042019], 0, 7.748037576675415, 1674271814.6633608], "version": 0.2, "tvm_version": "0.11.dev0"}
{"input": ["cuda -keys=cuda,gpu -arch=sm_86 -max_num_threads=1024 -thread_warp_size=32", "conv2d_nchw_winograd.cuda", [["TENSOR", [1, 12, 208, 208], "float32"], ["TENSOR", [24, 12, 3, 3], "float32"], [1, 1], [1, 1, 1, 1], [1, 1], "float32"], {}], "config": {"index": 846317, "code_hash": null, "entity": [["tile_b", "sp", [-1, 1, 1, 1]], ["tile_y", "sp", [-1, 2, 1, 12]], ["tile_x", "sp", [-1, 1, 208, 1]], ["tile_rc", "sp", [-1, 1]], ["auto_unroll_max_step", "ot", 1500], ["unroll_explicit", "ot", 1]]}, "result": [[0.00011997372392138623], 0, 6.799339771270752, 1674271816.0486717], "version": 0.2, "tvm_version": "0.11.dev0"}
{"input": ["cuda -keys=cuda,gpu -arch=sm_86 -max_num_threads=1024 -thread_warp_size=32", "conv2d_nchw_winograd.cuda", [["TENSOR", [1, 12, 208, 208], "float32"], ["TENSOR", [24, 12, 3, 3], "float32"], [1, 1], [1, 1, 1, 1], [1, 1], "float32"], {}], "config": {"index": 612571, "code_hash": null, "entity": [["tile_b", "sp", [-1, 1, 1, 1]], ["tile_y", "sp", [-1, 4, 2, 1]], ["tile_x", "sp", [-1, 1, 2, 104]], ["tile_rc", "sp", [-1, 4]], ["auto_unroll_max_step", "ot", 0], ["unroll_explicit", "ot", 1]]}, "result": [[0.002471137541966427], 0, 7.2093894481658936, 1674271817.4215562], "version": 0.2, "tvm_version": "0.11.dev0"}
{"input": ["cuda -keys=cuda,gpu -arch=sm_86 -max_num_threads=1024 -thread_warp_size=32", "conv2d_nchw_winograd.cuda", [["TENSOR", [1, 12, 208, 208], "float32"], ["TENSOR", [24, 12, 3, 3], "float32"], [1, 1], [1, 1, 1, 1], [1, 1], "float32"], {}], "config": {"index": 275474, "code_hash": null, "entity": [["tile_b", "sp", [-1, 1, 1, 1]], ["tile_y", "sp", [-1, 6, 1, 2]], ["tile_x", "sp", [-1, 13, 2, 52]], ["tile_rc", "sp", [-1, 4]], ["auto_unroll_max_step", "ot", 128], ["unroll_explicit", "ot", 0]]}, "result": [[0.011111141659340658], 0, 7.43851900100708, 1674271818.8882], "version": 0.2, "tvm_version": "0.11.dev0"}
{"input": ["cuda -keys=cuda,gpu -arch=sm_86 -max_num_threads=1024 -thread_warp_size=32", "conv2d_nchw_winograd.cuda", [["TENSOR", [1, 12, 208, 208], "float32"], ["TENSOR", [24, 12, 3, 3], "float32"], [1, 1], [1, 1, 1, 1], [1, 1], "float32"], {}], "config": {"index": 705541, "code_hash": null, "entity": [["tile_b", "sp", [-1, 1, 1, 1]], ["tile_y", "sp", [-1, 6, 4, 1]], ["tile_x", "sp", [-1, 1, 104, 1]], ["tile_rc", "sp", [-1, 2]], ["auto_unroll_max_step", "ot", 128], ["unroll_explicit", "ot", 1]]}, "result": [[0.0001543516143001007], 0, 6.791124105453491, 1674271820.316759], "version": 0.2, "tvm_version": "0.11.dev0"}
{"input": ["cuda -keys=cuda,gpu -arch=sm_86 -max_num_threads=1024 -thread_warp_size=32", "conv2d_nchw_winograd.cuda", [["TENSOR", [1, 12, 208, 208], "float32"], ["TENSOR", [24, 12, 3, 3], "float32"], [1, 1], [1, 1, 1, 1], [1, 1], "float32"], {}], "config": {"index": 769935, "code_hash": null, "entity": [["tile_b", "sp", [-1, 1, 1, 1]], ["tile_y", "sp", [-1, 2, 3, 1]], ["tile_x", "sp", [-1, 1, 26, 4]], ["tile_rc", "sp", [-1, 4]], ["auto_unroll_max_step", "ot", 128], ["unroll_explicit", "ot", 1]]}, "result": [[0.00014233231709117754], 0, 6.453371047973633, 1674271821.7916634], "version": 0.2, "tvm_version": "0.11.dev0"}
{"input": ["cuda -keys=cuda,gpu -arch=sm_86 -max_num_threads=1024 -thread_warp_size=32", "conv2d_nchw_winograd.cuda", [["TENSOR", [1, 12, 208, 208], "float32"], ["TENSOR", [24, 12, 3, 3], "float32"], [1, 1], [1, 1, 1, 1], [1, 1], "float32"], {}], "config": {"index": 28083, "code_hash": null, "entity": [["tile_b", "sp", [-1, 1, 1, 1]], ["tile_y", "sp", [-1, 4, 1, 1]], ["tile_x", "sp", [-1, 2, 1, 1]], ["tile_rc", "sp", [-1, 2]], ["auto_unroll_max_step", "ot", 0], ["unroll_explicit", "ot", 0]]}, "result": [[0.0016014829338129497], 0, 5.679658651351929, 1674271823.2388196], "version": 0.2, "tvm_version": "0.11.dev0"}
{"input": ["cuda -keys=cuda,gpu -arch=sm_86 -max_num_threads=1024 -thread_warp_size=32", "conv2d_nchw_winograd.cuda", [["TENSOR", [1, 12, 208, 208], "float32"], ["TENSOR", [24, 12, 3, 3], "float32"], [1, 1], [1, 1, 1, 1], [1, 1], "float32"], {}], "config": {"index": 546885, "code_hash": null, "entity": [["tile_b", "sp", [-1, 1, 1, 1]], ["tile_y", "sp", [-1, 8, 1, 1]], ["tile_x", "sp", [-1, 1, 1, 8]], ["tile_rc", "sp", [-1, 2]], ["auto_unroll_max_step", "ot", 0], ["unroll_explicit", "ot", 1]]}, "result": [[0.000675306975329891], 0, 5.6581711769104, 1674271824.753237], "version": 0.2, "tvm_version": "0.11.dev0"}
{"input": ["cuda -keys=cuda,gpu -arch=sm_86 -max_num_threads=1024 -thread_warp_size=32", "conv2d_nchw_winograd.cuda", [["TENSOR", [1, 12, 208, 208], "float32"], ["TENSOR", [24, 12, 3, 3], "float32"], [1, 1], [1, 1, 1, 1], [1, 1], "float32"], {}], "config": {"index": 479634, "code_hash": null, "entity": [["tile_b", "sp", [-1, 1, 1, 1]], ["tile_y", "sp", [-1, 6, 1, 2]], ["tile_x", "sp", [-1, 8, 13, 1]], ["tile_rc", "sp", [-1, 12]], ["auto_unroll_max_step", "ot", 1500], ["unroll_explicit", "ot", 0]]}, "result": [[0.00012608442522924995], 0, 6.085919141769409, 1674271826.192198], "version": 0.2, "tvm_version": "0.11.dev0"}
{"input": ["cuda -keys=cuda,gpu -arch=sm_86 -max_num_threads=1024 -thread_warp_size=32", "conv2d_nchw_winograd.cuda", [["TENSOR", [1, 12, 208, 208], "float32"], ["TENSOR", [24, 12, 3, 3], "float32"], [1, 1], [1, 1, 1, 1], [1, 1], "float32"], {}], "config": {"index": 1000411, "code_hash": null, "entity": [["tile_b", "sp", [-1, 1, 1, 1]], ["tile_y", "sp", [-1, 4, 2, 1]], ["tile_x", "sp", [-1, 1, 1, 26]], ["tile_rc", "sp", [-1, 12]], ["auto_unroll_max_step", "ot", 1500], ["unroll_explicit", "ot", 1]]}, "result": [[0.0004080662570093458], 0, 9.957573413848877, 1674271839.0280223], "version": 0.2, "tvm_version": "0.11.dev0"}
{"input": ["cuda -keys=cuda,gpu -arch=sm_86 -max_num_threads=1024 -thread_warp_size=32", "conv2d_nchw_winograd.cuda", [["TENSOR", [1, 12, 208, 208], "float32"], ["TENSOR", [24, 12, 3, 3], "float32"], [1, 1], [1, 1, 1, 1], [1, 1], "float32"], {}], "config": {"index": 754059, "code_hash": null, "entity": [["tile_b", "sp", [-1, 1, 1, 1]], ["tile_y", "sp", [-1, 2, 1, 4]], ["tile_x", "sp", [-1, 2, 8, 169]], ["tile_rc", "sp", [-1, 3]], ["auto_unroll_max_step", "ot", 128], ["unroll_explicit", "ot", 1]]}, "result": [[0.0037132277822878226], 0, 6.372489929199219, 1674271840.4395401], "version": 0.2, "tvm_version": "0.11.dev0"}
{"input": ["cuda -keys=cuda,gpu -arch=sm_86 -max_num_threads=1024 -thread_warp_size=32", "conv2d_nchw_winograd.cuda", [["TENSOR", [1, 12, 208, 208], "float32"], ["TENSOR", [24, 12, 3, 3], "float32"], [1, 1], [1, 1, 1, 1], [1, 1], "float32"], {}], "config": {"index": 12485, "code_hash": null, "entity": [["tile_b", "sp", [-1, 1, 1, 1]], ["tile_y", "sp", [-1, 8, 1, 1]], ["tile_x", "sp", [-1, 169, 1, 4]], ["tile_rc", "sp", [-1, 1]], ["auto_unroll_max_step", "ot", 0], ["unroll_explicit", "ot", 0]]}, "result": [[0.019258604769230768], 0, 6.697399377822876, 1674271842.009821], "version": 0.2, "tvm_version": "0.11.dev0"}
{"input": ["cuda -keys=cuda,gpu -arch=sm_86 -max_num_threads=1024 -thread_warp_size=32", "conv2d_nchw_winograd.cuda", [["TENSOR", [1, 12, 208, 208], "float32"], ["TENSOR", [24, 12, 3, 3], "float32"], [1, 1], [1, 1, 1, 1], [1, 1], "float32"], {}], "config": {"index": 411778, "code_hash": null, "entity": [["tile_b", "sp", [-1, 1, 1, 1]], ["tile_y", "sp", [-1, 1, 4, 1]], ["tile_x", "sp", [-1, 2, 104, 13]], ["tile_rc", "sp", [-1, 3]], ["auto_unroll_max_step", "ot", 1500], ["unroll_explicit", "ot", 0]]}, "result": [[0.00027298261983267716], 0, 5.446035385131836, 1674271843.466216], "version": 0.2, "tvm_version": "0.11.dev0"}
{"input": ["cuda -keys=cuda,gpu -arch=sm_86 -max_num_threads=1024 -thread_warp_size=32", "conv2d_nchw_winograd.cuda", [["TENSOR", [1, 12, 208, 208], "float32"], ["TENSOR", [24, 12, 3, 3], "float32"], [1, 1], [1, 1, 1, 1], [1, 1], "float32"], {}], "config": {"index": 935396, "code_hash": null, "entity": [["tile_b", "sp", [-1, 1, 1, 1]], ["tile_y", "sp", [-1, 1, 2, 2]], ["tile_x", "sp", [-1, 4, 169, 2]], ["tile_rc", "sp", [-1, 4]], ["auto_unroll_max_step", "ot", 1500], ["unroll_explicit", "ot", 1]]}, "result": [[0.0001390987982367758], 0, 6.616700887680054, 1674271844.9584682], "version": 0.2, "tvm_version": "0.11.dev0"}
{"input": ["cuda -keys=cuda,gpu -arch=sm_86 -max_num_threads=1024 -thread_warp_size=32", "conv2d_nchw_winograd.cuda", [["TENSOR", [1, 12, 208, 208], "float32"], ["TENSOR", [24, 12, 3, 3], "float32"], [1, 1], [1, 1, 1, 1], [1, 1], "float32"], {}], "config": {"index": 581291, "code_hash": null, "entity": [["tile_b", "sp", [-1, 1, 1, 1]], ["tile_y", "sp", [-1, 4, 2, 1]], ["tile_x", "sp", [-1, 13, 2, 26]], ["tile_rc", "sp", [-1, 3]], ["auto_unroll_max_step", "ot", 0], ["unroll_explicit", "ot", 1]]}, "result": [[0.0045152793139013455], 0, 6.743112325668335, 1674271846.3750944], "version": 0.2, "tvm_version": "0.11.dev0"}
{"input": ["cuda -keys=cuda,gpu -arch=sm_86 -max_num_threads=1024 -thread_warp_size=32", "conv2d_nchw_winograd.cuda", [["TENSOR", [1, 12, 208, 208], "float32"], ["TENSOR", [24, 12, 3, 3], "float32"], [1, 1], [1, 1, 1, 1], [1, 1], "float32"], {}], "config": {"index": 7797, "code_hash": null, "entity": [["tile_b", "sp", [-1, 1, 1, 1]], ["tile_y", "sp", [-1, 2, 2, 2]], ["tile_x", "sp", [-1, 104, 1, 2]], ["tile_rc", "sp", [-1, 1]], ["auto_unroll_max_step", "ot", 0], ["unroll_explicit", "ot", 0]]}, "result": [[0.007501939455223881], 0, 6.8268396854400635, 1674271847.8162928], "version": 0.2, "tvm_version": "0.11.dev0"}
{"input": ["cuda -keys=cuda,gpu -arch=sm_86 -max_num_threads=1024 -thread_warp_size=32", "conv2d_nchw_winograd.cuda", [["TENSOR", [1, 12, 208, 208], "float32"], ["TENSOR", [24, 12, 3, 3], "float32"], [1, 1], [1, 1, 1, 1], [1, 1], "float32"], {}], "config": {"index": 11602, "code_hash": null, "entity": [["tile_b", "sp", [-1, 1, 1, 1]], ["tile_y", "sp", [-1, 3, 1, 1]], ["tile_x", "sp", [-1, 2, 338, 2]], ["tile_rc", "sp", [-1, 1]], ["auto_unroll_max_step", "ot", 0], ["unroll_explicit", "ot", 0]]}, "result": [[0.00016277373214285717], 0, 5.267787218093872, 1674271849.3113492], "version": 0.2, "tvm_version": "0.11.dev0"}
{"input": ["cuda -keys=cuda,gpu -arch=sm_86 -max_num_threads=1024 -thread_warp_size=32", "conv2d_nchw_winograd.cuda", [["TENSOR", [1, 12, 208, 208], "float32"], ["TENSOR", [24, 12, 3, 3], "float32"], [1, 1], [1, 1, 1, 1], [1, 1], "float32"], {}], "config": {"index": 181376, "code_hash": null, "entity": [["tile_b", "sp", [-1, 1, 1, 1]], ["tile_y", "sp", [-1, 4, 3, 1]], ["tile_x", "sp", [-1, 169, 4, 4]], ["tile_rc", "sp", [-1, 1]], ["auto_unroll_max_step", "ot", 128], ["unroll_explicit", "ot", 0]]}, "result": [[0.0026950048826666667], 0, 5.712920188903809, 1674271850.679333], "version": 0.2, "tvm_version": "0.11.dev0"}
{"input": ["cuda -keys=cuda,gpu -arch=sm_86 -max_num_threads=1024 -thread_warp_size=32", "conv2d_nchw_winograd.cuda", [["TENSOR", [1, 12, 208, 208], "float32"], ["TENSOR", [24, 12, 3, 3], "float32"], [1, 1], [1, 1, 1, 1], [1, 1], "float32"], {}], "config": {"index": 938011, "code_hash": null, "entity": [["tile_b", "sp", [-1, 1, 1, 1]], ["tile_y", "sp", [-1, 4, 2, 1]], ["tile_x", "sp", [-1, 2, 26, 4]], ["tile_rc", "sp", [-1, 4]], ["auto_unroll_max_step", "ot", 1500], ["unroll_explicit", "ot", 1]]}, "result": [[0.00013974833366263274], 0, 6.32876443862915, 1674271852.1472065], "version": 0.2, "tvm_version": "0.11.dev0"}
{"input": ["cuda -keys=cuda,gpu -arch=sm_86 -max_num_threads=1024 -thread_warp_size=32", "conv2d_nchw_winograd.cuda", [["TENSOR", [1, 12, 208, 208], "float32"], ["TENSOR", [24, 12, 3, 3], "float32"], [1, 1], [1, 1, 1, 1], [1, 1], "float32"], {}], "config": {"index": 690446, "code_hash": null, "entity": [["tile_b", "sp", [-1, 1, 1, 1]], ["tile_y", "sp", [-1, 2, 6, 2]], ["tile_x", "sp", [-1, 13, 8, 13]], ["tile_rc", "sp", [-1, 1]], ["auto_unroll_max_step", "ot", 128], ["unroll_explicit", "ot", 1]]}, "result": [[0.0010444122272126816], 0, 11.053877115249634, 1674271863.3864202], "version": 0.2, "tvm_version": "0.11.dev0"}
