tuning_records/yolox_tiny_fp16_tuning-records_3000-2?.json
{"input": ["cuda -keys=cuda,gpu -arch=sm_86 -max_num_threads=1024 -thread_warp_size=32", "conv2d_nchw.cuda", [["TENSOR", [1, 12, 208, 208], "float16"], ["TENSOR", [24, 12, 3, 3], "float16"], [1, 1], [1, 1, 1, 1], [1, 1], "float16"], {}], "config": {"index": 141782372, "code_hash": null, "entity": [["tile_f", "sp", [-1, 1, 2, 3]], ["tile_y", "sp", [-1, 2, 4, 1]], ["tile_x", "sp", [-1, 1, 4, 2]], ["tile_rc", "sp", [-1, 1]], ["tile_ry", "sp", [-1, 3]], ["tile_rx", "sp", [-1, 3]], ["auto_unroll_max_step", "ot", 0], ["unroll_explicit", "ot", 1]]}, "result": [[0.00012191284626187527], 0, 3.3512489795684814, 1674702849.0836577], "version": 0.2, "tvm_version": "0.11.dev0"}
{"input": ["cuda -keys=cuda,gpu -arch=sm_86 -max_num_threads=1024 -thread_warp_size=32", "conv2d_nchw.cuda", [["TENSOR", [1, 12, 208, 208], "float16"], ["TENSOR", [24, 12, 3, 3], "float16"], [1, 1], [1, 1, 1, 1], [1, 1], "float16"], {}], "config": {"index": 141513513, "code_hash": null, "entity": [["tile_f", "sp", [-1, 1, 1, 8]], ["tile_y", "sp", [-1, 1, 4, 1]], ["tile_x", "sp", [-1, 1, 26, 1]], ["tile_rc", "sp", [-1, 1]], ["tile_ry", "sp", [-1, 3]], ["tile_rx", "sp", [-1, 3]], ["auto_unroll_max_step", "ot", 0], ["unroll_explicit", "ot", 1]]}, "result": [[9.323411747520565e-05], 0, 2.0497350692749023, 1674702850.6629555], "version": 0.2, "tvm_version": "0.11.dev0"}
{"input": ["cuda -keys=cuda,gpu -arch=sm_86 -max_num_threads=1024 -thread_warp_size=32", "conv2d_nchw.cuda", [["TENSOR", [1, 12, 208, 208], "float16"], ["TENSOR", [24, 12, 3, 3], "float16"], [1, 1], [1, 1, 1, 1], [1, 1], "float16"], {}], "config": {"index": 141894313, "code_hash": null, "entity": [["tile_f", "sp", [-1, 1, 1, 8]], ["tile_y", "sp", [-1, 1, 4, 1]], ["tile_x", "sp", [-1, 1, 26, 2]], ["tile_rc", "sp", [-1, 1]], ["tile_ry", "sp", [-1, 3]], ["tile_rx", "sp", [-1, 3]], ["auto_unroll_max_step", "ot", 0], ["unroll_explicit", "ot", 1]]}, "result": [[6.842347725708234e-05], 0, 2.357449769973755, 1674702852.8880866], "version": 0.2, "tvm_version": "0.11.dev0"}
{"input": ["cuda -keys=cuda,gpu -arch=sm_86 -max_num_threads=1024 -thread_warp_size=32", "conv2d_nchw.cuda", [["TENSOR", [1, 12, 208, 208], "float16"], ["TENSOR", [24, 12, 3, 3], "float16"], [1, 1], [1, 1, 1, 1], [1, 1], "float16"], {}], "config": {"index": 179424828, "code_hash": null, "entity": [["tile_f", "sp", [-1, 2, 12, 1]], ["tile_y", "sp", [-1, 1, 2, 1]], ["tile_x", "sp", [-1, 2, 4, 2]], ["tile_rc", "sp", [-1, 1]], ["tile_ry", "sp", [-1, 3]], ["tile_rx", "sp", [-1, 3]], ["auto_unroll_max_step", "ot", 512], ["unroll_explicit", "ot", 1]]}, "result": [[9.279310483191668e-05], 0, 2.120640516281128, 1674702855.0028117], "version": 0.2, "tvm_version": "0.11.dev0"}
{"input": ["cuda -keys=cuda,gpu -arch=sm_86 -max_num_threads=1024 -thread_warp_size=32", "conv2d_nchw.cuda", [["TENSOR", [1, 12, 208, 208], "float16"], ["TENSOR", [24, 12, 3, 3], "float16"], [1, 1], [1, 1, 1, 1], [1, 1], "float16"], {}], "config": {"index": 66528908, "code_hash": null, "entity": [["tile_f", "sp", [-1, 2, 12, 1]], ["tile_y", "sp", [-1, 2, 2, 1]], ["tile_x", "sp", [-1, 2, 4, 2]], ["tile_rc", "sp", [-1, 1]], ["tile_ry", "sp", [-1, 3]], ["tile_rx", "sp", [-1, 3]], ["auto_unroll_max_step", "ot", 512], ["unroll_explicit", "ot", 0]]}, "result": [[0.00011627046318333953], 0, 2.274135112762451, 1674702856.6190052], "version": 0.2, "tvm_version": "0.11.dev0"}
{"input": ["cuda -keys=cuda,gpu -arch=sm_86 -max_num_threads=1024 -thread_warp_size=32", "conv2d_nchw.cuda", [["TENSOR", [1, 12, 208, 208], "float16"], ["TENSOR", [24, 12, 3, 3], "float16"], [1, 1], [1, 1, 1, 1], [1, 1], "float16"], {}], "config": {"index": 66528828, "code_hash": null, "entity": [["tile_f", "sp", [-1, 2, 12, 1]], ["tile_y", "sp", [-1, 1, 2, 1]], ["tile_x", "sp", [-1, 2, 4, 2]], ["tile_rc", "sp", [-1, 1]], ["tile_ry", "sp", [-1, 3]], ["tile_rx", "sp", [-1, 3]], ["auto_unroll_max_step", "ot", 512], ["unroll_explicit", "ot", 0]]}, "result": [[9.345562875355194e-05], 0, 2.114193916320801, 1674702858.7848332], "version": 0.2, "tvm_version": "0.11.dev0"}
{"input": ["cuda -keys=cuda,gpu -arch=sm_86 -max_num_threads=1024 -thread_warp_size=32", "conv2d_nchw.cuda", [["TENSOR", [1, 12, 208, 208], "float16"], ["TENSOR", [24, 12, 3, 3], "float16"], [1, 1], [1, 1, 1, 1], [1, 1], "float16"], {}], "config": {"index": 141782357, "code_hash": null, "entity": [["tile_f", "sp", [-1, 2, 2, 2]], ["tile_y", "sp", [-1, 2, 4, 1]], ["tile_x", "sp", [-1, 1, 4, 2]], ["tile_rc", "sp", [-1, 1]], ["tile_ry", "sp", [-1, 3]], ["tile_rx", "sp", [-1, 3]], ["auto_unroll_max_step", "ot", 0], ["unroll_explicit", "ot", 1]]}, "result": [[0.00011990462109336243], 0, 2.112858295440674, 1674702860.9475632], "version": 0.2, "tvm_version": "0.11.dev0"}
{"input": ["cuda -keys=cuda,gpu -arch=sm_86 -max_num_threads=1024 -thread_warp_size=32", "conv2d_nchw.cuda", [["TENSOR", [1, 12, 208, 208], "float16"], ["TENSOR", [24, 12, 3, 3], "float16"], [1, 1], [1, 1, 1, 1], [1, 1], "float16"], {}], "config": {"index": 179424908, "code_hash": null, "entity": [["tile_f", "sp", [-1, 2, 12, 1]], ["tile_y", "sp", [-1, 2, 2, 1]], ["tile_x", "sp", [-1, 2, 4, 2]], ["tile_rc", "sp", [-1, 1]], ["tile_ry", "sp", [-1, 3]], ["tile_rx", "sp", [-1, 3]], ["auto_unroll_max_step", "ot", 512], ["unroll_explicit", "ot", 1]]}, "result": [[7.111405391923992e-05], 0, 2.1336710453033447, 1674702862.4836075], "version": 0.2, "tvm_version": "0.11.dev0"}
{"input": ["cuda -keys=cuda,gpu -arch=sm_86 -max_num_threads=1024 -thread_warp_size=32", "conv2d_nchw.cuda", [["TENSOR", [1, 12, 208, 208], "float16"], ["TENSOR", [24, 12, 3, 3], "float16"], [1, 1], [1, 1, 1, 1], [1, 1], "float16"], {}], "config": {"index": 28617513, "code_hash": null, "entity": [["tile_f", "sp", [-1, 1, 1, 8]], ["tile_y", "sp", [-1, 1, 4, 1]], ["tile_x", "sp", [-1, 1, 26, 1]], ["tile_rc", "sp", [-1, 1]], ["tile_ry", "sp", [-1, 3]], ["tile_rx", "sp", [-1, 3]], ["auto_unroll_max_step", "ot", 0], ["unroll_explicit", "ot", 0]]}, "result": [[9.388401694001693e-05], 0, 2.1276681423187256, 1674702864.0540953], "version": 0.2, "tvm_version": "0.11.dev0"}
{"input": ["cuda -keys=cuda,gpu -arch=sm_86 -max_num_threads=1024 -thread_warp_size=32", "conv2d_nchw.cuda", [["TENSOR", [1, 12, 208, 208], "float16"], ["TENSOR", [24, 12, 3, 3], "float16"], [1, 1], [1, 1, 1, 1], [1, 1], "float16"], {}], "config": {"index": 28998313, "code_hash": null, "entity": [["tile_f", "sp", [-1, 1, 1, 8]], ["tile_y", "sp", [-1, 1, 4, 1]], ["tile_x", "sp", [-1, 1, 26, 2]], ["tile_rc", "sp", [-1, 1]], ["tile_ry", "sp", [-1, 3]], ["tile_rx", "sp", [-1, 3]], ["auto_unroll_max_step", "ot", 0], ["unroll_explicit", "ot", 0]]}, "result": [[6.919068931366808e-05], 0, 2.3507585525512695, 1674702865.704432], "version": 0.2, "tvm_version": "0.11.dev0"}
{"input": ["cuda -keys=cuda,gpu -arch=sm_86 -max_num_threads=1024 -thread_warp_size=32", "conv2d_nchw.cuda", [["TENSOR", [1, 12, 208, 208], "float16"], ["TENSOR", [24, 12, 3, 3], "float16"], [1, 1], [1, 1, 1, 1], [1, 1], "float16"], {}], "config": {"index": 141782390, "code_hash": null, "entity": [["tile_f", "sp", [-1, 1, 2, 6]], ["tile_y", "sp", [-1, 2, 4, 1]], ["tile_x", "sp", [-1, 1, 4, 2]], ["tile_rc", "sp", [-1, 1]], ["tile_ry", "sp", [-1, 3]], ["tile_rx", "sp", [-1, 3]], ["auto_unroll_max_step", "ot", 0], ["unroll_explicit", "ot", 1]]}, "result": [[9.633664773707742e-05], 0, 2.039537191390991, 1674702867.278265], "version": 0.2, "tvm_version": "0.11.dev0"}
{"input": ["cuda -keys=cuda,gpu -arch=sm_86 -max_num_threads=1024 -thread_warp_size=32", "conv2d_nchw.cuda", [["TENSOR", [1, 12, 208, 208], "float16"], ["TENSOR", [24, 12, 3, 3], "float16"], [1, 1], [1, 1, 1, 1], [1, 1], "float16"], {}], "config": {"index": 141782292, "code_hash": null, "entity": [["tile_f", "sp", [-1, 1, 2, 3]], ["tile_y", "sp", [-1, 1, 4, 1]], ["tile_x", "sp", [-1, 1, 4, 2]], ["tile_rc", "sp", [-1, 1]], ["tile_ry", "sp", [-1, 3]], ["tile_rx", "sp", [-1, 3]], ["auto_unroll_max_step", "ot", 0], ["unroll_explicit", "ot", 1]]}, "result": [[0.0001418418597846442], 0, 2.1092307567596436, 1674702869.433134], "version": 0.2, "tvm_version": "0.11.dev0"}
{"input": ["cuda -keys=cuda,gpu -arch=sm_86 -max_num_threads=1024 -thread_warp_size=32", "conv2d_nchw.cuda", [["TENSOR", [1, 12, 208, 208], "float16"], ["TENSOR", [24, 12, 3, 3], "float16"], [1, 1], [1, 1, 1, 1], [1, 1], "float16"], {}], "config": {"index": 141513507, "code_hash": null, "entity": [["tile_f", "sp", [-1, 1, 1, 6]], ["tile_y", "sp", [-1, 1, 4, 1]], ["tile_x", "sp", [-1, 1, 26, 1]], ["tile_rc", "sp", [-1, 1]], ["tile_ry", "sp", [-1, 3]], ["tile_rx", "sp", [-1, 3]], ["auto_unroll_max_step", "ot", 0], ["unroll_explicit", "ot", 1]]}, "result": [[0.00010678947311544544], 0, 2.012667655944824, 1674702871.587931], "version": 0.2, "tvm_version": "0.11.dev0"}
{"input": ["cuda -keys=cuda,gpu -arch=sm_86 -max_num_threads=1024 -thread_warp_size=32", "conv2d_nchw.cuda", [["TENSOR", [1, 12, 208, 208], "float16"], ["TENSOR", [24, 12, 3, 3], "float16"], [1, 1], [1, 1, 1, 1], [1, 1], "float16"], {}], "config": {"index": 141827172, "code_hash": null, "entity": [["tile_f", "sp", [-1, 1, 2, 3]], ["tile_y", "sp", [-1, 2, 4, 1]], ["tile_x", "sp", [-1, 1, 8, 2]], ["tile_rc", "sp", [-1, 1]], ["tile_ry", "sp", [-1, 3]], ["tile_rx", "sp", [-1, 3]], ["auto_unroll_max_step", "ot", 0], ["unroll_explicit", "ot", 1]]}, "result": [[9.887635243234663e-05], 0, 2.069187879562378, 1674702873.200564], "version": 0.2, "tvm_version": "0.11.dev0"}
{"input": ["cuda -keys=cuda,gpu -arch=sm_86 -max_num_threads=1024 -thread_warp_size=32", "conv2d_nchw.cuda", [["TENSOR", [1, 12, 208, 208], "float16"], ["TENSOR", [24, 12, 3, 3], "float16"], [1, 1], [1, 1, 1, 1], [1, 1], "float16"], {}], "config": {"index": 141782375, "code_hash": null, "entity": [["tile_f", "sp", [-1, 1, 4, 3]], ["tile_y", "sp", [-1, 2, 4, 1]], ["tile_x", "sp", [-1, 1, 4, 2]], ["tile_rc", "sp", [-1, 1]], ["tile_ry", "sp", [-1, 3]], ["tile_rx", "sp", [-1, 3]], ["auto_unroll_max_step", "ot", 0], ["unroll_explicit", "ot", 1]]}, "result": [[0.00010142900947906362], 0, 2.0027215480804443, 1674702875.3553464], "version": 0.2, "tvm_version": "0.11.dev0"}
{"input": ["cuda -keys=cuda,gpu -arch=sm_86 -max_num_threads=1024 -thread_warp_size=32", "conv2d_nchw.cuda", [["TENSOR", [1, 12, 208, 208], "float16"], ["TENSOR", [24, 12, 3, 3], "float16"], [1, 1], [1, 1, 1, 1], [1, 1], "float16"], {}], "config": {"index": 66249507, "code_hash": null, "entity": [["tile_f", "sp", [-1, 1, 1, 6]], ["tile_y", "sp", [-1, 1, 4, 1]], ["tile_x", "sp", [-1, 1, 26, 1]], ["tile_rc", "sp", [-1, 1]], ["tile_ry", "sp", [-1, 3]], ["tile_rx", "sp", [-1, 3]], ["auto_unroll_max_step", "ot", 512], ["unroll_explicit", "ot", 0]]}, "result": [[0.00010715071976427126], 0, 1.9420580863952637, 1674702877.508041], "version": 0.2, "tvm_version": "0.11.dev0"}
{"input": ["cuda -keys=cuda,gpu -arch=sm_86 -max_num_threads=1024 -thread_warp_size=32", "conv2d_nchw.cuda", [["TENSOR", [1, 12, 208, 208], "float16"], ["TENSOR", [24, 12, 3, 3], "float16"], [1, 1], [1, 1, 1, 1], [1, 1], "float16"], {}], "config": {"index": 66521147, "code_hash": null, "entity": [["tile_f", "sp", [-1, 1, 12, 1]], ["tile_y", "sp", [-1, 2, 2, 2]], ["tile_x", "sp", [-1, 1, 4, 2]], ["tile_rc", "sp", [-1, 1]], ["tile_ry", "sp", [-1, 3]], ["tile_rx", "sp", [-1, 3]], ["auto_unroll_max_step", "ot", 512], ["unroll_explicit", "ot", 0]]}, "result": [[9.00652641865958e-05], 0, 3.2761409282684326, 1674702881.7476242], "version": 0.2, "tvm_version": "0.11.dev0"}
{"input": ["cuda -keys=cuda,gpu -arch=sm_86 -max_num_threads=1024 -thread_warp_size=32", "conv2d_nchw.cuda", [["TENSOR", [1, 12, 208, 208], "float16"], ["TENSOR", [24, 12, 3, 3], "float16"], [1, 1], [1, 1, 1, 1], [1, 1], "float16"], {}], "config": {"index": 68096828, "code_hash": null, "entity": [["tile_f", "sp", [-1, 2, 12, 1]], ["tile_y", "sp", [-1, 1, 2, 1]], ["tile_x", "sp", [-1, 2, 4, 2]], ["tile_rc", "sp", [-1, 2]], ["tile_ry", "sp", [-1, 3]], ["tile_rx", "sp", [-1, 3]], ["auto_unroll_max_step", "ot", 512], ["unroll_explicit", "ot", 0]]}, "result": [[9.911135213426934e-05], 0, 2.1267740726470947, 1674702883.889896], "version": 0.2, "tvm_version": "0.11.dev0"}
{"input": ["cuda -keys=cuda,gpu -arch=sm_86 -max_num_threads=1024 -thread_warp_size=32", "conv2d_nchw.cuda", [["TENSOR", [1, 12, 208, 208], "float16"], ["TENSOR", [24, 12, 3, 3], "float16"], [1, 1], [1, 1, 1, 1], [1, 1], "float16"], {}], "config": {"index": 179413628, "code_hash": null, "entity": [["tile_f", "sp", [-1, 2, 12, 1]], ["tile_y", "sp", [-1, 1, 2, 1]], ["tile_x", "sp", [-1, 1, 4, 2]], ["tile_rc", "sp", [-1, 1]], ["tile_ry", "sp", [-1, 3]], ["tile_rx", "sp", [-1, 3]], ["auto_unroll_max_step", "ot", 512], ["unroll_explicit", "ot", 1]]}, "result": [[0.00014449710674225061], 0, 2.7612409591674805, 1674702885.4195664], "version": 0.2, "tvm_version": "0.11.dev0"}
{"input": ["cuda -keys=cuda,gpu -arch=sm_86 -max_num_threads=1024 -thread_warp_size=32", "conv2d_nchw.cuda", [["TENSOR", [1, 12, 208, 208], "float16"], ["TENSOR", [24, 12, 3, 3], "float16"], [1, 1], [1, 1, 1, 1], [1, 1], "float16"], {}], "config": {"index": 141782395, "code_hash": null, "entity": [["tile_f", "sp", [-1, 1, 3, 8]], ["tile_y", "sp", [-1, 2, 4, 1]], ["tile_x", "sp", [-1, 1, 4, 2]], ["tile_rc", "sp", [-1, 1]], ["tile_ry", "sp", [-1, 3]], ["tile_rx", "sp", [-1, 3]], ["auto_unroll_max_step", "ot", 0], ["unroll_explicit", "ot", 1]]}, "result": [[9.297521050207279e-05], 0, 2.014080286026001, 1674702886.988902], "version": 0.2, "tvm_version": "0.11.dev0"}
{"input": ["cuda -keys=cuda,gpu -arch=sm_86 -max_num_threads=1024 -thread_warp_size=32", "conv2d_nchw.cuda", [["TENSOR", [1, 12, 208, 208], "float16"], ["TENSOR", [24, 12, 3, 3], "float16"], [1, 1], [1, 1, 1, 1], [1, 1], "float16"], {}], "config": {"index": 66518372, "code_hash": null, "entity": [["tile_f", "sp", [-1, 1, 2, 3]], ["tile_y", "sp", [-1, 2, 4, 1]], ["tile_x", "sp", [-1, 1, 4, 2]], ["tile_rc", "sp", [-1, 1]], ["tile_ry", "sp", [-1, 3]], ["tile_rx", "sp", [-1, 3]], ["auto_unroll_max_step", "ot", 512], ["unroll_explicit", "ot", 0]]}, "result": [[0.00011436172663123166], 0, 2.1737115383148193, 1674702889.1948688], "version": 0.2, "tvm_version": "0.11.dev0"}
{"input": ["cuda -keys=cuda,gpu -arch=sm_86 -max_num_threads=1024 -thread_warp_size=32", "conv2d_nchw.cuda", [["TENSOR", [1, 12, 208, 208], "float16"], ["TENSOR", [24, 12, 3, 3], "float16"], [1, 1], [1, 1, 1, 1], [1, 1], "float16"], {}], "config": {"index": 141323172, "code_hash": null, "entity": [["tile_f", "sp", [-1, 1, 2, 3]], ["tile_y", "sp", [-1, 2, 4, 1]], ["tile_x", "sp", [-1, 1, 4, 1]], ["tile_rc", "sp", [-1, 1]], ["tile_ry", "sp", [-1, 3]], ["tile_rx", "sp", [-1, 3]], ["auto_unroll_max_step", "ot", 0], ["unroll_explicit", "ot", 1]]}, "result": [[0.00015760577338272262], 0, 2.028995990753174, 1674702890.7355394], "version": 0.2, "tvm_version": "0.11.dev0"}
{"input": ["cuda -keys=cuda,gpu -arch=sm_86 -max_num_threads=1024 -thread_warp_size=32", "conv2d_nchw.cuda", [["TENSOR", [1, 12, 208, 208], "float16"], ["TENSOR", [24, 12, 3, 3], "float16"], [1, 1], [1, 1, 1, 1], [1, 1], "float16"], {}], "config": {"index": 141782277, "code_hash": null, "entity": [["tile_f", "sp", [-1, 2, 2, 2]], ["tile_y", "sp", [-1, 1, 4, 1]], ["tile_x", "sp", [-1, 1, 4, 2]], ["tile_rc", "sp", [-1, 1]], ["tile_ry", "sp", [-1, 3]], ["tile_rx", "sp", [-1, 3]], ["auto_unroll_max_step", "ot", 0], ["unroll_explicit", "ot", 1]]}, "result": [[9.704943921382152e-05], 0, 2.135770797729492, 1674702892.324312], "version": 0.2, "tvm_version": "0.11.dev0"}
{"input": ["cuda -keys=cuda,gpu -arch=sm_86 -max_num_threads=1024 -thread_warp_size=32", "conv2d_nchw.cuda", [["TENSOR", [1, 12, 208, 208], "float16"], ["TENSOR", [24, 12, 3, 3], "float16"], [1, 1], [1, 1, 1, 1], [1, 1], "float16"], {}], "config": {"index": 66517706, "code_hash": null, "entity": [["tile_f", "sp", [-1, 3, 8, 1]], ["tile_y", "sp", [-1, 2, 2, 1]], ["tile_x", "sp", [-1, 1, 4, 2]], ["tile_rc", "sp", [-1, 1]], ["tile_ry", "sp", [-1, 3]], ["tile_rx", "sp", [-1, 3]], ["auto_unroll_max_step", "ot", 512], ["unroll_explicit", "ot", 0]]}, "result": [[8.427382714110094e-05], 0, 2.1319870948791504, 1674702894.5296621], "version": 0.2, "tvm_version": "0.11.dev0"}
{"input": ["cuda -keys=cuda,gpu -arch=sm_86 -max_num_threads=1024 -thread_warp_size=32", "conv2d_nchw.cuda", [["TENSOR", [1, 12, 208, 208], "float16"], ["TENSOR", [24, 12, 3, 3], "float16"], [1, 1], [1, 1, 1, 1], [1, 1], "float16"], {}], "config": {"index": 66517628, "code_hash": null, "entity": [["tile_f", "sp", [-1, 2, 12, 1]], ["tile_y", "sp", [-1, 1, 2, 1]], ["tile_x", "sp", [-1, 1, 4, 2]], ["tile_rc", "sp", [-1, 1]], ["tile_ry", "sp", [-1, 3]], ["tile_rx", "sp", [-1, 3]], ["auto_unroll_max_step", "ot", 512], ["unroll_explicit", "ot", 0]]}, "result": [[0.00014583467075306479], 0, 2.10386061668396, 1674702895.969979], "version": 0.2, "tvm_version": "0.11.dev0"}
{"input": ["cuda -keys=cuda,gpu -arch=sm_86 -max_num_threads=1024 -thread_warp_size=32", "conv2d_nchw.cuda", [["TENSOR", [1, 12, 208, 208], "float16"], ["TENSOR", [24, 12, 3, 3], "float16"], [1, 1], [1, 1, 1, 1], [1, 1], "float16"], {}], "config": {"index": 141782368, "code_hash": null, "entity": [["tile_f", "sp", [-1, 1, 1, 3]], ["tile_y", "sp", [-1, 2, 4, 1]], ["tile_x", "sp", [-1, 1, 4, 2]], ["tile_rc", "sp", [-1, 1]], ["tile_ry", "sp", [-1, 3]], ["tile_rx", "sp", [-1, 3]], ["auto_unroll_max_step", "ot", 0], ["unroll_explicit", "ot", 1]]}, "result": [[0.00021867508078927774], 0, 2.0453896522521973, 1674702897.4934273], "version": 0.2, "tvm_version": "0.11.dev0"}
{"input": ["cuda -keys=cuda,gpu -arch=sm_86 -max_num_threads=1024 -thread_warp_size=32", "conv2d_nchw.cuda", [["TENSOR", [1, 12, 208, 208], "float16"], ["TENSOR", [24, 12, 3, 3], "float16"], [1, 1], [1, 1, 1, 1], [1, 1], "float16"], {}], "config": {"index": 179414263, "code_hash": null, "entity": [["tile_f", "sp", [-1, 2, 6, 1]], ["tile_y", "sp", [-1, 1, 4, 1]], ["tile_x", "sp", [-1, 1, 4, 2]], ["tile_rc", "sp", [-1, 1]], ["tile_ry", "sp", [-1, 3]], ["tile_rx", "sp", [-1, 3]], ["auto_unroll_max_step", "ot", 512], ["unroll_explicit", "ot", 1]]}, "result": [[0.00014546056583255378], 0, 2.7678639888763428, 1674702899.7050421], "version": 0.2, "tvm_version": "0.11.dev0"}
{"input": ["cuda -keys=cuda,gpu -arch=sm_86 -max_num_threads=1024 -thread_warp_size=32", "conv2d_nchw.cuda", [["TENSOR", [1, 12, 208, 208], "float16"], ["TENSOR", [24, 12, 3, 3], "float16"], [1, 1], [1, 1, 1, 1], [1, 1], "float16"], {}], "config": {"index": 179414372, "code_hash": null, "entity": [["tile_f", "sp", [-1, 1, 2, 3]], ["tile_y", "sp", [-1, 2, 4, 1]], ["tile_x", "sp", [-1, 1, 4, 2]], ["tile_rc", "sp", [-1, 1]], ["tile_ry", "sp", [-1, 3]], ["tile_rx", "sp", [-1, 3]], ["auto_unroll_max_step", "ot", 512], ["unroll_explicit", "ot", 1]]}, "result": [[0.00011440447928775717], 0, 2.199306011199951, 1674702901.8551118], "version": 0.2, "tvm_version": "0.11.dev0"}
{"input": ["cuda -keys=cuda,gpu -arch=sm_86 -max_num_threads=1024 -thread_warp_size=32", "conv2d_nchw.cuda", [["TENSOR", [1, 12, 208, 208], "float16"], ["TENSOR", [24, 12, 3, 3], "float16"], [1, 1], [1, 1, 1, 1], [1, 1], "float16"], {}], "config": {"index": 66630313, "code_hash": null, "entity": [["tile_f", "sp", [-1, 1, 1, 8]], ["tile_y", "sp", [-1, 1, 4, 1]], ["tile_x", "sp", [-1, 1, 26, 2]], ["tile_rc", "sp", [-1, 1]], ["tile_ry", "sp", [-1, 3]], ["tile_rx", "sp", [-1, 3]], ["auto_unroll_max_step", "ot", 512], ["unroll_explicit", "ot", 0]]}, "result": [[6.795125085693191e-05], 0, 2.140958070755005, 1674702903.4990926], "version": 0.2, "tvm_version": "0.11.dev0"}
{"input": ["cuda -keys=cuda,gpu -arch=sm_86 -max_num_threads=1024 -thread_warp_size=32", "conv2d_nchw.cuda", [["TENSOR", [1, 12, 208, 208], "float16"], ["TENSOR", [24, 12, 3, 3], "float16"], [1, 1], [1, 1, 1, 1], [1, 1], "float16"], {}], "config": {"index": 68096908, "code_hash": null, "entity": [["tile_f", "sp", [-1, 2, 12, 1]], ["tile_y", "sp", [-1, 2, 2, 1]], ["tile_x", "sp", [-1, 2, 4, 2]], ["tile_rc", "sp", [-1, 2]], ["tile_ry", "sp", [-1, 3]], ["tile_rx", "sp", [-1, 3]], ["auto_unroll_max_step", "ot", 512], ["unroll_explicit", "ot", 0]]}, "result": [[8.017132273299749e-05], 0, 2.2366602420806885, 1674702905.7078729], "version": 0.2, "tvm_version": "0.11.dev0"}
{"input": ["cuda -keys=cuda,gpu -arch=sm_86 -max_num_threads=1024 -thread_warp_size=32", "conv2d_nchw.cuda", [["TENSOR", [1, 12, 208, 208], "float16"], ["TENSOR", [24, 12, 3, 3], "float16"], [1, 1], [1, 1, 1, 1], [1, 1], "float16"], {}], "config": {"index": 141827107, "code_hash": null, "entity": [["tile_f", "sp", [-1, 1, 1, 6]], ["tile_y", "sp", [-1, 1, 4, 1]], ["tile_x", "sp", [-1, 1, 8, 2]], ["tile_rc", "sp", [-1, 1]], ["tile_ry", "sp", [-1, 3]], ["tile_rx", "sp", [-1, 3]], ["auto_unroll_max_step", "ot", 0], ["unroll_explicit", "ot", 1]]}, "result": [[9.640863629937956e-05], 0, 2.150592565536499, 1674702907.8593934], "version": 0.2, "tvm_version": "0.11.dev0"}
{"input": ["cuda -keys=cuda,gpu -arch=sm_86 -max_num_threads=1024 -thread_warp_size=32", "conv2d_nchw.cuda", [["TENSOR", [1, 12, 208, 208], "float16"], ["TENSOR", [24, 12, 3, 3], "float16"], [1, 1], [1, 1, 1, 1], [1, 1], "float16"], {}], "config": {"index": 28617507, "code_hash": null, "entity": [["tile_f", "sp", [-1, 1, 1, 6]], ["tile_y", "sp", [-1, 1, 4, 1]], ["tile_x", "sp", [-1, 1, 26, 1]], ["tile_rc", "sp", [-1, 1]], ["tile_ry", "sp", [-1, 3]], ["tile_rx", "sp", [-1, 3]], ["auto_unroll_max_step", "ot", 0], ["unroll_explicit", "ot", 0]]}, "result": [[0.00010834514040520216], 0, 2.0401623249053955, 1674702909.4185915], "version": 0.2, "tvm_version": "0.11.dev0"}
{"input": ["cuda -keys=cuda,gpu -arch=sm_86 -max_num_threads=1024 -thread_warp_size=32", "conv2d_nchw.cuda", [["TENSOR", [1, 12, 208, 208], "float16"], ["TENSOR", [24, 12, 3, 3], "float16"], [1, 1], [1, 1, 1, 1], [1, 1], "float16"], {}], "config": {"index": 66518361, "code_hash": null, "entity": [["tile_f", "sp", [-1, 2, 3, 2]], ["tile_y", "sp", [-1, 2, 4, 1]], ["tile_x", "sp", [-1, 1, 4, 2]], ["tile_rc", "sp", [-1, 1]], ["tile_ry", "sp", [-1, 3]], ["tile_rx", "sp", [-1, 3]], ["auto_unroll_max_step", "ot", 512], ["unroll_explicit", "ot", 0]]}, "result": [[8.493207020104838e-05], 0, 2.207427501678467, 1674702912.0934398], "version": 0.2, "tvm_version": "0.11.dev0"}
{"input": ["cuda -keys=cuda,gpu -arch=sm_86 -max_num_threads=1024 -thread_warp_size=32", "conv2d_nchw.cuda", [["TENSOR", [1, 12, 208, 208], "float16"], ["TENSOR", [24, 12, 3, 3], "float16"], [1, 1], [1, 1, 1, 1], [1, 1], "float16"], {}], "config": {"index": 66518263, "code_hash": null, "entity": [["tile_f", "sp", [-1, 2, 6, 1]], ["tile_y", "sp", [-1, 1, 4, 1]], ["tile_x", "sp", [-1, 1, 4, 2]], ["tile_rc", "sp", [-1, 1]], ["tile_ry", "sp", [-1, 3]], ["tile_rx", "sp", [-1, 3]], ["auto_unroll_max_step", "ot", 512], ["unroll_explicit", "ot", 0]]}, "result": [[0.0001708670325203252], 0, 2.3046014308929443, 1674702913.6977577], "version": 0.2, "tvm_version": "0.11.dev0"}
{"input": ["cuda -keys=cuda,gpu -arch=sm_86 -max_num_threads=1024 -thread_warp_size=32", "conv2d_nchw.cuda", [["TENSOR", [1, 12, 208, 208], "float16"], ["TENSOR", [24, 12, 3, 3], "float16"], [1, 1], [1, 1, 1, 1], [1, 1], "float16"], {}], "config": {"index": 141323187, "code_hash": null, "entity": [["tile_f", "sp", [-1, 1, 1, 6]], ["tile_y", "sp", [-1, 2, 4, 1]], ["tile_x", "sp", [-1, 1, 4, 1]], ["tile_rc", "sp", [-1, 1]], ["tile_ry", "sp", [-1, 3]], ["tile_rx", "sp", [-1, 3]], ["auto_unroll_max_step", "ot", 0], ["unroll_explicit", "ot", 1]]}, "result": [[0.00016682769058726674], 0, 2.0573809146881104, 1674702915.2563372], "version": 0.2, "tvm_version": "0.11.dev0"}
{"input": ["cuda -keys=cuda,gpu -arch=sm_86 -max_num_threads=1024 -thread_warp_size=32", "conv2d_nchw.cuda", [["TENSOR", [1, 12, 208, 208], "float16"], ["TENSOR", [24, 12, 3, 3], "float16"], [1, 1], [1, 1, 1, 1], [1, 1], "float16"], {}], "config": {"index": 180992828, "code_hash": null, "entity": [["tile_f", "sp", [-1, 2, 12, 1]], ["tile_y", "sp", [-1, 1, 2, 1]], ["tile_x", "sp", [-1, 2, 4, 2]], ["tile_rc", "sp", [-1, 2]], ["tile_ry", "sp", [-1, 3]], ["tile_rx", "sp", [-1, 3]], ["auto_unroll_max_step", "ot", 512], ["unroll_explicit", "ot", 1]]}, "result": [[7.70301045561808e-05], 0, 2.3498048782348633, 1674702916.8890653], "version": 0.2, "tvm_version": "0.11.dev0"}
{"input": ["cuda -keys=cuda,gpu -arch=sm_86 -max_num_threads=1024 -thread_warp_size=32", "conv2d_nchw.cuda", [["TENSOR", [1, 12, 208, 208], "float16"], ["TENSOR", [24, 12, 3, 3], "float16"], [1, 1], [1, 1, 1, 1], [1, 1], "float16"], {}], "config": {"index": 71232828, "code_hash": null, "entity": [["tile_f", "sp", [-1, 2, 12, 1]], ["tile_y", "sp", [-1, 1, 2, 1]], ["tile_x", "sp", [-1, 2, 4, 2]], ["tile_rc", "sp", [-1, 4]], ["tile_ry", "sp", [-1, 3]], ["tile_rx", "sp", [-1, 3]], ["auto_unroll_max_step", "ot", 512], ["unroll_explicit", "ot", 0]]}, "result": [[6.655933195082949e-05], 0, 2.3492751121520996, 1674702918.5902634], "version": 0.2, "tvm_version": "0.11.dev0"}
{"input": ["cuda -keys=cuda,gpu -arch=sm_86 -max_num_threads=1024 -thread_warp_size=32", "conv2d_nchw.cuda", [["TENSOR", [1, 12, 208, 208], "float16"], ["TENSOR", [24, 12, 3, 3], "float16"], [1, 1], [1, 1, 1, 1], [1, 1], "float16"], {}], "config": {"index": 178969068, "code_hash": null, "entity": [["tile_f", "sp", [-1, 2, 12, 1]], ["tile_y", "sp", [-1, 1, 2, 2]], ["tile_x", "sp", [-1, 2, 4, 1]], ["tile_rc", "sp", [-1, 1]], ["tile_ry", "sp", [-1, 3]], ["tile_rx", "sp", [-1, 3]], ["auto_unroll_max_step", "ot", 512], ["unroll_explicit", "ot", 1]]}, "result": [[0.00011591433482795592], 0, 2.121706008911133, 1674702920.1366212], "version": 0.2, "tvm_version": "0.11.dev0"}
{"input": ["cuda -keys=cuda,gpu -arch=sm_86 -max_num_threads=1024 -thread_warp_size=32", "conv2d_nchw.cuda", [["TENSOR", [1, 12, 208, 208], "float16"], ["TENSOR", [24, 12, 3, 3], "float16"], [1, 1], [1, 1, 1, 1], [1, 1], "float16"], {}], "config": {"index": 141782343, "code_hash": null, "entity": [["tile_f", "sp", [-1, 2, 6, 1]], ["tile_y", "sp", [-1, 2, 4, 1]], ["tile_x", "sp", [-1, 1, 4, 2]], ["tile_rc", "sp", [-1, 1]], ["tile_ry", "sp", [-1, 3]], ["tile_rx", "sp", [-1, 3]], ["auto_unroll_max_step", "ot", 0], ["unroll_explicit", "ot", 1]]}, "result": [[0.00012013741994465307], 0, 2.074448823928833, 1674702921.7146544], "version": 0.2, "tvm_version": "0.11.dev0"}
{"input": ["cuda -keys=cuda,gpu -arch=sm_86 -max_num_threads=1024 -thread_warp_size=32", "conv2d_nchw.cuda", [["TENSOR", [1, 12, 208, 208], "float16"], ["TENSOR", [24, 12, 3, 3], "float16"], [1, 1], [1, 1, 1, 1], [1, 1], "float16"], {}], "config": {"index": 179428743, "code_hash": null, "entity": [["tile_f", "sp", [-1, 2, 6, 1]], ["tile_y", "sp", [-1, 1, 4, 2]], ["tile_x", "sp", [-1, 2, 4, 2]], ["tile_rc", "sp", [-1, 1]], ["tile_ry", "sp", [-1, 3]], ["tile_rx", "sp", [-1, 3]], ["auto_unroll_max_step", "ot", 512], ["unroll_explicit", "ot", 1]]}, "result": [[8.277026244403477e-05], 0, 2.2697932720184326, 1674702923.3448887], "version": 0.2, "tvm_version": "0.11.dev0"}
{"input": ["cuda -keys=cuda,gpu -arch=sm_86 -max_num_threads=1024 -thread_warp_size=32", "conv2d_nchw.cuda", [["TENSOR", [1, 12, 208, 208], "float16"], ["TENSOR", [24, 12, 3, 3], "float16"], [1, 1], [1, 1, 1, 1], [1, 1], "float16"], {}], "config": {"index": 66528826, "code_hash": null, "entity": [["tile_f", "sp", [-1, 3, 8, 1]], ["tile_y", "sp", [-1, 1, 2, 1]], ["tile_x", "sp", [-1, 2, 4, 2]], ["tile_rc", "sp", [-1, 1]], ["tile_ry", "sp", [-1, 3]], ["tile_rx", "sp", [-1, 3]], ["auto_unroll_max_step", "ot", 512], ["unroll_explicit", "ot", 0]]}, "result": [[9.170206769640085e-05], 0, 2.1097755432128906, 1674702924.913817], "version": 0.2, "tvm_version": "0.11.dev0"}
{"input": ["cuda -keys=cuda,gpu -arch=sm_86 -max_num_threads=1024 -thread_warp_size=32", "conv2d_nchw.cuda", [["TENSOR", [1, 12, 208, 208], "float16"], ["TENSOR", [24, 12, 3, 3], "float16"], [1, 1], [1, 1, 1, 1], [1, 1], "float16"], {}], "config": {"index": 28886361, "code_hash": null, "entity": [["tile_f", "sp", [-1, 2, 3, 2]], ["tile_y", "sp", [-1, 2, 4, 1]], ["tile_x", "sp", [-1, 1, 4, 2]], ["tile_rc", "sp", [-1, 1]], ["tile_ry", "sp", [-1, 3]], ["tile_rx", "sp", [-1, 3]], ["auto_unroll_max_step", "ot", 0], ["unroll_explicit", "ot", 0]]}, "result": [[0.0001247685674071041], 0, 2.115476131439209, 1674702926.4904199], "version": 0.2, "tvm_version": "0.11.dev0"}
{"input": ["cuda -keys=cuda,gpu -arch=sm_86 -max_num_threads=1024 -thread_warp_size=32", "conv2d_nchw.cuda", [["TENSOR", [1, 12, 208, 208], "float16"], ["TENSOR", [24, 12, 3, 3], "float16"], [1, 1], [1, 1, 1, 1], [1, 1], "float16"], {}], "config": {"index": 141782351, "code_hash": null, "entity": [["tile_f", "sp", [-1, 2, 1, 2]], ["tile_y", "sp", [-1, 2, 4, 1]], ["tile_x", "sp", [-1, 1, 4, 2]], ["tile_rc", "sp", [-1, 1]], ["tile_ry", "sp", [-1, 3]], ["tile_rx", "sp", [-1, 3]], ["auto_unroll_max_step", "ot", 0], ["unroll_explicit", "ot", 1]]}, "result": [[0.0001875342005068103], 0, 2.082362651824951, 1674702928.030154], "version": 0.2, "tvm_version": "0.11.dev0"}
{"input": ["cuda -keys=cuda,gpu -arch=sm_86 -max_num_threads=1024 -thread_warp_size=32", "conv2d_nchw.cuda", [["TENSOR", [1, 12, 208, 208], "float16"], ["TENSOR", [24, 12, 3, 3], "float16"], [1, 1], [1, 1, 1, 1], [1, 1], "float16"], {}], "config": {"index": 66532743, "code_hash": null, "entity": [["tile_f", "sp", [-1, 2, 6, 1]], ["tile_y", "sp", [-1, 1, 4, 2]], ["tile_x", "sp", [-1, 2, 4, 2]], ["tile_rc", "sp", [-1, 1]], ["tile_ry", "sp", [-1, 3]], ["tile_rx", "sp", [-1, 3]], ["auto_unroll_max_step", "ot", 512], ["unroll_explicit", "ot", 0]]}, "result": [[6.766533051426171e-05], 0, 2.224306344985962, 1674702929.6646268], "version": 0.2, "tvm_version": "0.11.dev0"}
{"input": ["cuda -keys=cuda,gpu -arch=sm_86 -max_num_threads=1024 -thread_warp_size=32", "conv2d_nchw.cuda", [["TENSOR", [1, 12, 208, 208], "float16"], ["TENSOR", [24, 12, 3, 3], "float16"], [1, 1], [1, 1, 1, 1], [1, 1], "float16"], {}], "config": {"index": 69664828, "code_hash": null, "entity": [["tile_f", "sp", [-1, 2, 12, 1]], ["tile_y", "sp", [-1, 1, 2, 1]], ["tile_x", "sp", [-1, 2, 4, 2]], ["tile_rc", "sp", [-1, 3]], ["tile_ry", "sp", [-1, 3]], ["tile_rx", "sp", [-1, 3]], ["auto_unroll_max_step", "ot", 512], ["unroll_explicit", "ot", 0]]}, "result": [[9.314149466192172e-05], 0, 2.2493486404418945, 1674702931.2894378], "version": 0.2, "tvm_version": "0.11.dev0"}
{"input": ["cuda -keys=cuda,gpu -arch=sm_86 -max_num_threads=1024 -thread_warp_size=32", "conv2d_nchw.cuda", [["TENSOR", [1, 12, 208, 208], "float16"], ["TENSOR", [24, 12, 3, 3], "float16"], [1, 1], [1, 1, 1, 1], [1, 1], "float16"], {}], "config": {"index": 179414361, "code_hash": null, "entity": [["tile_f", "sp", [-1, 2, 3, 2]], ["tile_y", "sp", [-1, 2, 4, 1]], ["tile_x", "sp", [-1, 1, 4, 2]], ["tile_rc", "sp", [-1, 1]], ["tile_ry", "sp", [-1, 3]], ["tile_rx", "sp", [-1, 3]], ["auto_unroll_max_step", "ot", 512], ["unroll_explicit", "ot", 1]]}, "result": [[8.422736272373028e-05], 0, 2.3858628273010254, 1674702932.9267528], "version": 0.2, "tvm_version": "0.11.dev0"}
{"input": ["cuda -keys=cuda,gpu -arch=sm_86 -max_num_threads=1024 -thread_warp_size=32", "conv2d_nchw.cuda", [["TENSOR", [1, 12, 208, 208], "float16"], ["TENSOR", [24, 12, 3, 3], "float16"], [1, 1], [1, 1, 1, 1], [1, 1], "float16"], {}], "config": {"index": 141782260, "code_hash": null, "entity": [["tile_f", "sp", [-1, 3, 4, 1]], ["tile_y", "sp", [-1, 1, 4, 1]], ["tile_x", "sp", [-1, 1, 4, 2]], ["tile_rc", "sp", [-1, 1]], ["tile_ry", "sp", [-1, 3]], ["tile_rx", "sp", [-1, 3]], ["auto_unroll_max_step", "ot", 0], ["unroll_explicit", "ot", 1]]}, "result": [[0.00013498752654545452], 0, 1.9972903728485107, 1674702934.4170477], "version": 0.2, "tvm_version": "0.11.dev0"}
{"input": ["cuda -keys=cuda,gpu -arch=sm_86 -max_num_threads=1024 -thread_warp_size=32", "conv2d_nchw.cuda", [["TENSOR", [1, 12, 208, 208], "float16"], ["TENSOR", [24, 12, 3, 3], "float16"], [1, 1], [1, 1, 1, 1], [1, 1], "float16"], {}], "config": {"index": 179417147, "code_hash": null, "entity": [["tile_f", "sp", [-1, 1, 12, 1]], ["tile_y", "sp", [-1, 2, 2, 2]], ["tile_x", "sp", [-1, 1, 4, 2]], ["tile_rc", "sp", [-1, 1]], ["tile_ry", "sp", [-1, 3]], ["tile_rx", "sp", [-1, 3]], ["auto_unroll_max_step", "ot", 512], ["unroll_explicit", "ot", 1]]}, "result": [[8.985337890847073e-05], 0, 2.2503414154052734, 1674702936.0480807], "version": 0.2, "tvm_version": "0.11.dev0"}
{"input": ["cuda -keys=cuda,gpu -arch=sm_86 -max_num_threads=1024 -thread_warp_size=32", "conv2d_nchw.cuda", [["TENSOR", [1, 12, 208, 208], "float16"], ["TENSOR", [24, 12, 3, 3], "float16"], [1, 1], [1, 1, 1, 1], [1, 1], "float16"], {}], "config": {"index": 142073587, "code_hash": null, "entity": [["tile_f", "sp", [-1, 1, 1, 6]], ["tile_y", "sp", [-1, 2, 4, 1]], ["tile_x", "sp", [-1, 1, 4, 4]], ["tile_rc", "sp", [-1, 1]], ["tile_ry", "sp", [-1, 3]], ["tile_rx", "sp", [-1, 3]], ["auto_unroll_max_step", "ot", 0], ["unroll_explicit", "ot", 1]]}, "result": [[0.00017402334164872736], 0, 3.1957905292510986, 1674702940.5064895], "version": 0.2, "tvm_version": "0.11.dev0"}
{"input": ["cuda -keys=cuda,gpu -arch=sm_86 -max_num_threads=1024 -thread_warp_size=32", "conv2d_nchw.cuda", [["TENSOR", [1, 12, 208, 208], "float16"], ["TENSOR", [24, 12, 3, 3], "float16"], [1, 1], [1, 1, 1, 1], [1, 1], "float16"], {}], "config": {"index": 141323190, "code_hash": null, "entity": [["tile_f", "sp", [-1, 1, 2, 6]], ["tile_y", "sp", [-1, 2, 4, 1]], ["tile_x", "sp", [-1, 1, 4, 1]], ["tile_rc", "sp", [-1, 1]], ["tile_ry", "sp", [-1, 3]], ["tile_rx", "sp", [-1, 3]], ["auto_unroll_max_step", "ot", 0], ["unroll_explicit", "ot", 1]]}, "result": [[0.0001045897802998576], 0, 2.1240315437316895, 1674702942.1178644], "version": 0.2, "tvm_version": "0.11.dev0"}
{"input": ["cuda -keys=cuda,gpu -arch=sm_86 -max_num_threads=1024 -thread_warp_size=32", "conv2d_nchw.cuda", [["TENSOR", [1, 12, 208, 208], "float16"], ["TENSOR", [24, 12, 3, 3], "float16"], [1, 1], [1, 1, 1, 1], [1, 1], "float16"], {}], "config": {"index": 66517707, "code_hash": null, "entity": [["tile_f", "sp", [-1, 1, 12, 1]], ["tile_y", "sp", [-1, 2, 2, 1]], ["tile_x", "sp", [-1, 1, 4, 2]], ["tile_rc", "sp", [-1, 1]], ["tile_ry", "sp", [-1, 3]], ["tile_rx", "sp", [-1, 3]], ["auto_unroll_max_step", "ot", 512], ["unroll_explicit", "ot", 0]]}, "result": [[0.0001682664066929709], 0, 2.2497799396514893, 1674702943.6361485], "version": 0.2, "tvm_version": "0.11.dev0"}
{"input": ["cuda -keys=cuda,gpu -arch=sm_86 -max_num_threads=1024 -thread_warp_size=32", "conv2d_nchw.cuda", [["TENSOR", [1, 12, 208, 208], "float16"], ["TENSOR", [24, 12, 3, 3], "float16"], [1, 1], [1, 1, 1, 1], [1, 1], "float16"], {}], "config": {"index": 66529540, "code_hash": null, "entity": [["tile_f", "sp", [-1, 3, 4, 1]], ["tile_y", "sp", [-1, 2, 4, 1]], ["tile_x", "sp", [-1, 2, 4, 2]], ["tile_rc", "sp", [-1, 1]], ["tile_ry", "sp", [-1, 3]], ["tile_rx", "sp", [-1, 3]], ["auto_unroll_max_step", "ot", 512], ["unroll_explicit", "ot", 0]]}, "result": [[8.383894833153928e-05], 0, 2.2612760066986084, 1674702945.266358], "version": 0.2, "tvm_version": "0.11.dev0"}
{"input": ["cuda -keys=cuda,gpu -arch=sm_86 -max_num_threads=1024 -thread_warp_size=32", "conv2d_nchw.cuda", [["TENSOR", [1, 12, 208, 208], "float16"], ["TENSOR", [24, 12, 3, 3], "float16"], [1, 1], [1, 1, 1, 1], [1, 1], "float16"], {}], "config": {"index": 66529460, "code_hash": null, "entity": [["tile_f", "sp", [-1, 3, 4, 1]], ["tile_y", "sp", [-1, 1, 4, 1]], ["tile_x", "sp", [-1, 2, 4, 2]], ["tile_rc", "sp", [-1, 1]], ["tile_ry", "sp", [-1, 3]], ["tile_rx", "sp", [-1, 3]], ["auto_unroll_max_step", "ot", 512], ["unroll_explicit", "ot", 0]]}, "result": [[0.0001004141700641131], 0, 2.1066770553588867, 1674702946.82721], "version": 0.2, "tvm_version": "0.11.dev0"}
{"input": ["cuda -keys=cuda,gpu -arch=sm_86 -max_num_threads=1024 -thread_warp_size=32", "conv2d_nchw.cuda", [["TENSOR", [1, 12, 208, 208], "float16"], ["TENSOR", [24, 12, 3, 3], "float16"], [1, 1], [1, 1, 1, 1], [1, 1], "float16"], {}], "config": {"index": 66528108, "code_hash": null, "entity": [["tile_f", "sp", [-1, 2, 12, 1]], ["tile_y", "sp", [-1, 2, 1, 1]], ["tile_x", "sp", [-1, 2, 4, 2]], ["tile_rc", "sp", [-1, 1]], ["tile_ry", "sp", [-1, 3]], ["tile_rx", "sp", [-1, 3]], ["auto_unroll_max_step", "ot", 512], ["unroll_explicit", "ot", 0]]}, "result": [[8.91011722535916e-05], 0, 2.147089719772339, 1674702948.4153633], "version": 0.2, "tvm_version": "0.11.dev0"}
{"input": ["cuda -keys=cuda,gpu -arch=sm_86 -max_num_threads=1024 -thread_warp_size=32", "conv2d_nchw.cuda", [["TENSOR", [1, 12, 208, 208], "float16"], ["TENSOR", [24, 12, 3, 3], "float16"], [1, 1], [1, 1, 1, 1], [1, 1], "float16"], {}], "config": {"index": 66518357, "code_hash": null, "entity": [["tile_f", "sp", [-1, 2, 2, 2]], ["tile_y", "sp", [-1, 2, 4, 1]], ["tile_x", "sp", [-1, 1, 4, 2]], ["tile_rc", "sp", [-1, 1]], ["tile_ry", "sp", [-1, 3]], ["tile_rx", "sp", [-1, 3]], ["auto_unroll_max_step", "ot", 512], ["unroll_explicit", "ot", 0]]}, "result": [[8.767871344866071e-05], 0, 2.1968612670898438, 1674702950.0155702], "version": 0.2, "tvm_version": "0.11.dev0"}
{"input": ["cuda -keys=cuda,gpu -arch=sm_86 -max_num_threads=1024 -thread_warp_size=32", "conv2d_nchw.cuda", [["TENSOR", [1, 12, 208, 208], "float16"], ["TENSOR", [24, 12, 3, 3], "float16"], [1, 1], [1, 1, 1, 1], [1, 1], "float16"], {}], "config": {"index": 57120908, "code_hash": null, "entity": [["tile_f", "sp", [-1, 2, 12, 1]], ["tile_y", "sp", [-1, 2, 2, 1]], ["tile_x", "sp", [-1, 2, 4, 2]], ["tile_rc", "sp", [-1, 1]], ["tile_ry", "sp", [-1, 1]], ["tile_rx", "sp", [-1, 3]], ["auto_unroll_max_step", "ot", 512], ["unroll_explicit", "ot", 0]]}, "result": [[8.168761443450393e-05], 0, 2.171505928039551, 1674702951.6054053], "version": 0.2, "tvm_version": "0.11.dev0"}
{"input": ["cuda -keys=cuda,gpu -arch=sm_86 -max_num_threads=1024 -thread_warp_size=32", "conv2d_nchw.cuda", [["TENSOR", [1, 12, 208, 208], "float16"], ["TENSOR", [24, 12, 3, 3], "float16"], [1, 1], [1, 1, 1, 1], [1, 1], "float16"], {}], "config": {"index": 141323110, "code_hash": null, "entity": [["tile_f", "sp", [-1, 1, 2, 6]], ["tile_y", "sp", [-1, 1, 4, 1]], ["tile_x", "sp", [-1, 1, 4, 1]], ["tile_rc", "sp", [-1, 1]], ["tile_ry", "sp", [-1, 3]], ["tile_rx", "sp", [-1, 3]], ["auto_unroll_max_step", "ot", 0], ["unroll_explicit", "ot", 1]]}, "result": [[0.00015861377694105427], 0, 2.090364456176758, 1674702953.1609638], "version": 0.2, "tvm_version": "0.11.dev0"}
{"input": ["cuda -keys=cuda,gpu -arch=sm_86 -max_num_threads=1024 -thread_warp_size=32", "conv2d_nchw.cuda", [["TENSOR", [1, 12, 208, 208], "float16"], ["TENSOR", [24, 12, 3, 3], "float16"], [1, 1], [1, 1, 1, 1], [1, 1], "float16"], {}], "config": {"index": 141785637, "code_hash": null, "entity": [["tile_f", "sp", [-1, 2, 2, 2]], ["tile_y", "sp", [-1, 2, 4, 2]], ["tile_x", "sp", [-1, 1, 4, 2]], ["tile_rc", "sp", [-1, 1]], ["tile_ry", "sp", [-1, 3]], ["tile_rx", "sp", [-1, 3]], ["auto_unroll_max_step", "ot", 0], ["unroll_explicit", "ot", 1]]}, "result": [[0.00010757024833508587], 0, 2.2333600521087646, 1674702954.7516792], "version": 0.2, "tvm_version": "0.11.dev0"}
{"input": ["cuda -keys=cuda,gpu -arch=sm_86 -max_num_threads=1024 -thread_warp_size=32", "conv2d_nchw.cuda", [["TENSOR", [1, 12, 208, 208], "float16"], ["TENSOR", [24, 12, 3, 3], "float16"], [1, 1], [1, 1, 1, 1], [1, 1], "float16"], {}], "config": {"index": 179145513, "code_hash": null, "entity": [["tile_f", "sp", [-1, 1, 1, 8]], ["tile_y", "sp", [-1, 1, 4, 1]], ["tile_x", "sp", [-1, 1, 26, 1]], ["tile_rc", "sp", [-1, 1]], ["tile_ry", "sp", [-1, 3]], ["tile_rx", "sp", [-1, 3]], ["auto_unroll_max_step", "ot", 512], ["unroll_explicit", "ot", 1]]}, "result": [[9.671163716535432e-05], 0, 2.162977457046509, 1674702956.3532805], "version": 0.2, "tvm_version": "0.11.dev0"}
{"input": ["cuda -keys=cuda,gpu -arch=sm_86 -max_num_threads=1024 -thread_warp_size=32", "conv2d_nchw.cuda", [["TENSOR", [1, 12, 208, 208], "float16"], ["TENSOR", [24, 12, 3, 3], "float16"], [1, 1], [1, 1, 1, 1], [1, 1], "float16"], {}], "config": {"index": 179413707, "code_hash": null, "entity": [["tile_f", "sp", [-1, 1, 12, 1]], ["tile_y", "sp", [-1, 2, 2, 1]], ["tile_x", "sp", [-1, 1, 4, 2]], ["tile_rc", "sp", [-1, 1]], ["tile_ry", "sp", [-1, 3]], ["tile_rx", "sp", [-1, 3]], ["auto_unroll_max_step", "ot", 512], ["unroll_explicit", "ot", 1]]}, "result": [[0.00013622394834177085], 0, 2.9907405376434326, 1674702958.0365422], "version": 0.2, "tvm_version": "0.11.dev0"}
{"input": ["cuda -keys=cuda,gpu -arch=sm_86 -max_num_threads=1024 -thread_warp_size=32", "conv2d_nchw.cuda", [["TENSOR", [1, 12, 208, 208], "float16"], ["TENSOR", [24, 12, 3, 3], "float16"], [1, 1], [1, 1, 1, 1], [1, 1], "float16"], {}], "config": {"index": 66518344, "code_hash": null, "entity": [["tile_f", "sp", [-1, 4, 6, 1]], ["tile_y", "sp", [-1, 2, 4, 1]], ["tile_x", "sp", [-1, 1, 4, 2]], ["tile_rc", "sp", [-1, 1]], ["tile_ry", "sp", [-1, 3]], ["tile_rx", "sp", [-1, 3]], ["auto_unroll_max_step", "ot", 512], ["unroll_explicit", "ot", 0]]}, "result": [[9.947615808336581e-05], 0, 2.1918163299560547, 1674702959.6605859], "version": 0.2, "tvm_version": "0.11.dev0"}
{"input": ["cuda -keys=cuda,gpu -arch=sm_86 -max_num_threads=1024 -thread_warp_size=32", "conv2d_nchw.cuda", [["TENSOR", [1, 12, 208, 208], "float16"], ["TENSOR", [24, 12, 3, 3], "float16"], [1, 1], [1, 1, 1, 1], [1, 1], "float16"], {}], "config": {"index": 95851450, "code_hash": null, "entity": [["tile_f", "sp", [-1, 3, 2, 1]], ["tile_y", "sp", [-1, 52, 4, 1]], ["tile_x", "sp", [-1, 1, 4, 1]], ["tile_rc", "sp", [-1, 2]], ["tile_ry", "sp", [-1, 1]], ["tile_rx", "sp", [-1, 3]], ["auto_unroll_max_step", "ot", 1500], ["unroll_explicit", "ot", 0]]}, "result": [[0.00017021617826847986], 0, 3.181506872177124, 1674702961.281853], "version": 0.2, "tvm_version": "0.11.dev0"}
{"input": ["cuda -keys=cuda,gpu -arch=sm_86 -max_num_threads=1024 -thread_warp_size=32", "conv2d_nchw.cuda", [["TENSOR", [1, 12, 208, 208], "float16"], ["TENSOR", [24, 12, 3, 3], "float16"], [1, 1], [1, 1, 1, 1], [1, 1], "float16"], {}], "config": {"index": 162288951, "code_hash": null, "entity": [["tile_f", "sp", [-1, 2, 2, 6]], ["tile_y", "sp", [-1, 2, 2, 1]], ["tile_x", "sp", [-1, 2, 26, 2]], ["tile_rc", "sp", [-1, 2]], ["tile_ry", "sp", [-1, 3]], ["tile_rx", "sp", [-1, 1]], ["auto_unroll_max_step", "ot", 512], ["unroll_explicit", "ot", 1]]}, "result": [[6.232249711384055e-05], 0, 3.6842005252838135, 1674702987.962601], "version": 0.2, "tvm_version": "0.11.dev0"}
{"input": ["cuda -keys=cuda,gpu -arch=sm_86 -max_num_threads=1024 -thread_warp_size=32", "conv2d_nchw.cuda", [["TENSOR", [1, 12, 208, 208], "float16"], ["TENSOR", [24, 12, 3, 3], "float16"], [1, 1], [1, 1, 1, 1], [1, 1], "float16"], {}], "config": {"index": 162292391, "code_hash": null, "entity": [["tile_f", "sp", [-1, 2, 2, 6]], ["tile_y", "sp", [-1, 2, 2, 2]], ["tile_x", "sp", [-1, 2, 26, 2]], ["tile_rc", "sp", [-1, 2]], ["tile_ry", "sp", [-1, 3]], ["tile_rx", "sp", [-1, 1]], ["auto_unroll_max_step", "ot", 512], ["unroll_explicit", "ot", 1]]}, "result": [[6.176126992037267e-05], 0, 2.8273613452911377, 1674702989.4583302], "version": 0.2, "tvm_version": "0.11.dev0"}
{"input": ["cuda -keys=cuda,gpu -arch=sm_86 -max_num_threads=1024 -thread_warp_size=32", "conv2d_nchw.cuda", [["TENSOR", [1, 24, 208, 208], "float16"], ["TENSOR", [48, 24, 3, 3], "float16"], [2, 2], [1, 1, 1, 1], [1, 1], "float16"], {}], "config": {"index": 36002421, "code_hash": null, "entity": [["tile_f", "sp", [-1, 8, 3, 1]], ["tile_y", "sp", [-1, 1, 4, 2]], ["tile_x", "sp", [-1, 1, 4, 1]], ["tile_rc", "sp", [-1, 1]], ["tile_ry", "sp", [-1, 3]], ["tile_rx", "sp", [-1, 1]], ["auto_unroll_max_step", "ot", 512], ["unroll_explicit", "ot", 0]]}, "result": [[0.00018556175215032417], 0, 3.342991828918457, 1674703105.09115], "version": 0.2, "tvm_version": "0.11.dev0"}
{"input": ["cuda -keys=cuda,gpu -arch=sm_86 -max_num_threads=1024 -thread_warp_size=32", "conv2d_nchw.cuda", [["TENSOR", [1, 24, 208, 208], "float16"], ["TENSOR", [48, 24, 3, 3], "float16"], [2, 2], [1, 1, 1, 1], [1, 1], "float16"], {}], "config": {"index": 7330421, "code_hash": null, "entity": [["tile_f", "sp", [-1, 8, 3, 1]], ["tile_y", "sp", [-1, 1, 4, 2]], ["tile_x", "sp", [-1, 1, 4, 1]], ["tile_rc", "sp", [-1, 1]], ["tile_ry", "sp", [-1, 3]], ["tile_rx", "sp", [-1, 1]], ["auto_unroll_max_step", "ot", 0], ["unroll_explicit", "ot", 0]]}, "result": [[0.00018752450801796025], 0, 2.228398323059082, 1674703106.6408522], "version": 0.2, "tvm_version": "0.11.dev0"}
{"input": ["cuda -keys=cuda,gpu -arch=sm_86 -max_num_threads=1024 -thread_warp_size=32", "conv2d_nchw.cuda", [["TENSOR", [1, 24, 208, 208], "float16"], ["TENSOR", [48, 24, 3, 3], "float16"], [2, 2], [1, 1, 1, 1], [1, 1], "float16"], {}], "config": {"index": 28834421, "code_hash": null, "entity": [["tile_f", "sp", [-1, 8, 3, 1]], ["tile_y", "sp", [-1, 1, 4, 2]], ["tile_x", "sp", [-1, 1, 4, 1]], ["tile_rc", "sp", [-1, 1]], ["tile_ry", "sp", [-1, 1]], ["tile_rx", "sp", [-1, 1]], ["auto_unroll_max_step", "ot", 512], ["unroll_explicit", "ot", 0]]}, "result": [[0.0002734079261949391], 0, 2.318815231323242, 1674703108.172344], "version": 0.2, "tvm_version": "0.11.dev0"}
{"input": ["cuda -keys=cuda,gpu -arch=sm_86 -max_num_threads=1024 -thread_warp_size=32", "conv2d_nchw.cuda", [["TENSOR", [1, 24, 208, 208], "float16"], ["TENSOR", [48, 24, 3, 3], "float16"], [2, 2], [1, 1, 1, 1], [1, 1], "float16"], {}], "config": {"index": 162421, "code_hash": null, "entity": [["tile_f", "sp", [-1, 8, 3, 1]], ["tile_y", "sp", [-1, 1, 4, 2]], ["tile_x", "sp", [-1, 1, 4, 1]], ["tile_rc", "sp", [-1, 1]], ["tile_ry", "sp", [-1, 1]], ["tile_rx", "sp", [-1, 1]], ["auto_unroll_max_step", "ot", 0], ["unroll_explicit", "ot", 0]]}, "result": [[0.0003939877452063698], 0, 2.2631397247314453, 1674703109.7460327], "version": 0.2, "tvm_version": "0.11.dev0"}
{"input": ["cuda -keys=cuda,gpu -arch=sm_86 -max_num_threads=1024 -thread_warp_size=32", "conv2d_nchw.cuda", [["TENSOR", [1, 24, 208, 208], "float16"], ["TENSOR", [48, 24, 3, 3], "float16"], [2, 2], [1, 1, 1, 1], [1, 1], "float16"], {}], "config": {"index": 28763581, "code_hash": null, "entity": [["tile_f", "sp", [-1, 8, 3, 1]], ["tile_y", "sp", [-1, 1, 4, 1]], ["tile_x", "sp", [-1, 1, 2, 1]], ["tile_rc", "sp", [-1, 1]], ["tile_ry", "sp", [-1, 1]], ["tile_rx", "sp", [-1, 1]], ["auto_unroll_max_step", "ot", 512], ["unroll_explicit", "ot", 0]]}, "result": [[0.000391812887933998], 0, 2.0626590251922607, 1674703111.2312903], "version": 0.2, "tvm_version": "0.11.dev0"}
{"input": ["cuda -keys=cuda,gpu -arch=sm_86 -max_num_threads=1024 -thread_warp_size=32", "conv2d_nchw.cuda", [["TENSOR", [1, 24, 208, 208], "float16"], ["TENSOR", [48, 24, 3, 3], "float16"], [2, 2], [1, 1, 1, 1], [1, 1], "float16"], {}], "config": {"index": 50338421, "code_hash": null, "entity": [["tile_f", "sp", [-1, 8, 3, 1]], ["tile_y", "sp", [-1, 1, 4, 2]], ["tile_x", "sp", [-1, 1, 4, 1]], ["tile_rc", "sp", [-1, 1]], ["tile_ry", "sp", [-1, 3]], ["tile_rx", "sp", [-1, 3]], ["auto_unroll_max_step", "ot", 512], ["unroll_explicit", "ot", 0]]}, "result": [[0.00016242293033951033], 0, 2.2718684673309326, 1674703112.8077104], "version": 0.2, "tvm_version": "0.11.dev0"}
{"input": ["cuda -keys=cuda,gpu -arch=sm_86 -max_num_threads=1024 -thread_warp_size=32", "conv2d_nchw.cuda", [["TENSOR", [1, 24, 208, 208], "float16"], ["TENSOR", [48, 24, 3, 3], "float16"], [2, 2], [1, 1, 1, 1], [1, 1], "float16"], {}], "config": {"index": 35935221, "code_hash": null, "entity": [["tile_f", "sp", [-1, 8, 3, 1]], ["tile_y", "sp", [-1, 1, 4, 2]], ["tile_x", "sp", [-1, 1, 2, 1]], ["tile_rc", "sp", [-1, 1]], ["tile_ry", "sp", [-1, 3]], ["tile_rx", "sp", [-1, 1]], ["auto_unroll_max_step", "ot", 512], ["unroll_explicit", "ot", 0]]}, "result": [[0.0002225998156331229], 0, 2.18247389793396, 1674703114.3664262], "version": 0.2, "tvm_version": "0.11.dev0"}
{"input": ["cuda -keys=cuda,gpu -arch=sm_86 -max_num_threads=1024 -thread_warp_size=32", "conv2d_nchw.cuda", [["TENSOR", [1, 24, 208, 208], "float16"], ["TENSOR", [48, 24, 3, 3], "float16"], [2, 2], [1, 1, 1, 1], [1, 1], "float16"], {}], "config": {"index": 43458105, "code_hash": null, "entity": [["tile_f", "sp", [-1, 8, 1, 1]], ["tile_y", "sp", [-1, 2, 4, 1]], ["tile_x", "sp", [-1, 1, 4, 2]], ["tile_rc", "sp", [-1, 1]], ["tile_ry", "sp", [-1, 1]], ["tile_rx", "sp", [-1, 3]], ["auto_unroll_max_step", "ot", 512], ["unroll_explicit", "ot", 0]]}, "result": [[0.0005967228561759729], 0, 2.3634376525878906, 1674703115.7902815], "version": 0.2, "tvm_version": "0.11.dev0"}
{"input": ["cuda -keys=cuda,gpu -arch=sm_86 -max_num_threads=1024 -thread_warp_size=32", "conv2d_nchw.cuda", [["TENSOR", [1, 24, 208, 208], "float16"], ["TENSOR", [48, 24, 3, 3], "float16"], [2, 2], [1, 1, 1, 1], [1, 1], "float16"], {}], "config": {"index": 14786105, "code_hash": null, "entity": [["tile_f", "sp", [-1, 8, 1, 1]], ["tile_y", "sp", [-1, 2, 4, 1]], ["tile_x", "sp", [-1, 1, 4, 2]], ["tile_rc", "sp", [-1, 1]], ["tile_ry", "sp", [-1, 1]], ["tile_rx", "sp", [-1, 3]], ["auto_unroll_max_step", "ot", 0], ["unroll_explicit", "ot", 0]]}, "result": [[0.000659830559976247], 0, 1.9210140705108643, 1674703117.2820888], "version": 0.2, "tvm_version": "0.11.dev0"}
{"input": ["cuda -keys=cuda,gpu -arch=sm_86 -max_num_threads=1024 -thread_warp_size=32", "conv2d_nchw.cuda", [["TENSOR", [1, 24, 208, 208], "float16"], ["TENSOR", [48, 24, 3, 3], "float16"], [2, 2], [1, 1, 1, 1], [1, 1], "float16"], {}], "config": {"index": 28830865, "code_hash": null, "entity": [["tile_f", "sp", [-1, 1, 6, 4]], ["tile_y", "sp", [-1, 1, 4, 1]], ["tile_x", "sp", [-1, 1, 4, 1]], ["tile_rc", "sp", [-1, 1]], ["tile_ry", "sp", [-1, 1]], ["tile_rx", "sp", [-1, 1]], ["auto_unroll_max_step", "ot", 512], ["unroll_explicit", "ot", 0]]}, "result": [[0.0003802212527743527], 0, 2.2058894634246826, 1674703118.8742864], "version": 0.2, "tvm_version": "0.11.dev0"}
{"input": ["cuda -keys=cuda,gpu -arch=sm_86 -max_num_threads=1024 -thread_warp_size=32", "conv2d_nchw.cuda", [["TENSOR", [1, 24, 208, 208], "float16"], ["TENSOR", [48, 24, 3, 3], "float16"], [2, 2], [1, 1, 1, 1], [1, 1], "float16"], {}], "config": {"index": 7326820, "code_hash": null, "entity": [["tile_f", "sp", [-1, 2, 3, 2]], ["tile_y", "sp", [-1, 1, 4, 1]], ["tile_x", "sp", [-1, 1, 4, 1]], ["tile_rc", "sp", [-1, 1]], ["tile_ry", "sp", [-1, 3]], ["tile_rx", "sp", [-1, 1]], ["auto_unroll_max_step", "ot", 0], ["unroll_explicit", "ot", 0]]}, "result": [[0.0003256183277530735], 0, 2.1173994541168213, 1674703120.487941], "version": 0.2, "tvm_version": "0.11.dev0"}
{"input": ["cuda -keys=cuda,gpu -arch=sm_86 -max_num_threads=1024 -thread_warp_size=32", "conv2d_nchw.cuda", [["TENSOR", [1, 24, 208, 208], "float16"], ["TENSOR", [48, 24, 3, 3], "float16"], [2, 2], [1, 1, 1, 1], [1, 1], "float16"], {}], "config": {"index": 93346421, "code_hash": null, "entity": [["tile_f", "sp", [-1, 8, 3, 1]], ["tile_y", "sp", [-1, 1, 4, 2]], ["tile_x", "sp", [-1, 1, 4, 1]], ["tile_rc", "sp", [-1, 1]], ["tile_ry", "sp", [-1, 3]], ["tile_rx", "sp", [-1, 1]], ["auto_unroll_max_step", "ot", 0], ["unroll_explicit", "ot", 1]]}, "result": [[0.00020399684137157508], 0, 2.2204694747924805, 1674703122.1360176], "version": 0.2, "tvm_version": "0.11.dev0"}
{"input": ["cuda -keys=cuda,gpu -arch=sm_86 -max_num_threads=1024 -thread_warp_size=32", "conv2d_nchw.cuda", [["TENSOR", [1, 24, 208, 208], "float16"], ["TENSOR", [48, 24, 3, 3], "float16"], [2, 2], [1, 1, 1, 1], [1, 1], "float16"], {}], "config": {"index": 64670781, "code_hash": null, "entity": [["tile_f", "sp", [-1, 8, 3, 1]], ["tile_y", "sp", [-1, 1, 4, 1]], ["tile_x", "sp", [-1, 1, 4, 1]], ["tile_rc", "sp", [-1, 1]], ["tile_ry", "sp", [-1, 3]], ["tile_rx", "sp", [-1, 1]], ["auto_unroll_max_step", "ot", 1500], ["unroll_explicit", "ot", 0]]}, "result": [[0.00031651336899224804], 0, 2.119105339050293, 1674703123.736934], "version": 0.2, "tvm_version": "0.11.dev0"}
{"input": ["cuda -keys=cuda,gpu -arch=sm_86 -max_num_threads=1024 -thread_warp_size=32", "conv2d_nchw.cuda", [["TENSOR", [1, 24, 208, 208], "float16"], ["TENSOR", [48, 24, 3, 3], "float16"], [2, 2], [1, 1, 1, 1], [1, 1], "float16"], {}], "config": {"index": 157956, "code_hash": null, "entity": [["tile_f", "sp", [-1, 6, 8, 1]], ["tile_y", "sp", [-1, 1, 2, 1]], ["tile_x", "sp", [-1, 1, 4, 1]], ["tile_rc", "sp", [-1, 1]], ["tile_ry", "sp", [-1, 1]], ["tile_rx", "sp", [-1, 1]], ["auto_unroll_max_step", "ot", 0], ["unroll_explicit", "ot", 0]]}, "result": [[0.0003512867325936199], 0, 2.1973226070404053, 1674703125.3548543], "version": 0.2, "tvm_version": "0.11.dev0"}
{"input": ["cuda -keys=cuda,gpu -arch=sm_86 -max_num_threads=1024 -thread_warp_size=32", "conv2d_nchw.cuda", [["TENSOR", [1, 24, 208, 208], "float16"], ["TENSOR", [48, 24, 3, 3], "float16"], [2, 2], [1, 1, 1, 1], [1, 1], "float16"], {}], "config": {"index": 158916, "code_hash": null, "entity": [["tile_f", "sp", [-1, 12, 2, 1]], ["tile_y", "sp", [-1, 2, 4, 1]], ["tile_x", "sp", [-1, 1, 4, 1]], ["tile_rc", "sp", [-1, 1]], ["tile_ry", "sp", [-1, 1]], ["tile_rx", "sp", [-1, 1]], ["auto_unroll_max_step", "ot", 0], ["unroll_explicit", "ot", 0]]}, "result": [[0.0003908403729238483], 0, 2.666762351989746, 1674703126.9600194], "version": 0.2, "tvm_version": "0.11.dev0"}
{"input": ["cuda -keys=cuda,gpu -arch=sm_86 -max_num_threads=1024 -thread_warp_size=32", "conv2d_nchw.cuda", [["TENSOR", [1, 24, 208, 208], "float16"], ["TENSOR", [48, 24, 3, 3], "float16"], [2, 2], [1, 1, 1, 1], [1, 1], "float16"], {}], "config": {"index": 450105, "code_hash": null, "entity": [["tile_f", "sp", [-1, 8, 1, 1]], ["tile_y", "sp", [-1, 2, 4, 1]], ["tile_x", "sp", [-1, 1, 4, 2]], ["tile_rc", "sp", [-1, 1]], ["tile_ry", "sp", [-1, 1]], ["tile_rx", "sp", [-1, 1]], ["auto_unroll_max_step", "ot", 0], ["unroll_explicit", "ot", 0]]}, "result": [[0.0017881664265625003], 0, 2.456998586654663, 1674703128.4965038], "version": 0.2, "tvm_version": "0.11.dev0"}
{"input": ["cuda -keys=cuda,gpu -arch=sm_86 -max_num_threads=1024 -thread_warp_size=32", "conv2d_nchw.cuda", [["TENSOR", [1, 24, 208, 208], "float16"], ["TENSOR", [48, 24, 3, 3], "float16"], [2, 2], [1, 1, 1, 1], [1, 1], "float16"], {}], "config": {"index": 29122105, "code_hash": null, "entity": [["tile_f", "sp", [-1, 8, 1, 1]], ["tile_y", "sp", [-1, 2, 4, 1]], ["tile_x", "sp", [-1, 1, 4, 2]], ["tile_rc", "sp", [-1, 1]], ["tile_ry", "sp", [-1, 1]], ["tile_rx", "sp", [-1, 1]], ["auto_unroll_max_step", "ot", 512], ["unroll_explicit", "ot", 0]]}, "result": [[0.0007817142629870129], 0, 2.9218876361846924, 1674703131.5498557], "version": 0.2, "tvm_version": "0.11.dev0"}
{"input": ["cuda -keys=cuda,gpu -arch=sm_86 -max_num_threads=1024 -thread_warp_size=32", "conv2d_nchw.cuda", [["TENSOR", [1, 24, 208, 208], "float16"], ["TENSOR", [48, 24, 3, 3], "float16"], [2, 2], [1, 1, 1, 1], [1, 1], "float16"], {}], "config": {"index": 7326914, "code_hash": null, "entity": [["tile_f", "sp", [-1, 6, 2, 1]], ["tile_y", "sp", [-1, 2, 4, 1]], ["tile_x", "sp", [-1, 1, 4, 1]], ["tile_rc", "sp", [-1, 1]], ["tile_ry", "sp", [-1, 3]], ["tile_rx", "sp", [-1, 1]], ["auto_unroll_max_step", "ot", 0], ["unroll_explicit", "ot", 0]]}, "result": [[0.0002227612292235975], 0, 2.3748319149017334, 1674703133.2901633], "version": 0.2, "tvm_version": "0.11.dev0"}
{"input": ["cuda -keys=cuda,gpu -arch=sm_86 -max_num_threads=1024 -thread_warp_size=32", "conv2d_nchw.cuda", [["TENSOR", [1, 24, 208, 208], "float16"], ["TENSOR", [48, 24, 3, 3], "float16"], [2, 2], [1, 1, 1, 1], [1, 1], "float16"], {}], "config": {"index": 35998914, "code_hash": null, "entity": [["tile_f", "sp", [-1, 6, 2, 1]], ["tile_y", "sp", [-1, 2, 4, 1]], ["tile_x", "sp", [-1, 1, 4, 1]], ["tile_rc", "sp", [-1, 1]], ["tile_ry", "sp", [-1, 3]], ["tile_rx", "sp", [-1, 1]], ["auto_unroll_max_step", "ot", 512], ["unroll_explicit", "ot", 0]]}, "result": [[0.00022046010301785432], 0, 2.4842090606689453, 1674703135.052834], "version": 0.2, "tvm_version": "0.11.dev0"}
{"input": ["cuda -keys=cuda,gpu -arch=sm_86 -max_num_threads=1024 -thread_warp_size=32", "conv2d_nchw.cuda", [["TENSOR", [1, 24, 208, 208], "float16"], ["TENSOR", [48, 24, 3, 3], "float16"], [2, 2], [1, 1, 1, 1], [1, 1], "float16"], {}], "config": {"index": 28830007, "code_hash": null, "entity": [["tile_f", "sp", [-1, 1, 8, 3]], ["tile_y", "sp", [-1, 1, 2, 1]], ["tile_x", "sp", [-1, 1, 4, 1]], ["tile_rc", "sp", [-1, 1]], ["tile_ry", "sp", [-1, 1]], ["tile_rx", "sp", [-1, 1]], ["auto_unroll_max_step", "ot", 512], ["unroll_explicit", "ot", 0]]}, "result": [[0.0004767238731060606], 0, 1.95224928855896, 1674703136.445338], "version": 0.2, "tvm_version": "0.11.dev0"}
{"input": ["cuda -keys=cuda,gpu -arch=sm_86 -max_num_threads=1024 -thread_warp_size=32", "conv2d_nchw.cuda", [["TENSOR", [1, 24, 208, 208], "float16"], ["TENSOR", [48, 24, 3, 3], "float16"], [2, 2], [1, 1, 1, 1], [1, 1], "float16"], {}], "config": {"index": 158007, "code_hash": null, "entity": [["tile_f", "sp", [-1, 1, 8, 3]], ["tile_y", "sp", [-1, 1, 2, 1]], ["tile_x", "sp", [-1, 1, 4, 1]], ["tile_rc", "sp", [-1, 1]], ["tile_ry", "sp", [-1, 1]], ["tile_rx", "sp", [-1, 1]], ["auto_unroll_max_step", "ot", 0], ["unroll_explicit", "ot", 0]]}, "result": [[0.0005067754218266254], 0, 2.334421157836914, 1674703138.1387913], "version": 0.2, "tvm_version": "0.11.dev0"}
{"input": ["cuda -keys=cuda,gpu -arch=sm_86 -max_num_threads=1024 -thread_warp_size=32", "conv2d_nchw.cuda", [["TENSOR", [1, 24, 208, 208], "float16"], ["TENSOR", [48, 24, 3, 3], "float16"], [2, 2], [1, 1, 1, 1], [1, 1], "float16"], {}], "config": {"index": 157990, "code_hash": null, "entity": [["tile_f", "sp", [-1, 1, 8, 2]], ["tile_y", "sp", [-1, 1, 2, 1]], ["tile_x", "sp", [-1, 1, 4, 1]], ["tile_rc", "sp", [-1, 1]], ["tile_ry", "sp", [-1, 1]], ["tile_rx", "sp", [-1, 1]], ["auto_unroll_max_step", "ot", 0], ["unroll_explicit", "ot", 0]]}, "result": [[0.000667860714573878], 0, 2.2321784496307373, 1674703139.826863], "version": 0.2, "tvm_version": "0.11.dev0"}
{"input": ["cuda -keys=cuda,gpu -arch=sm_86 -max_num_threads=1024 -thread_warp_size=32", "conv2d_nchw.cuda", [["TENSOR", [1, 24, 208, 208], "float16"], ["TENSOR", [48, 24, 3, 3], "float16"], [2, 2], [1, 1, 1, 1], [1, 1], "float16"], {}], "config": {"index": 35999005, "code_hash": null, "entity": [["tile_f", "sp", [-1, 1, 6, 4]], ["tile_y", "sp", [-1, 2, 4, 1]], ["tile_x", "sp", [-1, 1, 4, 1]], ["tile_rc", "sp", [-1, 1]], ["tile_ry", "sp", [-1, 3]], ["tile_rx", "sp", [-1, 1]], ["auto_unroll_max_step", "ot", 512], ["unroll_explicit", "ot", 0]]}, "result": [[0.0001839287613045738], 0, 2.37606143951416, 1674703141.5895624], "version": 0.2, "tvm_version": "0.11.dev0"}
{"input": ["cuda -keys=cuda,gpu -arch=sm_86 -max_num_threads=1024 -thread_warp_size=32", "conv2d_nchw.cuda", [["TENSOR", [1, 24, 208, 208], "float16"], ["TENSOR", [48, 24, 3, 3], "float16"], [2, 2], [1, 1, 1, 1], [1, 1], "float16"], {}], "config": {"index": 159005, "code_hash": null, "entity": [["tile_f", "sp", [-1, 1, 6, 4]], ["tile_y", "sp", [-1, 2, 4, 1]], ["tile_x", "sp", [-1, 1, 4, 1]], ["tile_rc", "sp", [-1, 1]], ["tile_ry", "sp", [-1, 1]], ["tile_rx", "sp", [-1, 1]], ["auto_unroll_max_step", "ot", 0], ["unroll_explicit", "ot", 0]]}, "result": [[0.0003237563093170618], 0, 2.3308448791503906, 1674703143.3602452], "version": 0.2, "tvm_version": "0.11.dev0"}
{"input": ["cuda -keys=cuda,gpu -arch=sm_86 -max_num_threads=1024 -thread_warp_size=32", "conv2d_nchw.cuda", [["TENSOR", [1, 24, 208, 208], "float16"], ["TENSOR", [48, 24, 3, 3], "float16"], [2, 2], [1, 1, 1, 1], [1, 1], "float16"], {}], "config": {"index": 7326767, "code_hash": null, "entity": [["tile_f", "sp", [-1, 16, 1, 1]], ["tile_y", "sp", [-1, 1, 4, 1]], ["tile_x", "sp", [-1, 1, 4, 1]], ["tile_rc", "sp", [-1, 1]], ["tile_ry", "sp", [-1, 3]], ["tile_rx", "sp", [-1, 1]], ["auto_unroll_max_step", "ot", 0], ["unroll_explicit", "ot", 0]]}, "result": [[0.0004614043011874776], 0, 2.2618932723999023, 1674703144.994621], "version": 0.2, "tvm_version": "0.11.dev0"}
{"input": ["cuda -keys=cuda,gpu -arch=sm_86 -max_num_threads=1024 -thread_warp_size=32", "conv2d_nchw.cuda", [["TENSOR", [1, 24, 208, 208], "float16"], ["TENSOR", [48, 24, 3, 3], "float16"], [2, 2], [1, 1, 1, 1], [1, 1], "float16"], {}], "config": {"index": 43166978, "code_hash": null, "entity": [["tile_f", "sp", [-1, 8, 1, 3]], ["tile_y", "sp", [-1, 2, 4, 1]], ["tile_x", "sp", [-1, 1, 4, 1]], ["tile_rc", "sp", [-1, 1]], ["tile_ry", "sp", [-1, 1]], ["tile_rx", "sp", [-1, 3]], ["auto_unroll_max_step", "ot", 512], ["unroll_explicit", "ot", 0]]}, "result": [[0.00030541219542619543], 0, 2.676121711730957, 1674703146.6944525], "version": 0.2, "tvm_version": "0.11.dev0"}
{"input": ["cuda -keys=cuda,gpu -arch=sm_86 -max_num_threads=1024 -thread_warp_size=32", "conv2d_nchw.cuda", [["TENSOR", [1, 24, 208, 208], "float16"], ["TENSOR", [48, 24, 3, 3], "float16"], [2, 2], [1, 1, 1, 1], [1, 1], "float16"], {}], "config": {"index": 50626105, "code_hash": null, "entity": [["tile_f", "sp", [-1, 8, 1, 1]], ["tile_y", "sp", [-1, 2, 4, 1]], ["tile_x", "sp", [-1, 1, 4, 2]], ["tile_rc", "sp", [-1, 1]], ["tile_ry", "sp", [-1, 3]], ["tile_rx", "sp", [-1, 3]], ["auto_unroll_max_step", "ot", 512], ["unroll_explicit", "ot", 0]]}, "result": [[0.00030465260581311553], 0, 2.525519847869873, 1674703148.319835], "version": 0.2, "tvm_version": "0.11.dev0"}
{"input": ["cuda -keys=cuda,gpu -arch=sm_86 -max_num_threads=1024 -thread_warp_size=32", "conv2d_nchw.cuda", [["TENSOR", [1, 24, 208, 208], "float16"], ["TENSOR", [48, 24, 3, 3], "float16"], [2, 2], [1, 1, 1, 1], [1, 1], "float16"], {}], "config": {"index": 21954105, "code_hash": null, "entity": [["tile_f", "sp", [-1, 8, 1, 1]], ["tile_y", "sp", [-1, 2, 4, 1]], ["tile_x", "sp", [-1, 1, 4, 2]], ["tile_rc", "sp", [-1, 1]], ["tile_ry", "sp", [-1, 3]], ["tile_rx", "sp", [-1, 3]], ["auto_unroll_max_step", "ot", 0], ["unroll_explicit", "ot", 0]]}, "result": [[0.0003951972945375543], 0, 2.3924996852874756, 1674703149.9512532], "version": 0.2, "tvm_version": "0.11.dev0"}
{"input": ["cuda -keys=cuda,gpu -arch=sm_86 -max_num_threads=1024 -thread_warp_size=32", "conv2d_nchw.cuda", [["TENSOR", [1, 24, 208, 208], "float16"], ["TENSOR", [48, 24, 3, 3], "float16"], [2, 2], [1, 1, 1, 1], [1, 1], "float16"], {}], "config": {"index": 7330460, "code_hash": null, "entity": [["tile_f", "sp", [-1, 2, 3, 2]], ["tile_y", "sp", [-1, 1, 4, 2]], ["tile_x", "sp", [-1, 1, 4, 1]], ["tile_rc", "sp", [-1, 1]], ["tile_ry", "sp", [-1, 3]], ["tile_rx", "sp", [-1, 1]], ["auto_unroll_max_step", "ot", 0], ["unroll_explicit", "ot", 0]]}, "result": [[0.0002656160397873435], 0, 2.5145390033721924, 1674703151.8786206], "version": 0.2, "tvm_version": "0.11.dev0"}
{"input": ["cuda -keys=cuda,gpu -arch=sm_86 -max_num_threads=1024 -thread_warp_size=32", "conv2d_nchw.cuda", [["TENSOR", [1, 24, 208, 208], "float16"], ["TENSOR", [48, 24, 3, 3], "float16"], [2, 2], [1, 1, 1, 1], [1, 1], "float16"], {}], "config": {"index": 162460, "code_hash": null, "entity": [["tile_f", "sp", [-1, 2, 3, 2]], ["tile_y", "sp", [-1, 1, 4, 2]], ["tile_x", "sp", [-1, 1, 4, 1]], ["tile_rc", "sp", [-1, 1]], ["tile_ry", "sp", [-1, 1]], ["tile_rx", "sp", [-1, 1]], ["auto_unroll_max_step", "ot", 0], ["unroll_explicit", "ot", 0]]}, "result": [[0.0008209825332575327], 0, 2.483762264251709, 1674703153.704646], "version": 0.2, "tvm_version": "0.11.dev0"}
{"input": ["cuda -keys=cuda,gpu -arch=sm_86 -max_num_threads=1024 -thread_warp_size=32", "conv2d_nchw.cuda", [["TENSOR", [1, 24, 208, 208], "float16"], ["TENSOR", [48, 24, 3, 3], "float16"], [2, 2], [1, 1, 1, 1], [1, 1], "float16"], {}], "config": {"index": 158834, "code_hash": null, "entity": [["tile_f", "sp", [-1, 1, 24, 2]], ["tile_y", "sp", [-1, 1, 4, 1]], ["tile_x", "sp", [-1, 1, 4, 1]], ["tile_rc", "sp", [-1, 1]], ["tile_ry", "sp", [-1, 1]], ["tile_rx", "sp", [-1, 1]], ["auto_unroll_max_step", "ot", 0], ["unroll_explicit", "ot", 0]]}, "result": [[0.0006072229935034801], 0, 2.2630112171173096, 1674703155.3817756], "version": 0.2, "tvm_version": "0.11.dev0"}
