tuning_records/yolox-l-fp32-3000-2.json
{"input": ["cuda -keys=cuda,gpu -arch=sm_86 -max_num_threads=1024 -thread_warp_size=32", "conv2d_nchw.cuda", [["TENSOR", [1, 12, 320, 320], "float32"], ["TENSOR", [64, 12, 3, 3], "float32"], [1, 1], [1, 1, 1, 1], [1, 1], "float32"], {}], "config": {"index": 172351945, "code_hash": null, "entity": [["tile_f", "sp", [-1, 1, 8, 8]], ["tile_y", "sp", [-1, 1, 1, 5]], ["tile_x", "sp", [-1, 2, 16, 1]], ["tile_rc", "sp", [-1, 1]], ["tile_ry", "sp", [-1, 3]], ["tile_rx", "sp", [-1, 3]], ["auto_unroll_max_step", "ot", 0], ["unroll_explicit", "ot", 0]]}, "result": [[0.00033210053314028316], 0, 2.172276496887207, 1676140427.0732224], "version": 0.2, "tvm_version": "0.11.dev0"}
{"input": ["cuda -keys=cuda,gpu -arch=sm_86 -max_num_threads=1024 -thread_warp_size=32", "conv2d_nchw.cuda", [["TENSOR", [1, 12, 320, 320], "float32"], ["TENSOR", [64, 12, 3, 3], "float32"], [1, 1], [1, 1, 1, 1], [1, 1], "float32"], {}], "config": {"index": 855146953, "code_hash": null, "entity": [["tile_f", "sp", [-1, 1, 8, 8]], ["tile_y", "sp", [-1, 1, 1, 5]], ["tile_x", "sp", [-1, 2, 16, 1]], ["tile_rc", "sp", [-1, 1]], ["tile_ry", "sp", [-1, 3]], ["tile_rx", "sp", [-1, 3]], ["auto_unroll_max_step", "ot", 0], ["unroll_explicit", "ot", 1]]}, "result": [[0.0003359460260403991], 0, 2.4940030574798584, 1676140428.8799496], "version": 0.2, "tvm_version": "0.11.dev0"}
{"input": ["cuda -keys=cuda,gpu -arch=sm_86 -max_num_threads=1024 -thread_warp_size=32", "conv2d_nchw.cuda", [["TENSOR", [1, 12, 320, 320], "float32"], ["TENSOR", [64, 12, 3, 3], "float32"], [1, 1], [1, 1, 1, 1], [1, 1], "float32"], {}], "config": {"index": 855118717, "code_hash": null, "entity": [["tile_f", "sp", [-1, 1, 8, 4]], ["tile_y", "sp", [-1, 1, 1, 5]], ["tile_x", "sp", [-1, 1, 16, 1]], ["tile_rc", "sp", [-1, 1]], ["tile_ry", "sp", [-1, 3]], ["tile_rx", "sp", [-1, 3]], ["auto_unroll_max_step", "ot", 0], ["unroll_explicit", "ot", 1]]}, "result": [[0.0003296036982909728], 0, 2.501332998275757, 1676140431.4515672], "version": 0.2, "tvm_version": "0.11.dev0"}
{"input": ["cuda -keys=cuda,gpu -arch=sm_86 -max_num_threads=1024 -thread_warp_size=32", "conv2d_nchw.cuda", [["TENSOR", [1, 12, 320, 320], "float32"], ["TENSOR", [64, 12, 3, 3], "float32"], [1, 1], [1, 1, 1, 1], [1, 1], "float32"], {}], "config": {"index": 172323709, "code_hash": null, "entity": [["tile_f", "sp", [-1, 1, 8, 4]], ["tile_y", "sp", [-1, 1, 1, 5]], ["tile_x", "sp", [-1, 1, 16, 1]], ["tile_rc", "sp", [-1, 1]], ["tile_ry", "sp", [-1, 3]], ["tile_rx", "sp", [-1, 3]], ["auto_unroll_max_step", "ot", 0], ["unroll_explicit", "ot", 0]]}, "result": [[0.0003292445131578948], 0, 2.4501616954803467, 1676140433.3655434], "version": 0.2, "tvm_version": "0.11.dev0"}
{"input": ["cuda -keys=cuda,gpu -arch=sm_86 -max_num_threads=1024 -thread_warp_size=32", "conv2d_nchw.cuda", [["TENSOR", [1, 12, 320, 320], "float32"], ["TENSOR", [64, 12, 3, 3], "float32"], [1, 1], [1, 1, 1, 1], [1, 1], "float32"], {}], "config": {"index": 172351933, "code_hash": null, "entity": [["tile_f", "sp", [-1, 1, 8, 4]], ["tile_y", "sp", [-1, 1, 1, 5]], ["tile_x", "sp", [-1, 2, 16, 1]], ["tile_rc", "sp", [-1, 1]], ["tile_ry", "sp", [-1, 3]], ["tile_rx", "sp", [-1, 3]], ["auto_unroll_max_step", "ot", 0], ["unroll_explicit", "ot", 0]]}, "result": [[0.0004321974618308521], 0, 2.4497427940368652, 1676140435.7816806], "version": 0.2, "tvm_version": "0.11.dev0"}
{"input": ["cuda -keys=cuda,gpu -arch=sm_86 -max_num_threads=1024 -thread_warp_size=32", "conv2d_nchw.cuda", [["TENSOR", [1, 12, 320, 320], "float32"], ["TENSOR", [64, 12, 3, 3], "float32"], [1, 1], [1, 1, 1, 1], [1, 1], "float32"], {}], "config": {"index": 855118719, "code_hash": null, "entity": [["tile_f", "sp", [-1, 1, 16, 4]], ["tile_y", "sp", [-1, 1, 1, 5]], ["tile_x", "sp", [-1, 1, 16, 1]], ["tile_rc", "sp", [-1, 1]], ["tile_ry", "sp", [-1, 3]], ["tile_rx", "sp", [-1, 3]], ["auto_unroll_max_step", "ot", 0], ["unroll_explicit", "ot", 1]]}, "result": [[0.0003423152358419331], 0, 2.294541597366333, 1676140438.183985], "version": 0.2, "tvm_version": "0.11.dev0"}
{"input": ["cuda -keys=cuda,gpu -arch=sm_86 -max_num_threads=1024 -thread_warp_size=32", "conv2d_nchw.cuda", [["TENSOR", [1, 12, 320, 320], "float32"], ["TENSOR", [64, 12, 3, 3], "float32"], [1, 1], [1, 1, 1, 1], [1, 1], "float32"], {}], "config": {"index": 399950281, "code_hash": null, "entity": [["tile_f", "sp", [-1, 1, 8, 8]], ["tile_y", "sp", [-1, 1, 1, 5]], ["tile_x", "sp", [-1, 2, 16, 1]], ["tile_rc", "sp", [-1, 1]], ["tile_ry", "sp", [-1, 3]], ["tile_rx", "sp", [-1, 3]], ["auto_unroll_max_step", "ot", 512], ["unroll_explicit", "ot", 0]]}, "result": [[0.00034348152435673243], 0, 2.4693071842193604, 1676140439.9920502], "version": 0.2, "tvm_version": "0.11.dev0"}
{"input": ["cuda -keys=cuda,gpu -arch=sm_86 -max_num_threads=1024 -thread_warp_size=32", "conv2d_nchw.cuda", [["TENSOR", [1, 12, 320, 320], "float32"], ["TENSOR", [64, 12, 3, 3], "float32"], [1, 1], [1, 1, 1, 1], [1, 1], "float32"], {}], "config": {"index": 855146941, "code_hash": null, "entity": [["tile_f", "sp", [-1, 1, 8, 4]], ["tile_y", "sp", [-1, 1, 1, 5]], ["tile_x", "sp", [-1, 2, 16, 1]], ["tile_rc", "sp", [-1, 1]], ["tile_ry", "sp", [-1, 3]], ["tile_rx", "sp", [-1, 3]], ["auto_unroll_max_step", "ot", 0], ["unroll_explicit", "ot", 1]]}, "result": [[0.0004312739499524866], 0, 2.2724902629852295, 1676140442.4105392], "version": 0.2, "tvm_version": "0.11.dev0"}
{"input": ["cuda -keys=cuda,gpu -arch=sm_86 -max_num_threads=1024 -thread_warp_size=32", "conv2d_nchw.cuda", [["TENSOR", [1, 12, 320, 320], "float32"], ["TENSOR", [64, 12, 3, 3], "float32"], [1, 1], [1, 1, 1, 1], [1, 1], "float32"], {}], "config": {"index": 172356817, "code_hash": null, "entity": [["tile_f", "sp", [-1, 1, 8, 8]], ["tile_y", "sp", [-1, 1, 1, 10]], ["tile_x", "sp", [-1, 2, 16, 1]], ["tile_rc", "sp", [-1, 1]], ["tile_ry", "sp", [-1, 3]], ["tile_rx", "sp", [-1, 3]], ["auto_unroll_max_step", "ot", 0], ["unroll_explicit", "ot", 0]]}, "result": [[0.00036453739926739926], 0, 2.3990225791931152, 1676140444.5300732], "version": 0.2, "tvm_version": "0.11.dev0"}
{"input": ["cuda -keys=cuda,gpu -arch=sm_86 -max_num_threads=1024 -thread_warp_size=32", "conv2d_nchw.cuda", [["TENSOR", [1, 12, 320, 320], "float32"], ["TENSOR", [64, 12, 3, 3], "float32"], [1, 1], [1, 1, 1, 1], [1, 1], "float32"], {}], "config": {"index": 855151825, "code_hash": null, "entity": [["tile_f", "sp", [-1, 1, 8, 8]], ["tile_y", "sp", [-1, 1, 1, 10]], ["tile_x", "sp", [-1, 2, 16, 1]], ["tile_rc", "sp", [-1, 1]], ["tile_ry", "sp", [-1, 3]], ["tile_rx", "sp", [-1, 3]], ["auto_unroll_max_step", "ot", 0], ["unroll_explicit", "ot", 1]]}, "result": [[0.00036552333665524755], 0, 2.375875949859619, 1676140446.126139], "version": 0.2, "tvm_version": "0.11.dev0"}
{"input": ["cuda -keys=cuda,gpu -arch=sm_86 -max_num_threads=1024 -thread_warp_size=32", "conv2d_nchw.cuda", [["TENSOR", [1, 12, 320, 320], "float32"], ["TENSOR", [64, 12, 3, 3], "float32"], [1, 1], [1, 1, 1, 1], [1, 1], "float32"], {}], "config": {"index": 627520363, "code_hash": null, "entity": [["tile_f", "sp", [-1, 1, 8, 2]], ["tile_y", "sp", [-1, 1, 1, 5]], ["tile_x", "sp", [-1, 1, 16, 1]], ["tile_rc", "sp", [-1, 1]], ["tile_ry", "sp", [-1, 3]], ["tile_rx", "sp", [-1, 3]], ["auto_unroll_max_step", "ot", 1500], ["unroll_explicit", "ot", 0]]}, "result": [[0.0005060105287888815], 0, 2.7602310180664062, 1676140448.6609519], "version": 0.2, "tvm_version": "0.11.dev0"}
{"input": ["cuda -keys=cuda,gpu -arch=sm_86 -max_num_threads=1024 -thread_warp_size=32", "conv2d_nchw.cuda", [["TENSOR", [1, 12, 320, 320], "float32"], ["TENSOR", [64, 12, 3, 3], "float32"], [1, 1], [1, 1, 1, 1], [1, 1], "float32"], {}], "config": {"index": 172323711, "code_hash": null, "entity": [["tile_f", "sp", [-1, 1, 16, 4]], ["tile_y", "sp", [-1, 1, 1, 5]], ["tile_x", "sp", [-1, 1, 16, 1]], ["tile_rc", "sp", [-1, 1]], ["tile_ry", "sp", [-1, 3]], ["tile_rx", "sp", [-1, 3]], ["auto_unroll_max_step", "ot", 0], ["unroll_explicit", "ot", 0]]}, "result": [[0.0003437643138741471], 0, 2.2837157249450684, 1676140450.4632542], "version": 0.2, "tvm_version": "0.11.dev0"}
{"input": ["cuda -keys=cuda,gpu -arch=sm_86 -max_num_threads=1024 -thread_warp_size=32", "conv2d_nchw.cuda", [["TENSOR", [1, 12, 320, 320], "float32"], ["TENSOR", [64, 12, 3, 3], "float32"], [1, 1], [1, 1, 1, 1], [1, 1], "float32"], {}], "config": {"index": 115452361, "code_hash": null, "entity": [["tile_f", "sp", [-1, 1, 8, 8]], ["tile_y", "sp", [-1, 1, 1, 5]], ["tile_x", "sp", [-1, 2, 16, 1]], ["tile_rc", "sp", [-1, 1]], ["tile_ry", "sp", [-1, 1]], ["tile_rx", "sp", [-1, 3]], ["auto_unroll_max_step", "ot", 0], ["unroll_explicit", "ot", 0]]}, "result": [[0.0003760871125439625], 0, 2.3245608806610107, 1676140452.8080616], "version": 0.2, "tvm_version": "0.11.dev0"}
{"input": ["cuda -keys=cuda,gpu -arch=sm_86 -max_num_threads=1024 -thread_warp_size=32", "conv2d_nchw.cuda", [["TENSOR", [1, 12, 320, 320], "float32"], ["TENSOR", [64, 12, 3, 3], "float32"], [1, 1], [1, 1, 1, 1], [1, 1], "float32"], {}], "config": {"index": 399922047, "code_hash": null, "entity": [["tile_f", "sp", [-1, 1, 16, 4]], ["tile_y", "sp", [-1, 1, 1, 5]], ["tile_x", "sp", [-1, 1, 16, 1]], ["tile_rc", "sp", [-1, 1]], ["tile_ry", "sp", [-1, 3]], ["tile_rx", "sp", [-1, 3]], ["auto_unroll_max_step", "ot", 512], ["unroll_explicit", "ot", 0]]}, "result": [[0.00033272288743253667], 0, 2.218366861343384, 1676140454.5158637], "version": 0.2, "tvm_version": "0.11.dev0"}
{"input": ["cuda -keys=cuda,gpu -arch=sm_86 -max_num_threads=1024 -thread_warp_size=32", "conv2d_nchw.cuda", [["TENSOR", [1, 12, 320, 320], "float32"], ["TENSOR", [64, 12, 3, 3], "float32"], [1, 1], [1, 1, 1, 1], [1, 1], "float32"], {}], "config": {"index": 864601983, "code_hash": null, "entity": [["tile_f", "sp", [-1, 1, 16, 4]], ["tile_y", "sp", [-1, 1, 1, 5]], ["tile_x", "sp", [-1, 1, 16, 1]], ["tile_rc", "sp", [-1, 2]], ["tile_ry", "sp", [-1, 3]], ["tile_rx", "sp", [-1, 3]], ["auto_unroll_max_step", "ot", 0], ["unroll_explicit", "ot", 1]]}, "result": [[0.0003554646765339074], 0, 2.163361072540283, 1676140456.2821882], "version": 0.2, "tvm_version": "0.11.dev0"}
{"input": ["cuda -keys=cuda,gpu -arch=sm_86 -max_num_threads=1024 -thread_warp_size=32", "conv2d_nchw.cuda", [["TENSOR", [1, 12, 320, 320], "float32"], ["TENSOR", [64, 12, 3, 3], "float32"], [1, 1], [1, 1, 1, 1], [1, 1], "float32"], {}], "config": {"index": 399922027, "code_hash": null, "entity": [["tile_f", "sp", [-1, 1, 8, 2]], ["tile_y", "sp", [-1, 1, 1, 5]], ["tile_x", "sp", [-1, 1, 16, 1]], ["tile_rc", "sp", [-1, 1]], ["tile_ry", "sp", [-1, 3]], ["tile_rx", "sp", [-1, 3]], ["auto_unroll_max_step", "ot", 512], ["unroll_explicit", "ot", 0]]}, "result": [[0.0004733495837943377], 0, 2.2967872619628906, 1676140458.7964244], "version": 0.2, "tvm_version": "0.11.dev0"}
{"input": ["cuda -keys=cuda,gpu -arch=sm_86 -max_num_threads=1024 -thread_warp_size=32", "conv2d_nchw.cuda", [["TENSOR", [1, 12, 320, 320], "float32"], ["TENSOR", [64, 12, 3, 3], "float32"], [1, 1], [1, 1, 1, 1], [1, 1], "float32"], {}], "config": {"index": 172348165, "code_hash": null, "entity": [["tile_f", "sp", [-1, 1, 8, 8]], ["tile_y", "sp", [-1, 1, 1, 4]], ["tile_x", "sp", [-1, 2, 16, 1]], ["tile_rc", "sp", [-1, 1]], ["tile_ry", "sp", [-1, 3]], ["tile_rx", "sp", [-1, 3]], ["auto_unroll_max_step", "ot", 0], ["unroll_explicit", "ot", 0]]}, "result": [[0.00036072457669851385], 0, 2.3637611865997314, 1676140461.7967403], "version": 0.2, "tvm_version": "0.11.dev0"}
{"input": ["cuda -keys=cuda,gpu -arch=sm_86 -max_num_threads=1024 -thread_warp_size=32", "conv2d_nchw.cuda", [["TENSOR", [1, 12, 320, 320], "float32"], ["TENSOR", [64, 12, 3, 3], "float32"], [1, 1], [1, 1, 1, 1], [1, 1], "float32"], {}], "config": {"index": 409405291, "code_hash": null, "entity": [["tile_f", "sp", [-1, 1, 8, 2]], ["tile_y", "sp", [-1, 1, 1, 5]], ["tile_x", "sp", [-1, 1, 16, 1]], ["tile_rc", "sp", [-1, 2]], ["tile_ry", "sp", [-1, 3]], ["tile_rx", "sp", [-1, 3]], ["auto_unroll_max_step", "ot", 512], ["unroll_explicit", "ot", 0]]}, "result": [[0.0004443507223346829], 0, 2.2389581203460693, 1676140464.1827018], "version": 0.2, "tvm_version": "0.11.dev0"}
{"input": ["cuda -keys=cuda,gpu -arch=sm_86 -max_num_threads=1024 -thread_warp_size=32", "conv2d_nchw.cuda", [["TENSOR", [1, 12, 320, 320], "float32"], ["TENSOR", [64, 12, 3, 3], "float32"], [1, 1], [1, 1, 1, 1], [1, 1], "float32"], {}], "config": {"index": 627548617, "code_hash": null, "entity": [["tile_f", "sp", [-1, 1, 8, 8]], ["tile_y", "sp", [-1, 1, 1, 5]], ["tile_x", "sp", [-1, 2, 16, 1]], ["tile_rc", "sp", [-1, 1]], ["tile_ry", "sp", [-1, 3]], ["tile_rx", "sp", [-1, 3]], ["auto_unroll_max_step", "ot", 1500], ["unroll_explicit", "ot", 0]]}, "result": [[0.00028026501618450336], 0, 2.6120307445526123, 1676140466.6638296], "version": 0.2, "tvm_version": "0.11.dev0"}
{"input": ["cuda -keys=cuda,gpu -arch=sm_86 -max_num_threads=1024 -thread_warp_size=32", "conv2d_nchw.cuda", [["TENSOR", [1, 12, 320, 320], "float32"], ["TENSOR", [64, 12, 3, 3], "float32"], [1, 1], [1, 1, 1, 1], [1, 1], "float32"], {}], "config": {"index": 855143173, "code_hash": null, "entity": [["tile_f", "sp", [-1, 1, 8, 8]], ["tile_y", "sp", [-1, 1, 1, 4]], ["tile_x", "sp", [-1, 2, 16, 1]], ["tile_rc", "sp", [-1, 1]], ["tile_ry", "sp", [-1, 3]], ["tile_rx", "sp", [-1, 3]], ["auto_unroll_max_step", "ot", 0], ["unroll_explicit", "ot", 1]]}, "result": [[0.00036187321084656083], 0, 2.3697001934051514, 1676140468.4723628], "version": 0.2, "tvm_version": "0.11.dev0"}
{"input": ["cuda -keys=cuda,gpu -arch=sm_86 -max_num_threads=1024 -thread_warp_size=32", "conv2d_nchw.cuda", [["TENSOR", [1, 12, 320, 320], "float32"], ["TENSOR", [64, 12, 3, 3], "float32"], [1, 1], [1, 1, 1, 1], [1, 1], "float32"], {}], "config": {"index": 855118699, "code_hash": null, "entity": [["tile_f", "sp", [-1, 1, 8, 2]], ["tile_y", "sp", [-1, 1, 1, 5]], ["tile_x", "sp", [-1, 1, 16, 1]], ["tile_rc", "sp", [-1, 1]], ["tile_ry", "sp", [-1, 3]], ["tile_rx", "sp", [-1, 3]], ["auto_unroll_max_step", "ot", 0], ["unroll_explicit", "ot", 1]]}, "result": [[0.0004880902306169581], 0, 2.3659276962280273, 1676140471.0449948], "version": 0.2, "tvm_version": "0.11.dev0"}
{"input": ["cuda -keys=cuda,gpu -arch=sm_86 -max_num_threads=1024 -thread_warp_size=32", "conv2d_nchw.cuda", [["TENSOR", [1, 12, 320, 320], "float32"], ["TENSOR", [64, 12, 3, 3], "float32"], [1, 1], [1, 1, 1, 1], [1, 1], "float32"], {}], "config": {"index": 172323691, "code_hash": null, "entity": [["tile_f", "sp", [-1, 1, 8, 2]], ["tile_y", "sp", [-1, 1, 1, 5]], ["tile_x", "sp", [-1, 1, 16, 1]], ["tile_rc", "sp", [-1, 1]], ["tile_ry", "sp", [-1, 3]], ["tile_rx", "sp", [-1, 3]], ["auto_unroll_max_step", "ot", 0], ["unroll_explicit", "ot", 0]]}, "result": [[0.0004879392192142621], 0, 2.3073995113372803, 1676140473.6116083], "version": 0.2, "tvm_version": "0.11.dev0"}
{"input": ["cuda -keys=cuda,gpu -arch=sm_86 -max_num_threads=1024 -thread_warp_size=32", "conv2d_nchw.cuda", [["TENSOR", [1, 12, 320, 320], "float32"], ["TENSOR", [64, 12, 3, 3], "float32"], [1, 1], [1, 1, 1, 1], [1, 1], "float32"], {}], "config": {"index": 181806955, "code_hash": null, "entity": [["tile_f", "sp", [-1, 1, 8, 2]], ["tile_y", "sp", [-1, 1, 1, 5]], ["tile_x", "sp", [-1, 1, 16, 1]], ["tile_rc", "sp", [-1, 2]], ["tile_ry", "sp", [-1, 3]], ["tile_rx", "sp", [-1, 3]], ["auto_unroll_max_step", "ot", 0], ["unroll_explicit", "ot", 0]]}, "result": [[0.00045595696998123827], 0, 2.2440152168273926, 1676140475.4837334], "version": 0.2, "tvm_version": "0.11.dev0"}
{"input": ["cuda -keys=cuda,gpu -arch=sm_86 -max_num_threads=1024 -thread_warp_size=32", "conv2d_nchw.cuda", [["TENSOR", [1, 12, 320, 320], "float32"], ["TENSOR", [64, 12, 3, 3], "float32"], [1, 1], [1, 1, 1, 1], [1, 1], "float32"], {}], "config": {"index": 172356805, "code_hash": null, "entity": [["tile_f", "sp", [-1, 1, 8, 4]], ["tile_y", "sp", [-1, 1, 1, 10]], ["tile_x", "sp", [-1, 2, 16, 1]], ["tile_rc", "sp", [-1, 1]], ["tile_ry", "sp", [-1, 3]], ["tile_rx", "sp", [-1, 3]], ["auto_unroll_max_step", "ot", 0], ["unroll_explicit", "ot", 0]]}, "result": [[0.00040516924471393036], 0, 2.4106948375701904, 1676140477.237254], "version": 0.2, "tvm_version": "0.11.dev0"}
{"input": ["cuda -keys=cuda,gpu -arch=sm_86 -max_num_threads=1024 -thread_warp_size=32", "conv2d_nchw.cuda", [["TENSOR", [1, 12, 320, 320], "float32"], ["TENSOR", [64, 12, 3, 3], "float32"], [1, 1], [1, 1, 1, 1], [1, 1], "float32"], {}], "config": {"index": 637003627, "code_hash": null, "entity": [["tile_f", "sp", [-1, 1, 8, 2]], ["tile_y", "sp", [-1, 1, 1, 5]], ["tile_x", "sp", [-1, 1, 16, 1]], ["tile_rc", "sp", [-1, 2]], ["tile_ry", "sp", [-1, 3]], ["tile_rx", "sp", [-1, 3]], ["auto_unroll_max_step", "ot", 1500], ["unroll_explicit", "ot", 0]]}, "result": [[0.0004781792254758419], 0, 2.8500730991363525, 1676140479.320267], "version": 0.2, "tvm_version": "0.11.dev0"}
{"input": ["cuda -keys=cuda,gpu -arch=sm_86 -max_num_threads=1024 -thread_warp_size=32", "conv2d_nchw.cuda", [["TENSOR", [1, 12, 320, 320], "float32"], ["TENSOR", [64, 12, 3, 3], "float32"], [1, 1], [1, 1, 1, 1], [1, 1], "float32"], {}], "config": {"index": 855118702, "code_hash": null, "entity": [["tile_f", "sp", [-1, 1, 16, 2]], ["tile_y", "sp", [-1, 1, 1, 5]], ["tile_x", "sp", [-1, 1, 16, 1]], ["tile_rc", "sp", [-1, 1]], ["tile_ry", "sp", [-1, 3]], ["tile_rx", "sp", [-1, 3]], ["auto_unroll_max_step", "ot", 0], ["unroll_explicit", "ot", 1]]}, "result": [[0.00046851795116846875], 0, 2.296205759048462, 1676140481.1205988], "version": 0.2, "tvm_version": "0.11.dev0"}
{"input": ["cuda -keys=cuda,gpu -arch=sm_86 -max_num_threads=1024 -thread_warp_size=32", "conv2d_nchw.cuda", [["TENSOR", [1, 12, 320, 320], "float32"], ["TENSOR", [64, 12, 3, 3], "float32"], [1, 1], [1, 1, 1, 1], [1, 1], "float32"], {}], "config": {"index": 181835209, "code_hash": null, "entity": [["tile_f", "sp", [-1, 1, 8, 8]], ["tile_y", "sp", [-1, 1, 1, 5]], ["tile_x", "sp", [-1, 2, 16, 1]], ["tile_rc", "sp", [-1, 2]], ["tile_ry", "sp", [-1, 3]], ["tile_rx", "sp", [-1, 3]], ["auto_unroll_max_step", "ot", 0], ["unroll_explicit", "ot", 0]]}, "result": [[0.0002964798304033092], 0, 2.468893527984619, 1676140483.6106915], "version": 0.2, "tvm_version": "0.11.dev0"}
{"input": ["cuda -keys=cuda,gpu -arch=sm_86 -max_num_threads=1024 -thread_warp_size=32", "conv2d_nchw.cuda", [["TENSOR", [1, 12, 320, 320], "float32"], ["TENSOR", [64, 12, 3, 3], "float32"], [1, 1], [1, 1, 1, 1], [1, 1], "float32"], {}], "config": {"index": 637003630, "code_hash": null, "entity": [["tile_f", "sp", [-1, 1, 16, 2]], ["tile_y", "sp", [-1, 1, 1, 5]], ["tile_x", "sp", [-1, 1, 16, 1]], ["tile_rc", "sp", [-1, 2]], ["tile_ry", "sp", [-1, 3]], ["tile_rx", "sp", [-1, 3]], ["auto_unroll_max_step", "ot", 1500], ["unroll_explicit", "ot", 0]]}, "result": [[0.00042681903653250775], 0, 2.5228681564331055, 1676140486.0236857], "version": 0.2, "tvm_version": "0.11.dev0"}
{"input": ["cuda -keys=cuda,gpu -arch=sm_86 -max_num_threads=1024 -thread_warp_size=32", "conv2d_nchw.cuda", [["TENSOR", [1, 12, 320, 320], "float32"], ["TENSOR", [64, 12, 3, 3], "float32"], [1, 1], [1, 1, 1, 1], [1, 1], "float32"], {}], "config": {"index": 627525210, "code_hash": null, "entity": [["tile_f", "sp", [-1, 1, 8, 1]], ["tile_y", "sp", [-1, 1, 1, 10]], ["tile_x", "sp", [-1, 1, 16, 1]], ["tile_rc", "sp", [-1, 1]], ["tile_ry", "sp", [-1, 3]], ["tile_rx", "sp", [-1, 3]], ["auto_unroll_max_step", "ot", 1500], ["unroll_explicit", "ot", 0]]}, "result": [[0.0007112453843248347], 0, 2.705024242401123, 1676140487.9794347], "version": 0.2, "tvm_version": "0.11.dev0"}
{"input": ["cuda -keys=cuda,gpu -arch=sm_86 -max_num_threads=1024 -thread_warp_size=32", "conv2d_nchw.cuda", [["TENSOR", [1, 12, 320, 320], "float32"], ["TENSOR", [64, 12, 3, 3], "float32"], [1, 1], [1, 1, 1, 1], [1, 1], "float32"], {}], "config": {"index": 172335901, "code_hash": null, "entity": [["tile_f", "sp", [-1, 1, 8, 8]], ["tile_y", "sp", [-1, 2, 1, 1]], ["tile_x", "sp", [-1, 2, 16, 1]], ["tile_rc", "sp", [-1, 1]], ["tile_ry", "sp", [-1, 3]], ["tile_rx", "sp", [-1, 3]], ["auto_unroll_max_step", "ot", 0], ["unroll_explicit", "ot", 0]]}, "result": [[0.0004947088597538232], 0, 2.320134162902832, 1676140489.7530198], "version": 0.2, "tvm_version": "0.11.dev0"}
{"input": ["cuda -keys=cuda,gpu -arch=sm_86 -max_num_threads=1024 -thread_warp_size=32", "conv2d_nchw.cuda", [["TENSOR", [1, 12, 320, 320], "float32"], ["TENSOR", [64, 12, 3, 3], "float32"], [1, 1], [1, 1, 1, 1], [1, 1], "float32"], {}], "config": {"index": 399955153, "code_hash": null, "entity": [["tile_f", "sp", [-1, 1, 8, 8]], ["tile_y", "sp", [-1, 1, 1, 10]], ["tile_x", "sp", [-1, 2, 16, 1]], ["tile_rc", "sp", [-1, 1]], ["tile_ry", "sp", [-1, 3]], ["tile_rx", "sp", [-1, 3]], ["auto_unroll_max_step", "ot", 512], ["unroll_explicit", "ot", 0]]}, "result": [[0.00035917274376284124], 0, 2.3867552280426025, 1676140492.0123], "version": 0.2, "tvm_version": "0.11.dev0"}
{"input": ["cuda -keys=cuda,gpu -arch=sm_86 -max_num_threads=1024 -thread_warp_size=32", "conv2d_nchw.cuda", [["TENSOR", [1, 12, 320, 320], "float32"], ["TENSOR", [64, 12, 3, 3], "float32"], [1, 1], [1, 1, 1, 1], [1, 1], "float32"], {}], "config": {"index": 627548605, "code_hash": null, "entity": [["tile_f", "sp", [-1, 1, 8, 4]], ["tile_y", "sp", [-1, 1, 1, 5]], ["tile_x", "sp", [-1, 2, 16, 1]], ["tile_rc", "sp", [-1, 1]], ["tile_ry", "sp", [-1, 3]], ["tile_rx", "sp", [-1, 3]], ["auto_unroll_max_step", "ot", 1500], ["unroll_explicit", "ot", 0]]}, "result": [[0.0003049474012257406], 0, 2.559478521347046, 1676140493.9582036], "version": 0.2, "tvm_version": "0.11.dev0"}
{"input": ["cuda -keys=cuda,gpu -arch=sm_86 -max_num_threads=1024 -thread_warp_size=32", "conv2d_nchw.cuda", [["TENSOR", [1, 12, 320, 320], "float32"], ["TENSOR", [64, 12, 3, 3], "float32"], [1, 1], [1, 1, 1, 1], [1, 1], "float32"], {}], "config": {"index": 409410138, "code_hash": null, "entity": [["tile_f", "sp", [-1, 1, 8, 1]], ["tile_y", "sp", [-1, 1, 1, 10]], ["tile_x", "sp", [-1, 1, 16, 1]], ["tile_rc", "sp", [-1, 2]], ["tile_ry", "sp", [-1, 3]], ["tile_rx", "sp", [-1, 3]], ["auto_unroll_max_step", "ot", 512], ["unroll_explicit", "ot", 0]]}, "result": [[0.000641516342442357], 0, 2.4497127532958984, 1676140497.098142], "version": 0.2, "tvm_version": "0.11.dev0"}
{"input": ["cuda -keys=cuda,gpu -arch=sm_86 -max_num_threads=1024 -thread_warp_size=32", "conv2d_nchw.cuda", [["TENSOR", [1, 12, 320, 320], "float32"], ["TENSOR", [64, 12, 3, 3], "float32"], [1, 1], [1, 1, 1, 1], [1, 1], "float32"], {}], "config": {"index": 1082717055, "code_hash": null, "entity": [["tile_f", "sp", [-1, 1, 16, 4]], ["tile_y", "sp", [-1, 1, 1, 5]], ["tile_x", "sp", [-1, 1, 16, 1]], ["tile_rc", "sp", [-1, 1]], ["tile_ry", "sp", [-1, 3]], ["tile_rx", "sp", [-1, 3]], ["auto_unroll_max_step", "ot", 512], ["unroll_explicit", "ot", 1]]}, "result": [[0.00033817465875153], 0, 2.3519413471221924, 1676140498.936568], "version": 0.2, "tvm_version": "0.11.dev0"}
{"input": ["cuda -keys=cuda,gpu -arch=sm_86 -max_num_threads=1024 -thread_warp_size=32", "conv2d_nchw.cuda", [["TENSOR", [1, 12, 320, 320], "float32"], ["TENSOR", [64, 12, 3, 3], "float32"], [1, 1], [1, 1, 1, 1], [1, 1], "float32"], {}], "config": {"index": 1082745289, "code_hash": null, "entity": [["tile_f", "sp", [-1, 1, 8, 8]], ["tile_y", "sp", [-1, 1, 1, 5]], ["tile_x", "sp", [-1, 2, 16, 1]], ["tile_rc", "sp", [-1, 1]], ["tile_ry", "sp", [-1, 3]], ["tile_rx", "sp", [-1, 3]], ["auto_unroll_max_step", "ot", 512], ["unroll_explicit", "ot", 1]]}, "result": [[0.00034475497652108054], 0, 2.592069149017334, 1676140500.7580829], "version": 0.2, "tvm_version": "0.11.dev0"}
{"input": ["cuda -keys=cuda,gpu -arch=sm_86 -max_num_threads=1024 -thread_warp_size=32", "conv2d_nchw.cuda", [["TENSOR", [1, 12, 320, 320], "float32"], ["TENSOR", [64, 12, 3, 3], "float32"], [1, 1], [1, 1, 1, 1], [1, 1], "float32"], {}], "config": {"index": 855151813, "code_hash": null, "entity": [["tile_f", "sp", [-1, 1, 8, 4]], ["tile_y", "sp", [-1, 1, 1, 10]], ["tile_x", "sp", [-1, 2, 16, 1]], ["tile_rc", "sp", [-1, 1]], ["tile_ry", "sp", [-1, 3]], ["tile_rx", "sp", [-1, 3]], ["auto_unroll_max_step", "ot", 0], ["unroll_explicit", "ot", 1]]}, "result": [[0.0004093495771978875], 0, 2.3837709426879883, 1676140502.5017087], "version": 0.2, "tvm_version": "0.11.dev0"}
{"input": ["cuda -keys=cuda,gpu -arch=sm_86 -max_num_threads=1024 -thread_warp_size=32", "conv2d_nchw.cuda", [["TENSOR", [1, 12, 320, 320], "float32"], ["TENSOR", [64, 12, 3, 3], "float32"], [1, 1], [1, 1, 1, 1], [1, 1], "float32"], {}], "config": {"index": 399926874, "code_hash": null, "entity": [["tile_f", "sp", [-1, 1, 8, 1]], ["tile_y", "sp", [-1, 1, 1, 10]], ["tile_x", "sp", [-1, 1, 16, 1]], ["tile_rc", "sp", [-1, 1]], ["tile_ry", "sp", [-1, 3]], ["tile_rx", "sp", [-1, 3]], ["auto_unroll_max_step", "ot", 512], ["unroll_explicit", "ot", 0]]}, "result": [[0.0006769656600185529], 0, 2.197507381439209, 1676140504.4158797], "version": 0.2, "tvm_version": "0.11.dev0"}
{"input": ["cuda -keys=cuda,gpu -arch=sm_86 -max_num_threads=1024 -thread_warp_size=32", "conv2d_nchw.cuda", [["TENSOR", [1, 12, 320, 320], "float32"], ["TENSOR", [64, 12, 3, 3], "float32"], [1, 1], [1, 1, 1, 1], [1, 1], "float32"], {}], "config": {"index": 115452349, "code_hash": null, "entity": [["tile_f", "sp", [-1, 1, 8, 4]], ["tile_y", "sp", [-1, 1, 1, 5]], ["tile_x", "sp", [-1, 2, 16, 1]], ["tile_rc", "sp", [-1, 1]], ["tile_ry", "sp", [-1, 1]], ["tile_rx", "sp", [-1, 3]], ["auto_unroll_max_step", "ot", 0], ["unroll_explicit", "ot", 0]]}, "result": [[0.00046421674299223234], 0, 2.2886803150177, 1676140506.2655568], "version": 0.2, "tvm_version": "0.11.dev0"}
{"input": ["cuda -keys=cuda,gpu -arch=sm_86 -max_num_threads=1024 -thread_warp_size=32", "conv2d_nchw.cuda", [["TENSOR", [1, 12, 320, 320], "float32"], ["TENSOR", [64, 12, 3, 3], "float32"], [1, 1], [1, 1, 1, 1], [1, 1], "float32"], {}], "config": {"index": 352505707, "code_hash": null, "entity": [["tile_f", "sp", [-1, 1, 8, 2]], ["tile_y", "sp", [-1, 1, 1, 5]], ["tile_x", "sp", [-1, 1, 16, 1]], ["tile_rc", "sp", [-1, 2]], ["tile_ry", "sp", [-1, 1]], ["tile_rx", "sp", [-1, 3]], ["auto_unroll_max_step", "ot", 512], ["unroll_explicit", "ot", 0]]}, "result": [[0.000725692544628541], 0, 2.3147923946380615, 1676140508.0620341], "version": 0.2, "tvm_version": "0.11.dev0"}
{"input": ["cuda -keys=cuda,gpu -arch=sm_86 -max_num_threads=1024 -thread_warp_size=32", "conv2d_nchw.cuda", [["TENSOR", [1, 12, 320, 320], "float32"], ["TENSOR", [64, 12, 3, 3], "float32"], [1, 1], [1, 1, 1, 1], [1, 1], "float32"], {}], "config": {"index": 399906013, "code_hash": null, "entity": [["tile_f", "sp", [-1, 1, 8, 8]], ["tile_y", "sp", [-1, 2, 1, 1]], ["tile_x", "sp", [-1, 1, 16, 1]], ["tile_rc", "sp", [-1, 1]], ["tile_ry", "sp", [-1, 3]], ["tile_rx", "sp", [-1, 3]], ["auto_unroll_max_step", "ot", 512], ["unroll_explicit", "ot", 0]]}, "result": [[0.00044167417970842016], 0, 2.2954301834106445, 1676140509.974403], "version": 0.2, "tvm_version": "0.11.dev0"}
{"input": ["cuda -keys=cuda,gpu -arch=sm_86 -max_num_threads=1024 -thread_warp_size=32", "conv2d_nchw.cuda", [["TENSOR", [1, 12, 320, 320], "float32"], ["TENSOR", [64, 12, 3, 3], "float32"], [1, 1], [1, 1, 1, 1], [1, 1], "float32"], {}], "config": {"index": 627520366, "code_hash": null, "entity": [["tile_f", "sp", [-1, 1, 16, 2]], ["tile_y", "sp", [-1, 1, 1, 5]], ["tile_x", "sp", [-1, 1, 16, 1]], ["tile_rc", "sp", [-1, 1]], ["tile_ry", "sp", [-1, 3]], ["tile_rx", "sp", [-1, 3]], ["auto_unroll_max_step", "ot", 1500], ["unroll_explicit", "ot", 0]]}, "result": [[0.00048695661530542215], 0, 2.582807779312134, 1676140511.8627646], "version": 0.2, "tvm_version": "0.11.dev0"}
{"input": ["cuda -keys=cuda,gpu -arch=sm_86 -max_num_threads=1024 -thread_warp_size=32", "conv2d_nchw.cuda", [["TENSOR", [1, 12, 320, 320], "float32"], ["TENSOR", [64, 12, 3, 3], "float32"], [1, 1], [1, 1, 1, 1], [1, 1], "float32"], {}], "config": {"index": 343006429, "code_hash": null, "entity": [["tile_f", "sp", [-1, 1, 8, 8]], ["tile_y", "sp", [-1, 2, 1, 1]], ["tile_x", "sp", [-1, 1, 16, 1]], ["tile_rc", "sp", [-1, 1]], ["tile_ry", "sp", [-1, 1]], ["tile_rx", "sp", [-1, 3]], ["auto_unroll_max_step", "ot", 512], ["unroll_explicit", "ot", 0]]}, "result": [[0.0004638050013231889], 0, 2.3717153072357178, 1676140513.7261648], "version": 0.2, "tvm_version": "0.11.dev0"}
{"input": ["cuda -keys=cuda,gpu -arch=sm_86 -max_num_threads=1024 -thread_warp_size=32", "conv2d_nchw.cuda", [["TENSOR", [1, 12, 320, 320], "float32"], ["TENSOR", [64, 12, 3, 3], "float32"], [1, 1], [1, 1, 1, 1], [1, 1], "float32"], {}], "config": {"index": 627520383, "code_hash": null, "entity": [["tile_f", "sp", [-1, 1, 16, 4]], ["tile_y", "sp", [-1, 1, 1, 5]], ["tile_x", "sp", [-1, 1, 16, 1]], ["tile_rc", "sp", [-1, 1]], ["tile_ry", "sp", [-1, 3]], ["tile_rx", "sp", [-1, 3]], ["auto_unroll_max_step", "ot", 1500], ["unroll_explicit", "ot", 0]]}, "result": [[0.0003401181077755905], 0, 2.361748218536377, 1676140515.5588598], "version": 0.2, "tvm_version": "0.11.dev0"}
{"input": ["cuda -keys=cuda,gpu -arch=sm_86 -max_num_threads=1024 -thread_warp_size=32", "conv2d_nchw.cuda", [["TENSOR", [1, 12, 320, 320], "float32"], ["TENSOR", [64, 12, 3, 3], "float32"], [1, 1], [1, 1, 1, 1], [1, 1], "float32"], {}], "config": {"index": 409235950, "code_hash": null, "entity": [["tile_f", "sp", [-1, 1, 16, 2]], ["tile_y", "sp", [-1, 1, 1, 5]], ["tile_x", "sp", [-1, 1, 10, 1]], ["tile_rc", "sp", [-1, 2]], ["tile_ry", "sp", [-1, 3]], ["tile_rx", "sp", [-1, 3]], ["auto_unroll_max_step", "ot", 512], ["unroll_explicit", "ot", 0]]}, "result": [[0.0005074192576214405], 0, 2.451570510864258, 1676140517.4876554], "version": 0.2, "tvm_version": "0.11.dev0"}
{"input": ["cuda -keys=cuda,gpu -arch=sm_86 -max_num_threads=1024 -thread_warp_size=32", "conv2d_nchw.cuda", [["TENSOR", [1, 12, 320, 320], "float32"], ["TENSOR", [64, 12, 3, 3], "float32"], [1, 1], [1, 1, 1, 1], [1, 1], "float32"], {}], "config": {"index": 115424125, "code_hash": null, "entity": [["tile_f", "sp", [-1, 1, 8, 4]], ["tile_y", "sp", [-1, 1, 1, 5]], ["tile_x", "sp", [-1, 1, 16, 1]], ["tile_rc", "sp", [-1, 1]], ["tile_ry", "sp", [-1, 1]], ["tile_rx", "sp", [-1, 3]], ["auto_unroll_max_step", "ot", 0], ["unroll_explicit", "ot", 0]]}, "result": [[0.0004724260234773733], 0, 2.3424177169799805, 1676140519.3176186], "version": 0.2, "tvm_version": "0.11.dev0"}
{"input": ["cuda -keys=cuda,gpu -arch=sm_86 -max_num_threads=1024 -thread_warp_size=32", "conv2d_nchw.cuda", [["TENSOR", [1, 12, 320, 320], "float32"], ["TENSOR", [64, 12, 3, 3], "float32"], [1, 1], [1, 1, 1, 1], [1, 1], "float32"], {}], "config": {"index": 855118727, "code_hash": null, "entity": [["tile_f", "sp", [-1, 1, 4, 8]], ["tile_y", "sp", [-1, 1, 1, 5]], ["tile_x", "sp", [-1, 1, 16, 1]], ["tile_rc", "sp", [-1, 1]], ["tile_ry", "sp", [-1, 3]], ["tile_rx", "sp", [-1, 3]], ["auto_unroll_max_step", "ot", 0], ["unroll_explicit", "ot", 1]]}, "result": [[0.0004381419079445145], 0, 2.3495073318481445, 1676140521.1504178], "version": 0.2, "tvm_version": "0.11.dev0"}
{"input": ["cuda -keys=cuda,gpu -arch=sm_86 -max_num_threads=1024 -thread_warp_size=32", "conv2d_nchw.cuda", [["TENSOR", [1, 12, 320, 320], "float32"], ["TENSOR", [64, 12, 3, 3], "float32"], [1, 1], [1, 1, 1, 1], [1, 1], "float32"], {}], "config": {"index": 797864282, "code_hash": null, "entity": [["tile_f", "sp", [-1, 2, 32, 1]], ["tile_y", "sp", [-1, 1, 1, 1]], ["tile_x", "sp", [-1, 4, 8, 1]], ["tile_rc", "sp", [-1, 1]], ["tile_ry", "sp", [-1, 1]], ["tile_rx", "sp", [-1, 3]], ["auto_unroll_max_step", "ot", 0], ["unroll_explicit", "ot", 1]]}, "result": [[0.0008655472733188721], 0, 2.08247971534729, 1676140522.7724097], "version": 0.2, "tvm_version": "0.11.dev0"}
{"input": ["cuda -keys=cuda,gpu -arch=sm_86 -max_num_threads=1024 -thread_warp_size=32", "conv2d_nchw.cuda", [["TENSOR", [1, 12, 320, 320], "float32"], ["TENSOR", [64, 12, 3, 3], "float32"], [1, 1], [1, 1, 1, 1], [1, 1], "float32"], {}], "config": {"index": 172323694, "code_hash": null, "entity": [["tile_f", "sp", [-1, 1, 16, 2]], ["tile_y", "sp", [-1, 1, 1, 5]], ["tile_x", "sp", [-1, 1, 16, 1]], ["tile_rc", "sp", [-1, 1]], ["tile_ry", "sp", [-1, 3]], ["tile_rx", "sp", [-1, 3]], ["auto_unroll_max_step", "ot", 0], ["unroll_explicit", "ot", 0]]}, "result": [[0.0004719095373291273], 0, 2.22304105758667, 1676140524.5456746], "version": 0.2, "tvm_version": "0.11.dev0"}
{"input": ["cuda -keys=cuda,gpu -arch=sm_86 -max_num_threads=1024 -thread_warp_size=32", "conv2d_nchw.cuda", [["TENSOR", [1, 12, 320, 320], "float32"], ["TENSOR", [64, 12, 3, 3], "float32"], [1, 1], [1, 1, 1, 1], [1, 1], "float32"], {}], "config": {"index": 1025462618, "code_hash": null, "entity": [["tile_f", "sp", [-1, 2, 32, 1]], ["tile_y", "sp", [-1, 1, 1, 1]], ["tile_x", "sp", [-1, 4, 8, 1]], ["tile_rc", "sp", [-1, 1]], ["tile_ry", "sp", [-1, 1]], ["tile_rx", "sp", [-1, 3]], ["auto_unroll_max_step", "ot", 512], ["unroll_explicit", "ot", 1]]}, "result": [[0.000870495597832631], 0, 3.163308620452881, 1676140532.4737723], "version": 0.2, "tvm_version": "0.11.dev0"}
{"input": ["cuda -keys=cuda,gpu -arch=sm_86 -max_num_threads=1024 -thread_warp_size=32", "conv2d_nchw.cuda", [["TENSOR", [1, 12, 320, 320], "float32"], ["TENSOR", [64, 12, 3, 3], "float32"], [1, 1], [1, 1, 1, 1], [1, 1], "float32"], {}], "config": {"index": 864601963, "code_hash": null, "entity": [["tile_f", "sp", [-1, 1, 8, 2]], ["tile_y", "sp", [-1, 1, 1, 5]], ["tile_x", "sp", [-1, 1, 16, 1]], ["tile_rc", "sp", [-1, 2]], ["tile_ry", "sp", [-1, 3]], ["tile_rx", "sp", [-1, 3]], ["auto_unroll_max_step", "ot", 0], ["unroll_explicit", "ot", 1]]}, "result": [[0.0004657176413793103], 0, 2.506415367126465, 1676140534.4776728], "version": 0.2, "tvm_version": "0.11.dev0"}
{"input": ["cuda -keys=cuda,gpu -arch=sm_86 -max_num_threads=1024 -thread_warp_size=32", "conv2d_nchw.cuda", [["TENSOR", [1, 12, 320, 320], "float32"], ["TENSOR", [64, 12, 3, 3], "float32"], [1, 1], [1, 1, 1, 1], [1, 1], "float32"], {}], "config": {"index": 855125355, "code_hash": null, "entity": [["tile_f", "sp", [-1, 1, 16, 4]], ["tile_y", "sp", [-1, 1, 1, 16]], ["tile_x", "sp", [-1, 1, 16, 1]], ["tile_rc", "sp", [-1, 1]], ["tile_ry", "sp", [-1, 3]], ["tile_rx", "sp", [-1, 3]], ["auto_unroll_max_step", "ot", 0], ["unroll_explicit", "ot", 1]]}, "result": [[0.0004514606267605633], 0, 2.1669743061065674, 1676140536.1231637], "version": 0.2, "tvm_version": "0.11.dev0"}
{"input": ["cuda -keys=cuda,gpu -arch=sm_86 -max_num_threads=1024 -thread_warp_size=32", "conv2d_nchw.cuda", [["TENSOR", [1, 12, 320, 320], "float32"], ["TENSOR", [64, 12, 3, 3], "float32"], [1, 1], [1, 1, 1, 1], [1, 1], "float32"], {}], "config": {"index": 172323719, "code_hash": null, "entity": [["tile_f", "sp", [-1, 1, 4, 8]], ["tile_y", "sp", [-1, 1, 1, 5]], ["tile_x", "sp", [-1, 1, 16, 1]], ["tile_rc", "sp", [-1, 1]], ["tile_ry", "sp", [-1, 3]], ["tile_rx", "sp", [-1, 3]], ["auto_unroll_max_step", "ot", 0], ["unroll_explicit", "ot", 0]]}, "result": [[0.00044077942110266156], 0, 2.3126344680786133, 1676140537.9572923], "version": 0.2, "tvm_version": "0.11.dev0"}
{"input": ["cuda -keys=cuda,gpu -arch=sm_86 -max_num_threads=1024 -thread_warp_size=32", "conv2d_nchw.cuda", [["TENSOR", [1, 12, 320, 320], "float32"], ["TENSOR", [64, 12, 3, 3], "float32"], [1, 1], [1, 1, 1, 1], [1, 1], "float32"], {}], "config": {"index": 352489599, "code_hash": null, "entity": [["tile_f", "sp", [-1, 1, 16, 4]], ["tile_y", "sp", [-1, 1, 1, 1]], ["tile_x", "sp", [-1, 1, 16, 1]], ["tile_rc", "sp", [-1, 2]], ["tile_ry", "sp", [-1, 1]], ["tile_rx", "sp", [-1, 3]], ["auto_unroll_max_step", "ot", 512], ["unroll_explicit", "ot", 0]]}, "result": [[0.0008025363329305136], 0, 2.3803749084472656, 1676140539.7402802], "version": 0.2, "tvm_version": "0.11.dev0"}
{"input": ["cuda -keys=cuda,gpu -arch=sm_86 -max_num_threads=1024 -thread_warp_size=32", "conv2d_nchw.cuda", [["TENSOR", [1, 12, 320, 320], "float32"], ["TENSOR", [64, 12, 3, 3], "float32"], [1, 1], [1, 1, 1, 1], [1, 1], "float32"], {}], "config": {"index": 58552777, "code_hash": null, "entity": [["tile_f", "sp", [-1, 1, 8, 8]], ["tile_y", "sp", [-1, 1, 1, 5]], ["tile_x", "sp", [-1, 2, 16, 1]], ["tile_rc", "sp", [-1, 1]], ["tile_ry", "sp", [-1, 3]], ["tile_rx", "sp", [-1, 1]], ["auto_unroll_max_step", "ot", 0], ["unroll_explicit", "ot", 0]]}, "result": [[0.0003748758966977138], 0, 2.3158442974090576, 1676140541.5038471], "version": 0.2, "tvm_version": "0.11.dev0"}
{"input": ["cuda -keys=cuda,gpu -arch=sm_86 -max_num_threads=1024 -thread_warp_size=32", "conv2d_nchw.cuda", [["TENSOR", [1, 12, 320, 320], "float32"], ["TENSOR", [64, 12, 3, 3], "float32"], [1, 1], [1, 1, 1, 1], [1, 1], "float32"], {}], "config": {"index": 637008474, "code_hash": null, "entity": [["tile_f", "sp", [-1, 1, 8, 1]], ["tile_y", "sp", [-1, 1, 1, 10]], ["tile_x", "sp", [-1, 1, 16, 1]], ["tile_rc", "sp", [-1, 2]], ["tile_ry", "sp", [-1, 3]], ["tile_rx", "sp", [-1, 3]], ["auto_unroll_max_step", "ot", 1500], ["unroll_explicit", "ot", 0]]}, "result": [[0.0006729235295640915], 0, 2.8080849647521973, 1676140543.498313], "version": 0.2, "tvm_version": "0.11.dev0"}
{"input": ["cuda -keys=cuda,gpu -arch=sm_86 -max_num_threads=1024 -thread_warp_size=32", "conv2d_nchw.cuda", [["TENSOR", [1, 12, 320, 320], "float32"], ["TENSOR", [64, 12, 3, 3], "float32"], [1, 1], [1, 1, 1, 1], [1, 1], "float32"], {}], "config": {"index": 711301274, "code_hash": null, "entity": [["tile_f", "sp", [-1, 2, 32, 1]], ["tile_y", "sp", [-1, 1, 1, 1]], ["tile_x", "sp", [-1, 4, 1, 1]], ["tile_rc", "sp", [-1, 4]], ["tile_ry", "sp", [-1, 1]], ["tile_rx", "sp", [-1, 1]], ["auto_unroll_max_step", "ot", 0], ["unroll_explicit", "ot", 1]]}, "result": [[0.002181287040229885], 0, 2.0422115325927734, 1676140545.112467], "version": 0.2, "tvm_version": "0.11.dev0"}
{"input": ["cuda -keys=cuda,gpu -arch=sm_86 -max_num_threads=1024 -thread_warp_size=32", "conv2d_nchw.cuda", [["TENSOR", [1, 12, 320, 320], "float32"], ["TENSOR", [64, 12, 3, 3], "float32"], [1, 1], [1, 1, 1, 1], [1, 1], "float32"], {}], "config": {"index": 938899610, "code_hash": null, "entity": [["tile_f", "sp", [-1, 2, 32, 1]], ["tile_y", "sp", [-1, 1, 1, 1]], ["tile_x", "sp", [-1, 4, 1, 1]], ["tile_rc", "sp", [-1, 4]], ["tile_ry", "sp", [-1, 1]], ["tile_rx", "sp", [-1, 1]], ["auto_unroll_max_step", "ot", 512], ["unroll_explicit", "ot", 1]]}, "result": [[0.0021789756948176584], 0, 2.2746245861053467, 1676140546.6889374], "version": 0.2, "tvm_version": "0.11.dev0"}
{"input": ["cuda -keys=cuda,gpu -arch=sm_86 -max_num_threads=1024 -thread_warp_size=32", "conv2d_nchw.cuda", [["TENSOR", [1, 12, 320, 320], "float32"], ["TENSOR", [64, 12, 3, 3], "float32"], [1, 1], [1, 1, 1, 1], [1, 1], "float32"], {}], "config": {"index": 172154365, "code_hash": null, "entity": [["tile_f", "sp", [-1, 1, 8, 4]], ["tile_y", "sp", [-1, 1, 1, 5]], ["tile_x", "sp", [-1, 1, 10, 1]], ["tile_rc", "sp", [-1, 1]], ["tile_ry", "sp", [-1, 3]], ["tile_rx", "sp", [-1, 3]], ["auto_unroll_max_step", "ot", 0], ["unroll_explicit", "ot", 0]]}, "result": [[0.0004991766022688209], 0, 2.38724946975708, 1676140548.5850165], "version": 0.2, "tvm_version": "0.11.dev0"}
{"input": ["cuda -keys=cuda,gpu -arch=sm_86 -max_num_threads=1024 -thread_warp_size=32", "conv2d_nchw.cuda", [["TENSOR", [1, 12, 320, 320], "float32"], ["TENSOR", [64, 12, 3, 3], "float32"], [1, 1], [1, 1, 1, 1], [1, 1], "float32"], {}], "config": {"index": 399934237, "code_hash": null, "entity": [["tile_f", "sp", [-1, 1, 8, 8]], ["tile_y", "sp", [-1, 2, 1, 1]], ["tile_x", "sp", [-1, 2, 16, 1]], ["tile_rc", "sp", [-1, 1]], ["tile_ry", "sp", [-1, 3]], ["tile_rx", "sp", [-1, 3]], ["auto_unroll_max_step", "ot", 512], ["unroll_explicit", "ot", 0]]}, "result": [[0.0003524808661498708], 0, 2.3677682876586914, 1676140550.3874202], "version": 0.2, "tvm_version": "0.11.dev0"}
{"input": ["cuda -keys=cuda,gpu -arch=sm_86 -max_num_threads=1024 -thread_warp_size=32", "conv2d_nchw.cuda", [["TENSOR", [1, 12, 320, 320], "float32"], ["TENSOR", [64, 12, 3, 3], "float32"], [1, 1], [1, 1, 1, 1], [1, 1], "float32"], {}], "config": {"index": 115436317, "code_hash": null, "entity": [["tile_f", "sp", [-1, 1, 8, 8]], ["tile_y", "sp", [-1, 2, 1, 1]], ["tile_x", "sp", [-1, 2, 16, 1]], ["tile_rc", "sp", [-1, 1]], ["tile_ry", "sp", [-1, 1]], ["tile_rx", "sp", [-1, 3]], ["auto_unroll_max_step", "ot", 0], ["unroll_explicit", "ot", 0]]}, "result": [[0.0003935127360818538], 0, 2.244013547897339, 1676140552.1248753], "version": 0.2, "tvm_version": "0.11.dev0"}
{"input": ["cuda -keys=cuda,gpu -arch=sm_86 -max_num_threads=1024 -thread_warp_size=32", "conv2d_nchw.cuda", [["TENSOR", [1, 12, 320, 320], "float32"], ["TENSOR", [64, 12, 3, 3], "float32"], [1, 1], [1, 1, 1, 1], [1, 1], "float32"], {}], "config": {"index": 741347785, "code_hash": null, "entity": [["tile_f", "sp", [-1, 1, 8, 8]], ["tile_y", "sp", [-1, 1, 1, 5]], ["tile_x", "sp", [-1, 2, 16, 1]], ["tile_rc", "sp", [-1, 1]], ["tile_ry", "sp", [-1, 3]], ["tile_rx", "sp", [-1, 1]], ["auto_unroll_max_step", "ot", 0], ["unroll_explicit", "ot", 1]]}, "result": [[0.0003755037941259531], 0, 2.3459866046905518, 1676140553.9179454], "version": 0.2, "tvm_version": "0.11.dev0"}
{"input": ["cuda -keys=cuda,gpu -arch=sm_86 -max_num_threads=1024 -thread_warp_size=32", "conv2d_nchw.cuda", [["TENSOR", [1, 12, 320, 320], "float32"], ["TENSOR", [64, 12, 3, 3], "float32"], [1, 1], [1, 1, 1, 1], [1, 1], "float32"], {}], "config": {"index": 808533296, "code_hash": null, "entity": [["tile_f", "sp", [-1, 16, 1, 2]], ["tile_y", "sp", [-1, 8, 1, 1]], ["tile_x", "sp", [-1, 5, 1, 2]], ["tile_rc", "sp", [-1, 2]], ["tile_ry", "sp", [-1, 1]], ["tile_rx", "sp", [-1, 3]], ["auto_unroll_max_step", "ot", 0], ["unroll_explicit", "ot", 1]]}, "result": [[0.5772824706999999], 0, 11.43320369720459, 1676140560.6952953], "version": 0.2, "tvm_version": "0.11.dev0"}
{"input": ["cuda -keys=cuda,gpu -arch=sm_86 -max_num_threads=1024 -thread_warp_size=32", "conv2d_nchw.cuda", [["TENSOR", [1, 12, 320, 320], "float32"], ["TENSOR", [64, 12, 3, 3], "float32"], [1, 1], [1, 1, 1, 1], [1, 1], "float32"], {}], "config": {"index": 826497832, "code_hash": null, "entity": [["tile_f", "sp", [-1, 4, 1, 16]], ["tile_y", "sp", [-1, 1, 5, 4]], ["tile_x", "sp", [-1, 1, 10, 1]], ["tile_rc", "sp", [-1, 4]], ["tile_ry", "sp", [-1, 1]], ["tile_rx", "sp", [-1, 3]], ["auto_unroll_max_step", "ot", 0], ["unroll_explicit", "ot", 1]]}, "result": [[0.010329709444444444], 0, 3.0876176357269287, 1676140562.3157957], "version": 0.2, "tvm_version": "0.11.dev0"}
{"input": ["cuda -keys=cuda,gpu -arch=sm_86 -max_num_threads=1024 -thread_warp_size=32", "conv2d_nchw.cuda", [["TENSOR", [1, 12, 320, 320], "float32"], ["TENSOR", [64, 12, 3, 3], "float32"], [1, 1], [1, 1, 1, 1], [1, 1], "float32"], {}], "config": {"index": 172351935, "code_hash": null, "entity": [["tile_f", "sp", [-1, 1, 16, 4]], ["tile_y", "sp", [-1, 1, 1, 5]], ["tile_x", "sp", [-1, 2, 16, 1]], ["tile_rc", "sp", [-1, 1]], ["tile_ry", "sp", [-1, 3]], ["tile_rx", "sp", [-1, 3]], ["auto_unroll_max_step", "ot", 0], ["unroll_explicit", "ot", 0]]}, "result": [[0.0004313239443835616], 0, 3.1851954460144043, 1676140588.1181574], "version": 0.2, "tvm_version": "0.11.dev0"}
{"input": ["cuda -keys=cuda,gpu -arch=sm_86 -max_num_threads=1024 -thread_warp_size=32", "conv2d_nchw.cuda", [["TENSOR", [1, 12, 320, 320], "float32"], ["TENSOR", [64, 12, 3, 3], "float32"], [1, 1], [1, 1, 1, 1], [1, 1], "float32"], {}], "config": {"index": 172380159, "code_hash": null, "entity": [["tile_f", "sp", [-1, 1, 16, 4]], ["tile_y", "sp", [-1, 1, 1, 5]], ["tile_x", "sp", [-1, 4, 16, 1]], ["tile_rc", "sp", [-1, 1]], ["tile_ry", "sp", [-1, 3]], ["tile_rx", "sp", [-1, 3]], ["auto_unroll_max_step", "ot", 0], ["unroll_explicit", "ot", 0]]}, "result": [[0.00041400691382281974], 0, 1.9370543956756592, 1676140589.7782753], "version": 0.2, "tvm_version": "0.11.dev0"}
{"input": ["cuda -keys=cuda,gpu -arch=sm_86 -max_num_threads=1024 -thread_warp_size=32", "conv2d_nchw_winograd.cuda", [["TENSOR", [1, 12, 320, 320], "float32"], ["TENSOR", [64, 12, 3, 3], "float32"], [1, 1], [1, 1, 1, 1], [1, 1], "float32"], {}], "config": {"index": 275379, "code_hash": null, "entity": [["tile_b", "sp", [-1, 1, 1, 1]], ["tile_y", "sp", [-1, 1, 64, 1]], ["tile_x", "sp", [-1, 2, 1, 800]], ["tile_rc", "sp", [-1, 2]], ["auto_unroll_max_step", "ot", 0], ["unroll_explicit", "ot", 0]]}, "result": [[0.006086431043137255], 0, 11.659496068954468, 1676140607.2955518], "version": 0.2, "tvm_version": "0.11.dev0"}
{"input": ["cuda -keys=cuda,gpu -arch=sm_86 -max_num_threads=1024 -thread_warp_size=32", "conv2d_nchw_winograd.cuda", [["TENSOR", [1, 12, 320, 320], "float32"], ["TENSOR", [64, 12, 3, 3], "float32"], [1, 1], [1, 1, 1, 1], [1, 1], "float32"], {}], "config": {"index": 1952867, "code_hash": null, "entity": [["tile_b", "sp", [-1, 1, 1, 1]], ["tile_y", "sp", [-1, 2, 2, 2]], ["tile_x", "sp", [-1, 40, 20, 1]], ["tile_rc", "sp", [-1, 3]], ["auto_unroll_max_step", "ot", 1500], ["unroll_explicit", "ot", 0]]}, "result": [[0.0008196394198767335], 0, 6.474301338195801, 1676140608.8373466], "version": 0.2, "tvm_version": "0.11.dev0"}
{"input": ["cuda -keys=cuda,gpu -arch=sm_86 -max_num_threads=1024 -thread_warp_size=32", "conv2d_nchw_winograd.cuda", [["TENSOR", [1, 12, 320, 320], "float32"], ["TENSOR", [64, 12, 3, 3], "float32"], [1, 1], [1, 1, 1, 1], [1, 1], "float32"], {}], "config": {"index": 3362302, "code_hash": null, "entity": [["tile_b", "sp", [-1, 1, 1, 1]], ["tile_y", "sp", [-1, 1, 2, 2]], ["tile_x", "sp", [-1, 40, 40, 2]], ["tile_rc", "sp", [-1, 1]], ["auto_unroll_max_step", "ot", 128], ["unroll_explicit", "ot", 1]]}, "result": [[0.000786848291464261], 0, 7.740395545959473, 1676140610.4497352], "version": 0.2, "tvm_version": "0.11.dev0"}
{"input": ["cuda -keys=cuda,gpu -arch=sm_86 -max_num_threads=1024 -thread_warp_size=32", "conv2d_nchw_winograd.cuda", [["TENSOR", [1, 12, 320, 320], "float32"], ["TENSOR", [64, 12, 3, 3], "float32"], [1, 1], [1, 1, 1, 1], [1, 1], "float32"], {}], "config": {"index": 3826615, "code_hash": null, "entity": [["tile_b", "sp", [-1, 1, 1, 1]], ["tile_y", "sp", [-1, 1, 4, 16]], ["tile_x", "sp", [-1, 4, 40, 10]], ["tile_rc", "sp", [-1, 4]], ["auto_unroll_max_step", "ot", 128], ["unroll_explicit", "ot", 1]]}, "result": [[0.005669384627118644], 0, 7.799984931945801, 1676140611.9756284], "version": 0.2, "tvm_version": "0.11.dev0"}
{"input": ["cuda -keys=cuda,gpu -arch=sm_86 -max_num_threads=1024 -thread_warp_size=32", "conv2d_nchw_winograd.cuda", [["TENSOR", [1, 12, 320, 320], "float32"], ["TENSOR", [64, 12, 3, 3], "float32"], [1, 1], [1, 1, 1, 1], [1, 1], "float32"], {}], "config": {"index": 3634324, "code_hash": null, "entity": [["tile_b", "sp", [-1, 1, 1, 1]], ["tile_y", "sp", [-1, 1, 1, 8]], ["tile_x", "sp", [-1, 2, 10, 2]], ["tile_rc", "sp", [-1, 3]], ["auto_unroll_max_step", "ot", 128], ["unroll_explicit", "ot", 1]]}, "result": [[0.0008269823872340427], 0, 5.455276250839233, 1676140613.5852528], "version": 0.2, "tvm_version": "0.11.dev0"}
{"input": ["cuda -keys=cuda,gpu -arch=sm_86 -max_num_threads=1024 -thread_warp_size=32", "conv2d_nchw_winograd.cuda", [["TENSOR", [1, 12, 320, 320], "float32"], ["TENSOR", [64, 12, 3, 3], "float32"], [1, 1], [1, 1, 1, 1], [1, 1], "float32"], {}], "config": {"index": 4746872, "code_hash": null, "entity": [["tile_b", "sp", [-1, 1, 1, 1]], ["tile_y", "sp", [-1, 16, 1, 2]], ["tile_x", "sp", [-1, 1, 32, 2]], ["tile_rc", "sp", [-1, 6]], ["auto_unroll_max_step", "ot", 1500], ["unroll_explicit", "ot", 1]]}, "result": [[0.0005571285681063123], 0, 6.48835825920105, 1676140615.06203], "version": 0.2, "tvm_version": "0.11.dev0"}
{"input": ["cuda -keys=cuda,gpu -arch=sm_86 -max_num_threads=1024 -thread_warp_size=32", "conv2d_nchw_winograd.cuda", [["TENSOR", [1, 12, 320, 320], "float32"], ["TENSOR", [64, 12, 3, 3], "float32"], [1, 1], [1, 1, 1, 1], [1, 1], "float32"], {}], "config": {"index": 1953486, "code_hash": null, "entity": [["tile_b", "sp", [-1, 1, 1, 1]], ["tile_y", "sp", [-1, 4, 1, 8]], ["tile_x", "sp", [-1, 4, 25, 1]], ["tile_rc", "sp", [-1, 3]], ["auto_unroll_max_step", "ot", 1500], ["unroll_explicit", "ot", 0]]}, "result": [[0.0005753030748999428], 0, 6.540302276611328, 1676140616.556534], "version": 0.2, "tvm_version": "0.11.dev0"}
{"input": ["cuda -keys=cuda,gpu -arch=sm_86 -max_num_threads=1024 -thread_warp_size=32", "conv2d_nchw_winograd.cuda", [["TENSOR", [1, 12, 320, 320], "float32"], ["TENSOR", [64, 12, 3, 3], "float32"], [1, 1], [1, 1, 1, 1], [1, 1], "float32"], {}], "config": {"index": 1534414, "code_hash": null, "entity": [["tile_b", "sp", [-1, 1, 1, 1]], ["tile_y", "sp", [-1, 4, 2, 8]], ["tile_x", "sp", [-1, 32, 10, 1]], ["tile_rc", "sp", [-1, 12]], ["auto_unroll_max_step", "ot", 128], ["unroll_explicit", "ot", 0]]}, "result": [[0.006721583013422818], 0, 7.574023723602295, 1676140618.0977702], "version": 0.2, "tvm_version": "0.11.dev0"}
{"input": ["cuda -keys=cuda,gpu -arch=sm_86 -max_num_threads=1024 -thread_warp_size=32", "conv2d_nchw_winograd.cuda", [["TENSOR", [1, 12, 320, 320], "float32"], ["TENSOR", [64, 12, 3, 3], "float32"], [1, 1], [1, 1, 1, 1], [1, 1], "float32"], {}], "config": {"index": 1409062, "code_hash": null, "entity": [["tile_b", "sp", [-1, 1, 1, 1]], ["tile_y", "sp", [-1, 1, 16, 2]], ["tile_x", "sp", [-1, 8, 1, 2]], ["tile_rc", "sp", [-1, 6]], ["auto_unroll_max_step", "ot", 128], ["unroll_explicit", "ot", 0]]}, "result": [[0.0012919364075774972], 0, 6.609421253204346, 1676140619.7400324], "version": 0.2, "tvm_version": "0.11.dev0"}
{"input": ["cuda -keys=cuda,gpu -arch=sm_86 -max_num_threads=1024 -thread_warp_size=32", "conv2d_nchw_winograd.cuda", [["TENSOR", [1, 12, 320, 320], "float32"], ["TENSOR", [64, 12, 3, 3], "float32"], [1, 1], [1, 1, 1, 1], [1, 1], "float32"], {}], "config": {"index": 1724129, "code_hash": null, "entity": [["tile_b", "sp", [-1, 1, 1, 1]], ["tile_y", "sp", [-1, 2, 1, 2]], ["tile_x", "sp", [-1, 4, 10, 5]], ["tile_rc", "sp", [-1, 1]], ["auto_unroll_max_step", "ot", 1500], ["unroll_explicit", "ot", 0]]}, "result": [[0.0012223543260188087], 0, 7.2541913986206055, 1676140621.3738759], "version": 0.2, "tvm_version": "0.11.dev0"}
{"input": ["cuda -keys=cuda,gpu -arch=sm_86 -max_num_threads=1024 -thread_warp_size=32", "conv2d_nchw_winograd.cuda", [["TENSOR", [1, 12, 320, 320], "float32"], ["TENSOR", [64, 12, 3, 3], "float32"], [1, 1], [1, 1, 1, 1], [1, 1], "float32"], {}], "config": {"index": 3211107, "code_hash": null, "entity": [["tile_b", "sp", [-1, 1, 1, 1]], ["tile_y", "sp", [-1, 1, 4, 2]], ["tile_x", "sp", [-1, 20, 1, 2]], ["tile_rc", "sp", [-1, 12]], ["auto_unroll_max_step", "ot", 0], ["unroll_explicit", "ot", 1]]}, "result": [[0.0013926833525943396], 0, 7.010052919387817, 1676140623.043575], "version": 0.2, "tvm_version": "0.11.dev0"}
{"input": ["cuda -keys=cuda,gpu -arch=sm_86 -max_num_threads=1024 -thread_warp_size=32", "conv2d_nchw_winograd.cuda", [["TENSOR", [1, 12, 320, 320], "float32"], ["TENSOR", [64, 12, 3, 3], "float32"], [1, 1], [1, 1, 1, 1], [1, 1], "float32"], {}], "config": {"index": 791300, "code_hash": null, "entity": [["tile_b", "sp", [-1, 1, 1, 1]], ["tile_y", "sp", [-1, 4, 8, 1]], ["tile_x", "sp", [-1, 1, 16, 20]], ["tile_rc", "sp", [-1, 12]], ["auto_unroll_max_step", "ot", 0], ["unroll_explicit", "ot", 0]]}, "result": [[0.0013240889939467313], 0, 6.577784061431885, 1676140624.6486988], "version": 0.2, "tvm_version": "0.11.dev0"}
{"input": ["cuda -keys=cuda,gpu -arch=sm_86 -max_num_threads=1024 -thread_warp_size=32", "conv2d_nchw_winograd.cuda", [["TENSOR", [1, 12, 320, 320], "float32"], ["TENSOR", [64, 12, 3, 3], "float32"], [1, 1], [1, 1, 1, 1], [1, 1], "float32"], {}], "config": {"index": 2167734, "code_hash": null, "entity": [["tile_b", "sp", [-1, 1, 1, 1]], ["tile_y", "sp", [-1, 4, 1, 2]], ["tile_x", "sp", [-1, 25, 4, 16]], ["tile_rc", "sp", [-1, 4]], ["auto_unroll_max_step", "ot", 1500], ["unroll_explicit", "ot", 0]]}, "result": [[0.030209587529411764], 0, 7.427130937576294, 1676140626.4788604], "version": 0.2, "tvm_version": "0.11.dev0"}
{"input": ["cuda -keys=cuda,gpu -arch=sm_86 -max_num_threads=1024 -thread_warp_size=32", "conv2d_nchw_winograd.cuda", [["TENSOR", [1, 12, 320, 320], "float32"], ["TENSOR", [64, 12, 3, 3], "float32"], [1, 1], [1, 1, 1, 1], [1, 1], "float32"], {}], "config": {"index": 972850, "code_hash": null, "entity": [["tile_b", "sp", [-1, 1, 1, 1]], ["tile_y", "sp", [-1, 1, 16, 2]], ["tile_x", "sp", [-1, 8, 2, 1]], ["tile_rc", "sp", [-1, 2]], ["auto_unroll_max_step", "ot", 128], ["unroll_explicit", "ot", 0]]}, "result": [[0.0008710955735632184], 0, 6.38788104057312, 1676140638.7879136], "version": 0.2, "tvm_version": "0.11.dev0"}
{"input": ["cuda -keys=cuda,gpu -arch=sm_86 -max_num_threads=1024 -thread_warp_size=32", "conv2d_nchw_winograd.cuda", [["TENSOR", [1, 12, 320, 320], "float32"], ["TENSOR", [64, 12, 3, 3], "float32"], [1, 1], [1, 1, 1, 1], [1, 1], "float32"], {}], "config": {"index": 3147529, "code_hash": null, "entity": [["tile_b", "sp", [-1, 1, 1, 1]], ["tile_y", "sp", [-1, 1, 1, 4]], ["tile_x", "sp", [-1, 1, 16, 20]], ["tile_rc", "sp", [-1, 6]], ["auto_unroll_max_step", "ot", 0], ["unroll_explicit", "ot", 1]]}, "result": [[0.0011532843658291455], 0, 5.307345151901245, 1676140640.9575648], "version": 0.2, "tvm_version": "0.11.dev0"}
{"input": ["cuda -keys=cuda,gpu -arch=sm_86 -max_num_threads=1024 -thread_warp_size=32", "conv2d_nchw_winograd.cuda", [["TENSOR", [1, 12, 320, 320], "float32"], ["TENSOR", [64, 12, 3, 3], "float32"], [1, 1], [1, 1, 1, 1], [1, 1], "float32"], {}], "config": {"index": 1676434, "code_hash": null, "entity": [["tile_b", "sp", [-1, 1, 1, 1]], ["tile_y", "sp", [-1, 1, 16, 2]], ["tile_x", "sp", [-1, 16, 25, 1]], ["tile_rc", "sp", [-1, 1]], ["auto_unroll_max_step", "ot", 1500], ["unroll_explicit", "ot", 0]]}, "result": [[0.0006543391209130166], 0, 6.264468669891357, 1676140642.4876351], "version": 0.2, "tvm_version": "0.11.dev0"}
{"input": ["cuda -keys=cuda,gpu -arch=sm_86 -max_num_threads=1024 -thread_warp_size=32", "conv2d_nchw_winograd.cuda", [["TENSOR", [1, 12, 320, 320], "float32"], ["TENSOR", [64, 12, 3, 3], "float32"], [1, 1], [1, 1, 1, 1], [1, 1], "float32"], {}], "config": {"index": 645791, "code_hash": null, "entity": [["tile_b", "sp", [-1, 1, 1, 1]], ["tile_y", "sp", [-1, 1, 1, 64]], ["tile_x", "sp", [-1, 2, 20, 16]], ["tile_rc", "sp", [-1, 6]], ["auto_unroll_max_step", "ot", 0], ["unroll_explicit", "ot", 0]]}, "result": [[0.006476714103225805], 0, 6.887484312057495, 1676140644.0030184], "version": 0.2, "tvm_version": "0.11.dev0"}
{"input": ["cuda -keys=cuda,gpu -arch=sm_86 -max_num_threads=1024 -thread_warp_size=32", "conv2d_nchw_winograd.cuda", [["TENSOR", [1, 12, 320, 320], "float32"], ["TENSOR", [64, 12, 3, 3], "float32"], [1, 1], [1, 1, 1, 1], [1, 1], "float32"], {}], "config": {"index": 3992745, "code_hash": null, "entity": [["tile_b", "sp", [-1, 1, 1, 1]], ["tile_y", "sp", [-1, 8, 2, 4]], ["tile_x", "sp", [-1, 1, 5, 40]], ["tile_rc", "sp", [-1, 6]], ["auto_unroll_max_step", "ot", 128], ["unroll_explicit", "ot", 1]]}, "result": [[0.00901894574336283], 0, 8.307761192321777, 1676140645.5593793], "version": 0.2, "tvm_version": "0.11.dev0"}
{"input": ["cuda -keys=cuda,gpu -arch=sm_86 -max_num_threads=1024 -thread_warp_size=32", "conv2d_nchw_winograd.cuda", [["TENSOR", [1, 12, 320, 320], "float32"], ["TENSOR", [64, 12, 3, 3], "float32"], [1, 1], [1, 1, 1, 1], [1, 1], "float32"], {}], "config": {"index": 811972, "code_hash": null, "entity": [["tile_b", "sp", [-1, 1, 1, 1]], ["tile_y", "sp", [-1, 1, 1, 2]], ["tile_x", "sp", [-1, 1, 4, 64]], ["tile_rc", "sp", [-1, 12]], ["auto_unroll_max_step", "ot", 0], ["unroll_explicit", "ot", 0]]}, "result": [[0.0027927519318734794], 0, 6.75887131690979, 1676140647.2310464], "version": 0.2, "tvm_version": "0.11.dev0"}
{"input": ["cuda -keys=cuda,gpu -arch=sm_86 -max_num_threads=1024 -thread_warp_size=32", "conv2d_nchw_winograd.cuda", [["TENSOR", [1, 12, 320, 320], "float32"], ["TENSOR", [64, 12, 3, 3], "float32"], [1, 1], [1, 1, 1, 1], [1, 1], "float32"], {}], "config": {"index": 4159158, "code_hash": null, "entity": [["tile_b", "sp", [-1, 1, 1, 1]], ["tile_y", "sp", [-1, 4, 1, 8]], ["tile_x", "sp", [-1, 80, 1, 1]], ["tile_rc", "sp", [-1, 1]], ["auto_unroll_max_step", "ot", 1500], ["unroll_explicit", "ot", 1]]}, "result": [[0.13834967039999999], 0, 10.48619556427002, 1676140649.2419522], "version": 0.2, "tvm_version": "0.11.dev0"}
{"input": ["cuda -keys=cuda,gpu -arch=sm_86 -max_num_threads=1024 -thread_warp_size=32", "conv2d_nchw_winograd.cuda", [["TENSOR", [1, 12, 320, 320], "float32"], ["TENSOR", [64, 12, 3, 3], "float32"], [1, 1], [1, 1, 1, 1], [1, 1], "float32"], {}], "config": {"index": 4735387, "code_hash": null, "entity": [["tile_b", "sp", [-1, 1, 1, 1]], ["tile_y", "sp", [-1, 2, 2, 4]], ["tile_x", "sp", [-1, 5, 1, 2]], ["tile_rc", "sp", [-1, 6]], ["auto_unroll_max_step", "ot", 1500], ["unroll_explicit", "ot", 1]]}, "result": [[0.002201285486891386], 0, 6.954588413238525, 1676140650.9159977], "version": 0.2, "tvm_version": "0.11.dev0"}
{"input": ["cuda -keys=cuda,gpu -arch=sm_86 -max_num_threads=1024 -thread_warp_size=32", "conv2d_nchw_winograd.cuda", [["TENSOR", [1, 12, 320, 320], "float32"], ["TENSOR", [64, 12, 3, 3], "float32"], [1, 1], [1, 1, 1, 1], [1, 1], "float32"], {}], "config": {"index": 182045, "code_hash": null, "entity": [["tile_b", "sp", [-1, 1, 1, 1]], ["tile_y", "sp", [-1, 16, 4, 1]], ["tile_x", "sp", [-1, 40, 2, 4]], ["tile_rc", "sp", [-1, 2]], ["auto_unroll_max_step", "ot", 0], ["unroll_explicit", "ot", 0]]}, "result": [[0.016300956467741937], 0, 7.72327733039856, 1676140652.5546112], "version": 0.2, "tvm_version": "0.11.dev0"}
{"input": ["cuda -keys=cuda,gpu -arch=sm_86 -max_num_threads=1024 -thread_warp_size=32", "conv2d_nchw_winograd.cuda", [["TENSOR", [1, 12, 320, 320], "float32"], ["TENSOR", [64, 12, 3, 3], "float32"], [1, 1], [1, 1, 1, 1], [1, 1], "float32"], {}], "config": {"index": 2614301, "code_hash": null, "entity": [["tile_b", "sp", [-1, 1, 1, 1]], ["tile_y", "sp", [-1, 16, 1, 4]], ["tile_x", "sp", [-1, 5, 5, 64]], ["tile_rc", "sp", [-1, 1]], ["auto_unroll_max_step", "ot", 0], ["unroll_explicit", "ot", 1]]}, "result": [[0.03034946693939394], 0, 7.775145530700684, 1676140654.3598208], "version": 0.2, "tvm_version": "0.11.dev0"}
{"input": ["cuda -keys=cuda,gpu -arch=sm_86 -max_num_threads=1024 -thread_warp_size=32", "conv2d_nchw_winograd.cuda", [["TENSOR", [1, 12, 320, 320], "float32"], ["TENSOR", [64, 12, 3, 3], "float32"], [1, 1], [1, 1, 1, 1], [1, 1], "float32"], {}], "config": {"index": 2667452, "code_hash": null, "entity": [["tile_b", "sp", [-1, 1, 1, 1]], ["tile_y", "sp", [-1, 16, 1, 2]], ["tile_x", "sp", [-1, 8, 25, 2]], ["tile_rc", "sp", [-1, 2]], ["auto_unroll_max_step", "ot", 0], ["unroll_explicit", "ot", 1]]}, "result": [[0.0069679209375], 0, 7.6194775104522705, 1676140655.8637376], "version": 0.2, "tvm_version": "0.11.dev0"}
{"input": ["cuda -keys=cuda,gpu -arch=sm_86 -max_num_threads=1024 -thread_warp_size=32", "conv2d_nchw_winograd.cuda", [["TENSOR", [1, 12, 320, 320], "float32"], ["TENSOR", [64, 12, 3, 3], "float32"], [1, 1], [1, 1, 1, 1], [1, 1], "float32"], {}], "config": {"index": 427944, "code_hash": null, "entity": [["tile_b", "sp", [-1, 1, 1, 1]], ["tile_y", "sp", [-1, 1, 32, 2]], ["tile_x", "sp", [-1, 10, 20, 1]], ["tile_rc", "sp", [-1, 4]], ["auto_unroll_max_step", "ot", 0], ["unroll_explicit", "ot", 0]]}, "result": [[0.0006454846046901173], 0, 6.331588268280029, 1676140669.1569364], "version": 0.2, "tvm_version": "0.11.dev0"}
{"input": ["cuda -keys=cuda,gpu -arch=sm_86 -max_num_threads=1024 -thread_warp_size=32", "conv2d_nchw_winograd.cuda", [["TENSOR", [1, 12, 320, 320], "float32"], ["TENSOR", [64, 12, 3, 3], "float32"], [1, 1], [1, 1, 1, 1], [1, 1], "float32"], {}], "config": {"index": 1263862, "code_hash": null, "entity": [["tile_b", "sp", [-1, 1, 1, 1]], ["tile_y", "sp", [-1, 1, 2, 32]], ["tile_x", "sp", [-1, 2, 64, 1]], ["tile_rc", "sp", [-1, 4]], ["auto_unroll_max_step", "ot", 128], ["unroll_explicit", "ot", 0]]}, "result": [[0.0005568550598669623], 0, 5.077845573425293, 1676140670.6166935], "version": 0.2, "tvm_version": "0.11.dev0"}
{"input": ["cuda -keys=cuda,gpu -arch=sm_86 -max_num_threads=1024 -thread_warp_size=32", "conv2d_nchw_winograd.cuda", [["TENSOR", [1, 12, 320, 320], "float32"], ["TENSOR", [64, 12, 3, 3], "float32"], [1, 1], [1, 1, 1, 1], [1, 1], "float32"], {}], "config": {"index": 995188, "code_hash": null, "entity": [["tile_b", "sp", [-1, 1, 1, 1]], ["tile_y", "sp", [-1, 2, 4, 2]], ["tile_x", "sp", [-1, 5, 2, 2]], ["tile_rc", "sp", [-1, 2]], ["auto_unroll_max_step", "ot", 128], ["unroll_explicit", "ot", 0]]}, "result": [[0.0009542080058187864], 0, 6.4064719676971436, 1676140672.2235236], "version": 0.2, "tvm_version": "0.11.dev0"}
{"input": ["cuda -keys=cuda,gpu -arch=sm_86 -max_num_threads=1024 -thread_warp_size=32", "conv2d_nchw_winograd.cuda", [["TENSOR", [1, 12, 320, 320], "float32"], ["TENSOR", [64, 12, 3, 3], "float32"], [1, 1], [1, 1, 1, 1], [1, 1], "float32"], {}], "config": {"index": 3657644, "code_hash": null, "entity": [["tile_b", "sp", [-1, 1, 1, 1]], ["tile_y", "sp", [-1, 16, 1, 2]], ["tile_x", "sp", [-1, 2, 200, 4]], ["tile_rc", "sp", [-1, 3]], ["auto_unroll_max_step", "ot", 128], ["unroll_explicit", "ot", 1]]}, "result": [[0.0011079536490850375], 0, 8.204851150512695, 1676140673.808484], "version": 0.2, "tvm_version": "0.11.dev0"}
{"input": ["cuda -keys=cuda,gpu -arch=sm_86 -max_num_threads=1024 -thread_warp_size=32", "conv2d_nchw_winograd.cuda", [["TENSOR", [1, 12, 320, 320], "float32"], ["TENSOR", [64, 12, 3, 3], "float32"], [1, 1], [1, 1, 1, 1], [1, 1], "float32"], {}], "config": {"index": 3903936, "code_hash": null, "entity": [["tile_b", "sp", [-1, 1, 1, 1]], ["tile_y", "sp", [-1, 4, 2, 2]], ["tile_x", "sp", [-1, 10, 1, 2]], ["tile_rc", "sp", [-1, 6]], ["auto_unroll_max_step", "ot", 128], ["unroll_explicit", "ot", 1]]}, "result": [[0.0019763730652173914], 0, 7.982138633728027, 1676140675.4640458], "version": 0.2, "tvm_version": "0.11.dev0"}
{"input": ["cuda -keys=cuda,gpu -arch=sm_86 -max_num_threads=1024 -thread_warp_size=32", "conv2d_nchw_winograd.cuda", [["TENSOR", [1, 12, 320, 320], "float32"], ["TENSOR", [64, 12, 3, 3], "float32"], [1, 1], [1, 1, 1, 1], [1, 1], "float32"], {}], "config": {"index": 3518401, "code_hash": null, "entity": [["tile_b", "sp", [-1, 1, 1, 1]], ["tile_y", "sp", [-1, 1, 8, 4]], ["tile_x", "sp", [-1, 4, 100, 4]], ["tile_rc", "sp", [-1, 2]], ["auto_unroll_max_step", "ot", 128], ["unroll_explicit", "ot", 1]]}, "result": [[0.0010398600019493178], 0, 6.880187511444092, 1676140676.9880605], "version": 0.2, "tvm_version": "0.11.dev0"}
{"input": ["cuda -keys=cuda,gpu -arch=sm_86 -max_num_threads=1024 -thread_warp_size=32", "conv2d_nchw_winograd.cuda", [["TENSOR", [1, 12, 320, 320], "float32"], ["TENSOR", [64, 12, 3, 3], "float32"], [1, 1], [1, 1, 1, 1], [1, 1], "float32"], {}], "config": {"index": 1750847, "code_hash": null, "entity": [["tile_b", "sp", [-1, 1, 1, 1]], ["tile_y", "sp", [-1, 2, 2, 2]], ["tile_x", "sp", [-1, 10, 2, 16]], ["tile_rc", "sp", [-1, 1]], ["auto_unroll_max_step", "ot", 1500], ["unroll_explicit", "ot", 0]]}, "result": [[0.02339763834883721], 0, 7.932913303375244, 1676140678.7120144], "version": 0.2, "tvm_version": "0.11.dev0"}
{"input": ["cuda -keys=cuda,gpu -arch=sm_86 -max_num_threads=1024 -thread_warp_size=32", "conv2d_nchw_winograd.cuda", [["TENSOR", [1, 12, 320, 320], "float32"], ["TENSOR", [64, 12, 3, 3], "float32"], [1, 1], [1, 1, 1, 1], [1, 1], "float32"], {}], "config": {"index": 3551436, "code_hash": null, "entity": [["tile_b", "sp", [-1, 1, 1, 1]], ["tile_y", "sp", [-1, 1, 1, 1]], ["tile_x", "sp", [-1, 16, 1, 16]], ["tile_rc", "sp", [-1, 2]], ["auto_unroll_max_step", "ot", 128], ["unroll_explicit", "ot", 1]]}, "result": [[0.031736448281249996], 0, 9.355003356933594, 1676140680.5076265], "version": 0.2, "tvm_version": "0.11.dev0"}
