tuning_records/yolox_tiny_fp16_tuning-records.json
{"input": ["cuda -keys=cuda,gpu -arch=sm_86 -max_num_threads=1024 -thread_warp_size=32", "conv2d_nchw.cuda", [["TENSOR", [1, 12, 208, 208], "float16"], ["TENSOR", [24, 12, 3, 3], "float16"], [1, 1], [1, 1, 1, 1], [1, 1], "float16"], {}], "config": {"index": 51584337, "code_hash": null, "entity": [["tile_f", "sp", [-1, 8, 3, 1]], ["tile_y", "sp", [-1, 4, 1, 13]], ["tile_x", "sp", [-1, 2, 2, 26]], ["tile_rc", "sp", [-1, 3]], ["tile_ry", "sp", [-1, 3]], ["tile_rx", "sp", [-1, 1]], ["auto_unroll_max_step", "ot", 512], ["unroll_explicit", "ot", 0]]}, "result": [[0.026388856072727274], 0, 4.738249063491821, 1671381895.7073312], "version": 0.2, "tvm_version": "0.11.dev0"}
{"input": ["cuda -keys=cuda,gpu -arch=sm_86 -max_num_threads=1024 -thread_warp_size=32", "conv2d_nchw.cuda", [["TENSOR", [1, 12, 208, 208], "float16"], ["TENSOR", [24, 12, 3, 3], "float16"], [1, 1], [1, 1, 1, 1], [1, 1], "float16"], {}], "config": {"index": 145331293, "code_hash": null, "entity": [["tile_f", "sp", [-1, 12, 2, 1]], ["tile_y", "sp", [-1, 2, 1, 1]], ["tile_x", "sp", [-1, 26, 1, 8]], ["tile_rc", "sp", [-1, 3]], ["tile_ry", "sp", [-1, 3]], ["tile_rx", "sp", [-1, 3]], ["auto_unroll_max_step", "ot", 0], ["unroll_explicit", "ot", 1]]}, "result": [[0.03217107009375], 0, 3.7388956546783447, 1671381897.4841602], "version": 0.2, "tvm_version": "0.11.dev0"}
{"input": ["cuda -keys=cuda,gpu -arch=sm_86 -max_num_threads=1024 -thread_warp_size=32", "conv2d_nchw.cuda", [["TENSOR", [1, 12, 208, 208], "float16"], ["TENSOR", [24, 12, 3, 3], "float16"], [1, 1], [1, 1, 1, 1], [1, 1], "float16"], {}], "config": {"index": 163264752, "code_hash": null, "entity": [["tile_f", "sp", [-1, 3, 1, 2]], ["tile_y", "sp", [-1, 2, 13, 1]], ["tile_x", "sp", [-1, 104, 2, 1]], ["tile_rc", "sp", [-1, 3]], ["tile_ry", "sp", [-1, 3]], ["tile_rx", "sp", [-1, 1]], ["auto_unroll_max_step", "ot", 512], ["unroll_explicit", "ot", 1]]}, "result": [[0.003293564221875], 0, 2.9036333560943604, 1671381899.4884477], "version": 0.2, "tvm_version": "0.11.dev0"}
{"input": ["cuda -keys=cuda,gpu -arch=sm_86 -max_num_threads=1024 -thread_warp_size=32", "conv2d_nchw.cuda", [["TENSOR", [1, 12, 208, 208], "float16"], ["TENSOR", [24, 12, 3, 3], "float16"], [1, 1], [1, 1, 1, 1], [1, 1], "float16"], {}], "config": {"index": 42027480, "code_hash": null, "entity": [["tile_f", "sp", [-1, 1, 3, 2]], ["tile_y", "sp", [-1, 1, 8, 2]], ["tile_x", "sp", [-1, 2, 4, 13]], ["tile_rc", "sp", [-1, 3]], ["tile_ry", "sp", [-1, 1]], ["tile_rx", "sp", [-1, 1]], ["auto_unroll_max_step", "ot", 512], ["unroll_explicit", "ot", 0]]}, "result": [[0.00027294068172537006], 0, 2.9618825912475586, 1671381901.4686973], "version": 0.2, "tvm_version": "0.11.dev0"}
{"input": ["cuda -keys=cuda,gpu -arch=sm_86 -max_num_threads=1024 -thread_warp_size=32", "conv2d_nchw.cuda", [["TENSOR", [1, 12, 208, 208], "float16"], ["TENSOR", [24, 12, 3, 3], "float16"], [1, 1], [1, 1, 1, 1], [1, 1], "float16"], {}], "config": {"index": 45445965, "code_hash": null, "entity": [["tile_f", "sp", [-1, 1, 6, 2]], ["tile_y", "sp", [-1, 2, 1, 8]], ["tile_x", "sp", [-1, 2, 1, 104]], ["tile_rc", "sp", [-1, 6]], ["tile_ry", "sp", [-1, 1]], ["tile_rx", "sp", [-1, 1]], ["auto_unroll_max_step", "ot", 512], ["unroll_explicit", "ot", 0]]}, "result": [[0.013389001934210528], 0, 4.780212163925171, 1671381902.9875083], "version": 0.2, "tvm_version": "0.11.dev0"}
{"input": ["cuda -keys=cuda,gpu -arch=sm_86 -max_num_threads=1024 -thread_warp_size=32", "conv2d_nchw.cuda", [["TENSOR", [1, 12, 208, 208], "float16"], ["TENSOR", [24, 12, 3, 3], "float16"], [1, 1], [1, 1, 1, 1], [1, 1], "float16"], {}], "config": {"index": 80401379, "code_hash": null, "entity": [["tile_f", "sp", [-1, 2, 4, 1]], ["tile_y", "sp", [-1, 1, 2, 8]], ["tile_x", "sp", [-1, 8, 26, 1]], ["tile_rc", "sp", [-1, 4]], ["tile_ry", "sp", [-1, 1]], ["tile_rx", "sp", [-1, 1]], ["auto_unroll_max_step", "ot", 1500], ["unroll_explicit", "ot", 0]]}, "result": [[0.0008582153317409767], 0, 4.610738039016724, 1671381907.1016998], "version": 0.2, "tvm_version": "0.11.dev0"}
{"input": ["cuda -keys=cuda,gpu -arch=sm_86 -max_num_threads=1024 -thread_warp_size=32", "conv2d_nchw.cuda", [["TENSOR", [1, 12, 208, 208], "float16"], ["TENSOR", [24, 12, 3, 3], "float16"], [1, 1], [1, 1, 1, 1], [1, 1], "float16"], {}], "config": {"index": 22668247, "code_hash": null, "entity": [["tile_f", "sp", [-1, 24, 1, 1]], ["tile_y", "sp", [-1, 1, 2, 52]], ["tile_x", "sp", [-1, 1, 8, 2]], ["tile_rc", "sp", [-1, 3]], ["tile_ry", "sp", [-1, 1]], ["tile_rx", "sp", [-1, 3]], ["auto_unroll_max_step", "ot", 0], ["unroll_explicit", "ot", 0]]}, "result": [[0.004509360792035398], 0, 2.178752899169922, 1671381909.1416512], "version": 0.2, "tvm_version": "0.11.dev0"}
{"input": ["cuda -keys=cuda,gpu -arch=sm_86 -max_num_threads=1024 -thread_warp_size=32", "conv2d_nchw.cuda", [["TENSOR", [1, 12, 208, 208], "float16"], ["TENSOR", [24, 12, 3, 3], "float16"], [1, 1], [1, 1, 1, 1], [1, 1], "float16"], {}], "config": {"index": 191579517, "code_hash": null, "entity": [["tile_f", "sp", [-1, 2, 1, 12]], ["tile_y", "sp", [-1, 2, 104, 1]], ["tile_x", "sp", [-1, 2, 8, 1]], ["tile_rc", "sp", [-1, 3]], ["tile_ry", "sp", [-1, 1]], ["tile_rx", "sp", [-1, 1]], ["auto_unroll_max_step", "ot", 1500], ["unroll_explicit", "ot", 1]]}, "result": [[0.0030596166816816814], 0, 4.193429946899414, 1671381910.5741942], "version": 0.2, "tvm_version": "0.11.dev0"}
{"input": ["cuda -keys=cuda,gpu -arch=sm_86 -max_num_threads=1024 -thread_warp_size=32", "conv2d_nchw.cuda", [["TENSOR", [1, 12, 208, 208], "float16"], ["TENSOR", [24, 12, 3, 3], "float16"], [1, 1], [1, 1, 1, 1], [1, 1], "float16"], {}], "config": {"index": 152388707, "code_hash": null, "entity": [["tile_f", "sp", [-1, 1, 1, 6]], ["tile_y", "sp", [-1, 1, 4, 1]], ["tile_x", "sp", [-1, 13, 8, 1]], ["tile_rc", "sp", [-1, 2]], ["tile_ry", "sp", [-1, 1]], ["tile_rx", "sp", [-1, 1]], ["auto_unroll_max_step", "ot", 512], ["unroll_explicit", "ot", 1]]}, "result": [[0.00013145847758328627], 0, 3.1270785331726074, 1671381912.1175306], "version": 0.2, "tvm_version": "0.11.dev0"}
{"input": ["cuda -keys=cuda,gpu -arch=sm_86 -max_num_threads=1024 -thread_warp_size=32", "conv2d_nchw.cuda", [["TENSOR", [1, 12, 208, 208], "float16"], ["TENSOR", [24, 12, 3, 3], "float16"], [1, 1], [1, 1, 1, 1], [1, 1], "float16"], {}], "config": {"index": 200099189, "code_hash": null, "entity": [["tile_f", "sp", [-1, 4, 1, 6]], ["tile_y", "sp", [-1, 1, 1, 208]], ["tile_x", "sp", [-1, 1, 4, 4]], ["tile_rc", "sp", [-1, 2]], ["tile_ry", "sp", [-1, 3]], ["tile_rx", "sp", [-1, 1]], ["auto_unroll_max_step", "ot", 1500], ["unroll_explicit", "ot", 1]]}, "result": [[0.03455096013793103], 0, 3.4640839099884033, 1671381914.4394412], "version": 0.2, "tvm_version": "0.11.dev0"}
{"input": ["cuda -keys=cuda,gpu -arch=sm_86 -max_num_threads=1024 -thread_warp_size=32", "conv2d_nchw.cuda", [["TENSOR", [1, 12, 208, 208], "float16"], ["TENSOR", [24, 12, 3, 3], "float16"], [1, 1], [1, 1, 1, 1], [1, 1], "float16"], {}], "config": {"index": 80697766, "code_hash": null, "entity": [["tile_f", "sp", [-1, 12, 1, 1]], ["tile_y", "sp", [-1, 26, 4, 1]], ["tile_x", "sp", [-1, 1, 13, 2]], ["tile_rc", "sp", [-1, 4]], ["tile_ry", "sp", [-1, 1]], ["tile_rx", "sp", [-1, 1]], ["auto_unroll_max_step", "ot", 1500], ["unroll_explicit", "ot", 0]]}, "result": [[0.005718810005617977], 0, 4.086315393447876, 1671381915.8856514], "version": 0.2, "tvm_version": "0.11.dev0"}
{"input": ["cuda -keys=cuda,gpu -arch=sm_86 -max_num_threads=1024 -thread_warp_size=32", "conv2d_nchw.cuda", [["TENSOR", [1, 12, 208, 208], "float16"], ["TENSOR", [24, 12, 3, 3], "float16"], [1, 1], [1, 1, 1, 1], [1, 1], "float16"], {}], "config": {"index": 77584662, "code_hash": null, "entity": [["tile_f", "sp", [-1, 1, 6, 1]], ["tile_y", "sp", [-1, 1, 13, 1]], ["tile_x", "sp", [-1, 4, 13, 2]], ["tile_rc", "sp", [-1, 2]], ["tile_ry", "sp", [-1, 1]], ["tile_rx", "sp", [-1, 1]], ["auto_unroll_max_step", "ot", 1500], ["unroll_explicit", "ot", 0]]}, "result": [[0.0003371365295912142], 0, 3.214928388595581, 1671381918.613951], "version": 0.2, "tvm_version": "0.11.dev0"}
{"input": ["cuda -keys=cuda,gpu -arch=sm_86 -max_num_threads=1024 -thread_warp_size=32", "conv2d_nchw.cuda", [["TENSOR", [1, 12, 208, 208], "float16"], ["TENSOR", [24, 12, 3, 3], "float16"], [1, 1], [1, 1, 1, 1], [1, 1], "float16"], {}], "config": {"index": 45988279, "code_hash": null, "entity": [["tile_f", "sp", [-1, 6, 2, 2]], ["tile_y", "sp", [-1, 8, 2, 1]], ["tile_x", "sp", [-1, 2, 1, 2]], ["tile_rc", "sp", [-1, 12]], ["tile_ry", "sp", [-1, 1]], ["tile_rx", "sp", [-1, 1]], ["auto_unroll_max_step", "ot", 512], ["unroll_explicit", "ot", 0]]}, "result": [[0.00036276282516053705], 0, 4.630610704421997, 1671381931.8239686], "version": 0.2, "tvm_version": "0.11.dev0"}
{"input": ["cuda -keys=cuda,gpu -arch=sm_86 -max_num_threads=1024 -thread_warp_size=32", "conv2d_nchw.cuda", [["TENSOR", [1, 12, 208, 208], "float16"], ["TENSOR", [24, 12, 3, 3], "float16"], [1, 1], [1, 1, 1, 1], [1, 1], "float16"], {}], "config": {"index": 14791817, "code_hash": null, "entity": [["tile_f", "sp", [-1, 1, 8, 3]], ["tile_y", "sp", [-1, 1, 2, 8]], ["tile_x", "sp", [-1, 2, 4, 2]], ["tile_rc", "sp", [-1, 4]], ["tile_ry", "sp", [-1, 3]], ["tile_rx", "sp", [-1, 1]], ["auto_unroll_max_step", "ot", 0], ["unroll_explicit", "ot", 0]]}, "result": [[7.158488892957403e-05], 0, 2.0412042140960693, 1671381933.3446064], "version": 0.2, "tvm_version": "0.11.dev0"}
{"input": ["cuda -keys=cuda,gpu -arch=sm_86 -max_num_threads=1024 -thread_warp_size=32", "conv2d_nchw.cuda", [["TENSOR", [1, 12, 208, 208], "float16"], ["TENSOR", [24, 12, 3, 3], "float16"], [1, 1], [1, 1, 1, 1], [1, 1], "float16"], {}], "config": {"index": 84154756, "code_hash": null, "entity": [["tile_f", "sp", [-1, 1, 2, 2]], ["tile_y", "sp", [-1, 1, 8, 13]], ["tile_x", "sp", [-1, 1, 1, 8]], ["tile_rc", "sp", [-1, 12]], ["tile_ry", "sp", [-1, 1]], ["tile_rx", "sp", [-1, 1]], ["auto_unroll_max_step", "ot", 1500], ["unroll_explicit", "ot", 0]]}, "result": [[0.0007677106437021572], 0, 2.4145348072052, 1671381935.3689203], "version": 0.2, "tvm_version": "0.11.dev0"}
{"input": ["cuda -keys=cuda,gpu -arch=sm_86 -max_num_threads=1024 -thread_warp_size=32", "conv2d_nchw.cuda", [["TENSOR", [1, 12, 208, 208], "float16"], ["TENSOR", [24, 12, 3, 3], "float16"], [1, 1], [1, 1, 1, 1], [1, 1], "float16"], {}], "config": {"index": 131985189, "code_hash": null, "entity": [["tile_f", "sp", [-1, 4, 1, 6]], ["tile_y", "sp", [-1, 2, 2, 2]], ["tile_x", "sp", [-1, 1, 8, 1]], ["tile_rc", "sp", [-1, 1]], ["tile_ry", "sp", [-1, 1]], ["tile_rx", "sp", [-1, 3]], ["auto_unroll_max_step", "ot", 0], ["unroll_explicit", "ot", 1]]}, "result": [[0.00012613677402458577], 0, 2.1520345211029053, 1671381937.4708102], "version": 0.2, "tvm_version": "0.11.dev0"}
{"input": ["cuda -keys=cuda,gpu -arch=sm_86 -max_num_threads=1024 -thread_warp_size=32", "conv2d_nchw.cuda", [["TENSOR", [1, 12, 208, 208], "float16"], ["TENSOR", [24, 12, 3, 3], "float16"], [1, 1], [1, 1, 1, 1], [1, 1], "float16"], {}], "config": {"index": 30450296, "code_hash": null, "entity": [["tile_f", "sp", [-1, 2, 4, 3]], ["tile_y", "sp", [-1, 2, 2, 13]], ["tile_x", "sp", [-1, 52, 2, 2]], ["tile_rc", "sp", [-1, 2]], ["tile_ry", "sp", [-1, 3]], ["tile_rx", "sp", [-1, 3]], ["auto_unroll_max_step", "ot", 0], ["unroll_explicit", "ot", 0]]}, "result": [[0.01985608507843137], 0, 4.720425844192505, 1671381939.6243463], "version": 0.2, "tvm_version": "0.11.dev0"}
{"input": ["cuda -keys=cuda,gpu -arch=sm_86 -max_num_threads=1024 -thread_warp_size=32", "conv2d_nchw.cuda", [["TENSOR", [1, 12, 208, 208], "float16"], ["TENSOR", [24, 12, 3, 3], "float16"], [1, 1], [1, 1, 1, 1], [1, 1], "float16"], {}], "config": {"index": 184319909, "code_hash": null, "entity": [["tile_f", "sp", [-1, 4, 1, 6]], ["tile_y", "sp", [-1, 1, 4, 1]], ["tile_x", "sp", [-1, 4, 1, 4]], ["tile_rc", "sp", [-1, 4]], ["tile_ry", "sp", [-1, 3]], ["tile_rx", "sp", [-1, 3]], ["auto_unroll_max_step", "ot", 512], ["unroll_explicit", "ot", 1]]}, "result": [[0.007754290625954198], 0, 4.95799708366394, 1671381941.0875714], "version": 0.2, "tvm_version": "0.11.dev0"}
{"input": ["cuda -keys=cuda,gpu -arch=sm_86 -max_num_threads=1024 -thread_warp_size=32", "conv2d_nchw.cuda", [["TENSOR", [1, 12, 208, 208], "float16"], ["TENSOR", [24, 12, 3, 3], "float16"], [1, 1], [1, 1, 1, 1], [1, 1], "float16"], {}], "config": {"index": 109700345, "code_hash": null, "entity": [["tile_f", "sp", [-1, 1, 8, 1]], ["tile_y", "sp", [-1, 2, 1, 8]], ["tile_x", "sp", [-1, 2, 2, 52]], ["tile_rc", "sp", [-1, 4]], ["tile_ry", "sp", [-1, 3]], ["tile_rx", "sp", [-1, 3]], ["auto_unroll_max_step", "ot", 1500], ["unroll_explicit", "ot", 0]]}, "result": [[0.003339402153605016], 0, 3.054133415222168, 1671381943.087838], "version": 0.2, "tvm_version": "0.11.dev0"}
{"input": ["cuda -keys=cuda,gpu -arch=sm_86 -max_num_threads=1024 -thread_warp_size=32", "conv2d_nchw.cuda", [["TENSOR", [1, 12, 208, 208], "float16"], ["TENSOR", [24, 12, 3, 3], "float16"], [1, 1], [1, 1, 1, 1], [1, 1], "float16"], {}], "config": {"index": 103253711, "code_hash": null, "entity": [["tile_f", "sp", [-1, 2, 1, 2]], ["tile_y", "sp", [-1, 2, 2, 1]], ["tile_x", "sp", [-1, 1, 13, 16]], ["tile_rc", "sp", [-1, 12]], ["tile_ry", "sp", [-1, 1]], ["tile_rx", "sp", [-1, 3]], ["auto_unroll_max_step", "ot", 1500], ["unroll_explicit", "ot", 0]]}, "result": [[0.0007209980186379929], 0, 1.9713454246520996, 1671381945.6228077], "version": 0.2, "tvm_version": "0.11.dev0"}
{"input": ["cuda -keys=cuda,gpu -arch=sm_86 -max_num_threads=1024 -thread_warp_size=32", "conv2d_nchw.cuda", [["TENSOR", [1, 12, 208, 208], "float16"], ["TENSOR", [24, 12, 3, 3], "float16"], [1, 1], [1, 1, 1, 1], [1, 1], "float16"], {}], "config": {"index": 86484526, "code_hash": null, "entity": [["tile_f", "sp", [-1, 2, 6, 2]], ["tile_y", "sp", [-1, 1, 16, 13]], ["tile_x", "sp", [-1, 13, 4, 1]], ["tile_rc", "sp", [-1, 2]], ["tile_ry", "sp", [-1, 3]], ["tile_rx", "sp", [-1, 1]], ["auto_unroll_max_step", "ot", 1500], ["unroll_explicit", "ot", 0]]}, "result": [[0.0074344423636363635], 0, 6.042751789093018, 1671381958.4318511], "version": 0.2, "tvm_version": "0.11.dev0"}
{"input": ["cuda -keys=cuda,gpu -arch=sm_86 -max_num_threads=1024 -thread_warp_size=32", "conv2d_nchw.cuda", [["TENSOR", [1, 12, 208, 208], "float16"], ["TENSOR", [24, 12, 3, 3], "float16"], [1, 1], [1, 1, 1, 1], [1, 1], "float16"], {}], "config": {"index": 16595950, "code_hash": null, "entity": [["tile_f", "sp", [-1, 1, 1, 2]], ["tile_y", "sp", [-1, 4, 2, 13]], ["tile_x", "sp", [-1, 1, 2, 4]], ["tile_rc", "sp", [-1, 6]], ["tile_ry", "sp", [-1, 3]], ["tile_rx", "sp", [-1, 1]], ["auto_unroll_max_step", "ot", 0], ["unroll_explicit", "ot", 0]]}, "result": [[0.0070040861381578945], 0, 3.175659418106079, 1671381959.927213], "version": 0.2, "tvm_version": "0.11.dev0"}
{"input": ["cuda -keys=cuda,gpu -arch=sm_86 -max_num_threads=1024 -thread_warp_size=32", "conv2d_nchw.cuda", [["TENSOR", [1, 12, 208, 208], "float16"], ["TENSOR", [24, 12, 3, 3], "float16"], [1, 1], [1, 1, 1, 1], [1, 1], "float16"], {}], "config": {"index": 140508079, "code_hash": null, "entity": [["tile_f", "sp", [-1, 1, 1, 24]], ["tile_y", "sp", [-1, 26, 1, 2]], ["tile_x", "sp", [-1, 1, 4, 4]], ["tile_rc", "sp", [-1, 12]], ["tile_ry", "sp", [-1, 1]], ["tile_rx", "sp", [-1, 3]], ["auto_unroll_max_step", "ot", 0], ["unroll_explicit", "ot", 1]]}, "result": [[0.01071564169473684], 0, 3.1766490936279297, 1671381961.4364235], "version": 0.2, "tvm_version": "0.11.dev0"}
{"input": ["cuda -keys=cuda,gpu -arch=sm_86 -max_num_threads=1024 -thread_warp_size=32", "conv2d_nchw.cuda", [["TENSOR", [1, 12, 208, 208], "float16"], ["TENSOR", [24, 12, 3, 3], "float16"], [1, 1], [1, 1, 1, 1], [1, 1], "float16"], {}], "config": {"index": 222263337, "code_hash": null, "entity": [["tile_f", "sp", [-1, 1, 8, 3]], ["tile_y", "sp", [-1, 2, 1, 52]], ["tile_x", "sp", [-1, 4, 1, 13]], ["tile_rc", "sp", [-1, 4]], ["tile_ry", "sp", [-1, 3]], ["tile_rx", "sp", [-1, 3]], ["auto_unroll_max_step", "ot", 1500], ["unroll_explicit", "ot", 1]]}, "result": [[0.0209173761875], 0, 4.426964044570923, 1671381963.01897], "version": 0.2, "tvm_version": "0.11.dev0"}
{"input": ["cuda -keys=cuda,gpu -arch=sm_86 -max_num_threads=1024 -thread_warp_size=32", "conv2d_nchw.cuda", [["TENSOR", [1, 12, 208, 208], "float16"], ["TENSOR", [24, 12, 3, 3], "float16"], [1, 1], [1, 1, 1, 1], [1, 1], "float16"], {}], "config": {"index": 165234469, "code_hash": null, "entity": [["tile_f", "sp", [-1, 4, 1, 6]], ["tile_y", "sp", [-1, 1, 2, 1]], ["tile_x", "sp", [-1, 1, 2, 2]], ["tile_rc", "sp", [-1, 4]], ["tile_ry", "sp", [-1, 3]], ["tile_rx", "sp", [-1, 1]], ["auto_unroll_max_step", "ot", 512], ["unroll_explicit", "ot", 1]]}, "result": [[0.0007937379119638825], 0, 2.9626283645629883, 1671381964.493776], "version": 0.2, "tvm_version": "0.11.dev0"}
{"input": ["cuda -keys=cuda,gpu -arch=sm_86 -max_num_threads=1024 -thread_warp_size=32", "conv2d_nchw.cuda", [["TENSOR", [1, 12, 208, 208], "float16"], ["TENSOR", [24, 12, 3, 3], "float16"], [1, 1], [1, 1, 1, 1], [1, 1], "float16"], {}], "config": {"index": 150762261, "code_hash": null, "entity": [["tile_f", "sp", [-1, 6, 4, 1]], ["tile_y", "sp", [-1, 2, 4, 26]], ["tile_x", "sp", [-1, 4, 4, 1]], ["tile_rc", "sp", [-1, 1]], ["tile_ry", "sp", [-1, 1]], ["tile_rx", "sp", [-1, 1]], ["auto_unroll_max_step", "ot", 512], ["unroll_explicit", "ot", 1]]}, "result": [[0.0030686575855855855], 0, 2.5485870838165283, 1671381965.8754995], "version": 0.2, "tvm_version": "0.11.dev0"}
{"input": ["cuda -keys=cuda,gpu -arch=sm_86 -max_num_threads=1024 -thread_warp_size=32", "conv2d_nchw.cuda", [["TENSOR", [1, 12, 208, 208], "float16"], ["TENSOR", [24, 12, 3, 3], "float16"], [1, 1], [1, 1, 1, 1], [1, 1], "float16"], {}], "config": {"index": 26972476, "code_hash": null, "entity": [["tile_f", "sp", [-1, 1, 1, 12]], ["tile_y", "sp", [-1, 1, 26, 1]], ["tile_x", "sp", [-1, 1, 13, 1]], ["tile_rc", "sp", [-1, 12]], ["tile_ry", "sp", [-1, 1]], ["tile_rx", "sp", [-1, 3]], ["auto_unroll_max_step", "ot", 0], ["unroll_explicit", "ot", 0]]}, "result": [[0.00016187601801357187], 0, 2.0900378227233887, 1671381967.5601673], "version": 0.2, "tvm_version": "0.11.dev0"}
{"input": ["cuda -keys=cuda,gpu -arch=sm_86 -max_num_threads=1024 -thread_warp_size=32", "conv2d_nchw.cuda", [["TENSOR", [1, 12, 208, 208], "float16"], ["TENSOR", [24, 12, 3, 3], "float16"], [1, 1], [1, 1, 1, 1], [1, 1], "float16"], {}], "config": {"index": 14708088, "code_hash": null, "entity": [["tile_f", "sp", [-1, 1, 2, 1]], ["tile_y", "sp", [-1, 8, 13, 1]], ["tile_x", "sp", [-1, 1, 2, 2]], ["tile_rc", "sp", [-1, 4]], ["tile_ry", "sp", [-1, 3]], ["tile_rx", "sp", [-1, 1]], ["auto_unroll_max_step", "ot", 0], ["unroll_explicit", "ot", 0]]}, "result": [[0.0008056065709677418], 0, 1.975210189819336, 1671381969.1392844], "version": 0.2, "tvm_version": "0.11.dev0"}
{"input": ["cuda -keys=cuda,gpu -arch=sm_86 -max_num_threads=1024 -thread_warp_size=32", "conv2d_nchw.cuda", [["TENSOR", [1, 12, 208, 208], "float16"], ["TENSOR", [24, 12, 3, 3], "float16"], [1, 1], [1, 1, 1, 1], [1, 1], "float16"], {}], "config": {"index": 218184328, "code_hash": null, "entity": [["tile_f", "sp", [-1, 1, 2, 1]], ["tile_y", "sp", [-1, 4, 1, 13]], ["tile_x", "sp", [-1, 4, 4, 1]], ["tile_rc", "sp", [-1, 2]], ["tile_ry", "sp", [-1, 3]], ["tile_rx", "sp", [-1, 3]], ["auto_unroll_max_step", "ot", 1500], ["unroll_explicit", "ot", 1]]}, "result": [[0.00267000943639576], 0, 9.764013290405273, 1671381982.58826], "version": 0.2, "tvm_version": "0.11.dev0"}
{"input": ["cuda -keys=cuda,gpu -arch=sm_86 -max_num_threads=1024 -thread_warp_size=32", "conv2d_nchw.cuda", [["TENSOR", [1, 12, 208, 208], "float16"], ["TENSOR", [24, 12, 3, 3], "float16"], [1, 1], [1, 1, 1, 1], [1, 1], "float16"], {}], "config": {"index": 161818599, "code_hash": null, "entity": [["tile_f", "sp", [-1, 6, 2, 2]], ["tile_y", "sp", [-1, 4, 2, 1]], ["tile_x", "sp", [-1, 1, 13, 1]], ["tile_rc", "sp", [-1, 2]], ["tile_ry", "sp", [-1, 3]], ["tile_rx", "sp", [-1, 1]], ["auto_unroll_max_step", "ot", 512], ["unroll_explicit", "ot", 1]]}, "result": [[7.377799349797525e-05], 0, 3.448129177093506, 1671381984.244836], "version": 0.2, "tvm_version": "0.11.dev0"}
{"input": ["cuda -keys=cuda,gpu -arch=sm_86 -max_num_threads=1024 -thread_warp_size=32", "conv2d_nchw.cuda", [["TENSOR", [1, 12, 208, 208], "float16"], ["TENSOR", [24, 12, 3, 3], "float16"], [1, 1], [1, 1, 1, 1], [1, 1], "float16"], {}], "config": {"index": 18717216, "code_hash": null, "entity": [["tile_f", "sp", [-1, 4, 3, 1]], ["tile_y", "sp", [-1, 2, 8, 1]], ["tile_x", "sp", [-1, 2, 1, 52]], ["tile_rc", "sp", [-1, 12]], ["tile_ry", "sp", [-1, 3]], ["tile_rx", "sp", [-1, 1]], ["auto_unroll_max_step", "ot", 0], ["unroll_explicit", "ot", 0]]}, "result": [[0.001905423165247019], 0, 2.2983973026275635, 1671381985.726305], "version": 0.2, "tvm_version": "0.11.dev0"}
{"input": ["cuda -keys=cuda,gpu -arch=sm_86 -max_num_threads=1024 -thread_warp_size=32", "conv2d_nchw.cuda", [["TENSOR", [1, 12, 208, 208], "float16"], ["TENSOR", [24, 12, 3, 3], "float16"], [1, 1], [1, 1, 1, 1], [1, 1], "float16"], {}], "config": {"index": 165270938, "code_hash": null, "entity": [["tile_f", "sp", [-1, 1, 1, 4]], ["tile_y", "sp", [-1, 2, 1, 2]], ["tile_x", "sp", [-1, 13, 2, 2]], ["tile_rc", "sp", [-1, 4]], ["tile_ry", "sp", [-1, 3]], ["tile_rx", "sp", [-1, 1]], ["auto_unroll_max_step", "ot", 512], ["unroll_explicit", "ot", 1]]}, "result": [[0.0171769233220339], 0, 5.3784263134002686, 1671381987.2834952], "version": 0.2, "tvm_version": "0.11.dev0"}
{"input": ["cuda -keys=cuda,gpu -arch=sm_86 -max_num_threads=1024 -thread_warp_size=32", "conv2d_nchw.cuda", [["TENSOR", [1, 12, 208, 208], "float16"], ["TENSOR", [24, 12, 3, 3], "float16"], [1, 1], [1, 1, 1, 1], [1, 1], "float16"], {}], "config": {"index": 200842240, "code_hash": null, "entity": [["tile_f", "sp", [-1, 1, 1, 1]], ["tile_y", "sp", [-1, 8, 1, 2]], ["tile_x", "sp", [-1, 4, 2, 1]], ["tile_rc", "sp", [-1, 3]], ["tile_ry", "sp", [-1, 3]], ["tile_rx", "sp", [-1, 1]], ["auto_unroll_max_step", "ot", 1500], ["unroll_explicit", "ot", 1]]}, "result": [[0.00257402405034325], 0, 4.707726001739502, 1671381988.7808702], "version": 0.2, "tvm_version": "0.11.dev0"}
{"input": ["cuda -keys=cuda,gpu -arch=sm_86 -max_num_threads=1024 -thread_warp_size=32", "conv2d_nchw.cuda", [["TENSOR", [1, 12, 208, 208], "float16"], ["TENSOR", [24, 12, 3, 3], "float16"], [1, 1], [1, 1, 1, 1], [1, 1], "float16"], {}], "config": {"index": 22529236, "code_hash": null, "entity": [["tile_f", "sp", [-1, 1, 2, 2]], ["tile_y", "sp", [-1, 1, 1, 4]], ["tile_x", "sp", [-1, 52, 1, 2]], ["tile_rc", "sp", [-1, 3]], ["tile_ry", "sp", [-1, 1]], ["tile_rx", "sp", [-1, 3]], ["auto_unroll_max_step", "ot", 0], ["unroll_explicit", "ot", 0]]}, "result": [[0.020857354591836734], 0, 3.906770706176758, 1671381990.3755324], "version": 0.2, "tvm_version": "0.11.dev0"}
{"input": ["cuda -keys=cuda,gpu -arch=sm_86 -max_num_threads=1024 -thread_warp_size=32", "conv2d_nchw.cuda", [["TENSOR", [1, 12, 208, 208], "float16"], ["TENSOR", [24, 12, 3, 3], "float16"], [1, 1], [1, 1, 1, 1], [1, 1], "float16"], {}], "config": {"index": 221700256, "code_hash": null, "entity": [["tile_f", "sp", [-1, 4, 3, 1]], ["tile_y", "sp", [-1, 1, 1, 8]], ["tile_x", "sp", [-1, 2, 2, 2]], ["tile_rc", "sp", [-1, 4]], ["tile_ry", "sp", [-1, 3]], ["tile_rx", "sp", [-1, 3]], ["auto_unroll_max_step", "ot", 1500], ["unroll_explicit", "ot", 1]]}, "result": [[0.00025942630352003543], 0, 9.922114610671997, 1671381991.907098], "version": 0.2, "tvm_version": "0.11.dev0"}
{"input": ["cuda -keys=cuda,gpu -arch=sm_86 -max_num_threads=1024 -thread_warp_size=32", "conv2d_nchw.cuda", [["TENSOR", [1, 12, 208, 208], "float16"], ["TENSOR", [24, 12, 3, 3], "float16"], [1, 1], [1, 1, 1, 1], [1, 1], "float16"], {}], "config": {"index": 151074712, "code_hash": null, "entity": [["tile_f", "sp", [-1, 1, 4, 6]], ["tile_y", "sp", [-1, 4, 4, 13]], ["tile_x", "sp", [-1, 8, 1, 2]], ["tile_rc", "sp", [-1, 1]], ["tile_ry", "sp", [-1, 1]], ["tile_rx", "sp", [-1, 1]], ["auto_unroll_max_step", "ot", 512], ["unroll_explicit", "ot", 1]]}, "result": [[0.007587175052238806], 0, 3.637343168258667, 1671381993.4202466], "version": 0.2, "tvm_version": "0.11.dev0"}
{"input": ["cuda -keys=cuda,gpu -arch=sm_86 -max_num_threads=1024 -thread_warp_size=32", "conv2d_nchw.cuda", [["TENSOR", [1, 12, 208, 208], "float16"], ["TENSOR", [24, 12, 3, 3], "float16"], [1, 1], [1, 1, 1, 1], [1, 1], "float16"], {}], "config": {"index": 142941515, "code_hash": null, "entity": [["tile_f", "sp", [-1, 1, 3, 8]], ["tile_y", "sp", [-1, 2, 13, 4]], ["tile_x", "sp", [-1, 26, 4, 1]], ["tile_rc", "sp", [-1, 2]], ["tile_ry", "sp", [-1, 3]], ["tile_rx", "sp", [-1, 3]], ["auto_unroll_max_step", "ot", 0], ["unroll_explicit", "ot", 1]]}, "result": [[0.0037576271811594203], 0, 3.7629506587982178, 1671381994.8590307], "version": 0.2, "tvm_version": "0.11.dev0"}
{"input": ["cuda -keys=cuda,gpu -arch=sm_86 -max_num_threads=1024 -thread_warp_size=32", "conv2d_nchw.cuda", [["TENSOR", [1, 12, 208, 208], "float16"], ["TENSOR", [24, 12, 3, 3], "float16"], [1, 1], [1, 1, 1, 1], [1, 1], "float16"], {}], "config": {"index": 76004070, "code_hash": null, "entity": [["tile_f", "sp", [-1, 1, 2, 6]], ["tile_y", "sp", [-1, 1, 2, 1]], ["tile_x", "sp", [-1, 2, 13, 2]], ["tile_rc", "sp", [-1, 1]], ["tile_ry", "sp", [-1, 1]], ["tile_rx", "sp", [-1, 1]], ["auto_unroll_max_step", "ot", 1500], ["unroll_explicit", "ot", 0]]}, "result": [[9.886685035003812e-05], 0, 2.960336923599243, 1671382018.7020142], "version": 0.2, "tvm_version": "0.11.dev0"}
{"input": ["cuda -keys=cuda,gpu -arch=sm_86 -max_num_threads=1024 -thread_warp_size=32", "conv2d_nchw.cuda", [["TENSOR", [1, 12, 208, 208], "float16"], ["TENSOR", [24, 12, 3, 3], "float16"], [1, 1], [1, 1, 1, 1], [1, 1], "float16"], {}], "config": {"index": 77572070, "code_hash": null, "entity": [["tile_f", "sp", [-1, 1, 2, 6]], ["tile_y", "sp", [-1, 1, 2, 1]], ["tile_x", "sp", [-1, 2, 13, 2]], ["tile_rc", "sp", [-1, 2]], ["tile_ry", "sp", [-1, 1]], ["tile_rx", "sp", [-1, 1]], ["auto_unroll_max_step", "ot", 1500], ["unroll_explicit", "ot", 0]]}, "result": [[8.353064253920427e-05], 0, 1.963960886001587, 1671382020.2953224], "version": 0.2, "tvm_version": "0.11.dev0"}
{"input": ["cuda -keys=cuda,gpu -arch=sm_86 -max_num_threads=1024 -thread_warp_size=32", "conv2d_nchw.cuda", [["TENSOR", [1, 24, 208, 208], "float16"], ["TENSOR", [48, 24, 3, 3], "float16"], [2, 2], [1, 1, 1, 1], [1, 1], "float16"], {}], "config": {"index": 81914154, "code_hash": null, "entity": [["tile_f", "sp", [-1, 6, 2, 1]], ["tile_y", "sp", [-1, 2, 1, 13]], ["tile_x", "sp", [-1, 13, 1, 2]], ["tile_rc", "sp", [-1, 4]], ["tile_ry", "sp", [-1, 3]], ["tile_rx", "sp", [-1, 3]], ["auto_unroll_max_step", "ot", 1500], ["unroll_explicit", "ot", 0]]}, "result": [[0.021052844891891888], 0, 6.956040859222412, 1671382094.015916], "version": 0.2, "tvm_version": "0.11.dev0"}
{"input": ["cuda -keys=cuda,gpu -arch=sm_86 -max_num_threads=1024 -thread_warp_size=32", "conv2d_nchw.cuda", [["TENSOR", [1, 24, 208, 208], "float16"], ["TENSOR", [48, 24, 3, 3], "float16"], [2, 2], [1, 1, 1, 1], [1, 1], "float16"], {}], "config": {"index": 22244397, "code_hash": null, "entity": [["tile_f", "sp", [-1, 4, 1, 3]], ["tile_y", "sp", [-1, 1, 2, 1]], ["tile_x", "sp", [-1, 4, 2, 13]], ["tile_rc", "sp", [-1, 1]], ["tile_ry", "sp", [-1, 3]], ["tile_rx", "sp", [-1, 3]], ["auto_unroll_max_step", "ot", 0], ["unroll_explicit", "ot", 0]]}, "result": [[0.007307852666666667], 0, 2.8919384479522705, 1671382095.4767847], "version": 0.2, "tvm_version": "0.11.dev0"}
{"input": ["cuda -keys=cuda,gpu -arch=sm_86 -max_num_threads=1024 -thread_warp_size=32", "conv2d_nchw.cuda", [["TENSOR", [1, 24, 208, 208], "float16"], ["TENSOR", [48, 24, 3, 3], "float16"], [2, 2], [1, 1, 1, 1], [1, 1], "float16"], {}], "config": {"index": 54210659, "code_hash": null, "entity": [["tile_f", "sp", [-1, 1, 1, 48]], ["tile_y", "sp", [-1, 1, 8, 1]], ["tile_x", "sp", [-1, 1, 4, 2]], ["tile_rc", "sp", [-1, 6]], ["tile_ry", "sp", [-1, 3]], ["tile_rx", "sp", [-1, 3]], ["auto_unroll_max_step", "ot", 512], ["unroll_explicit", "ot", 0]]}, "result": [[0.00014763256892950393], 0, 3.2105019092559814, 1671382096.9699411], "version": 0.2, "tvm_version": "0.11.dev0"}
{"input": ["cuda -keys=cuda,gpu -arch=sm_86 -max_num_threads=1024 -thread_warp_size=32", "conv2d_nchw.cuda", [["TENSOR", [1, 24, 208, 208], "float16"], ["TENSOR", [48, 24, 3, 3], "float16"], [2, 2], [1, 1, 1, 1], [1, 1], "float16"], {}], "config": {"index": 110859745, "code_hash": null, "entity": [["tile_f", "sp", [-1, 1, 1, 2]], ["tile_y", "sp", [-1, 2, 4, 1]], ["tile_x", "sp", [-1, 13, 1, 8]], ["tile_rc", "sp", [-1, 4]], ["tile_ry", "sp", [-1, 3]], ["tile_rx", "sp", [-1, 3]], ["auto_unroll_max_step", "ot", 0], ["unroll_explicit", "ot", 1]]}, "result": [[0.008165907968503937], 0, 3.602576732635498, 1671382098.4328673], "version": 0.2, "tvm_version": "0.11.dev0"}
{"input": ["cuda -keys=cuda,gpu -arch=sm_86 -max_num_threads=1024 -thread_warp_size=32", "conv2d_nchw.cuda", [["TENSOR", [1, 24, 208, 208], "float16"], ["TENSOR", [48, 24, 3, 3], "float16"], [2, 2], [1, 1, 1, 1], [1, 1], "float16"], {}], "config": {"index": 128363244, "code_hash": null, "entity": [["tile_f", "sp", [-1, 1, 48, 1]], ["tile_y", "sp", [-1, 1, 1, 1]], ["tile_x", "sp", [-1, 2, 13, 1]], ["tile_rc", "sp", [-1, 24]], ["tile_ry", "sp", [-1, 3]], ["tile_rx", "sp", [-1, 1]], ["auto_unroll_max_step", "ot", 512], ["unroll_explicit", "ot", 1]]}, "result": [[0.00021566877602996254], 0, 3.030135154724121, 1671382099.9430938], "version": 0.2, "tvm_version": "0.11.dev0"}
{"input": ["cuda -keys=cuda,gpu -arch=sm_86 -max_num_threads=1024 -thread_warp_size=32", "conv2d_nchw.cuda", [["TENSOR", [1, 24, 208, 208], "float16"], ["TENSOR", [48, 24, 3, 3], "float16"], [2, 2], [1, 1, 1, 1], [1, 1], "float16"], {}], "config": {"index": 109099485, "code_hash": null, "entity": [["tile_f", "sp", [-1, 8, 1, 1]], ["tile_y", "sp", [-1, 4, 1, 1]], ["tile_x", "sp", [-1, 2, 1, 13]], ["tile_rc", "sp", [-1, 2]], ["tile_ry", "sp", [-1, 3]], ["tile_rx", "sp", [-1, 3]], ["auto_unroll_max_step", "ot", 0], ["unroll_explicit", "ot", 1]]}, "result": [[0.057235799111111124], 0, 3.212836980819702, 1671382101.9431129], "version": 0.2, "tvm_version": "0.11.dev0"}
{"input": ["cuda -keys=cuda,gpu -arch=sm_86 -max_num_threads=1024 -thread_warp_size=32", "conv2d_nchw.cuda", [["TENSOR", [1, 24, 208, 208], "float16"], ["TENSOR", [48, 24, 3, 3], "float16"], [2, 2], [1, 1, 1, 1], [1, 1], "float16"], {}], "config": {"index": 7294392, "code_hash": null, "entity": [["tile_f", "sp", [-1, 1, 2, 6]], ["tile_y", "sp", [-1, 4, 13, 1]], ["tile_x", "sp", [-1, 13, 2, 1]], ["tile_rc", "sp", [-1, 1]], ["tile_ry", "sp", [-1, 3]], ["tile_rx", "sp", [-1, 1]], ["auto_unroll_max_step", "ot", 0], ["unroll_explicit", "ot", 0]]}, "result": [[0.0028428538920454547], 0, 3.0784125328063965, 1671382103.3484166], "version": 0.2, "tvm_version": "0.11.dev0"}
{"input": ["cuda -keys=cuda,gpu -arch=sm_86 -max_num_threads=1024 -thread_warp_size=32", "conv2d_nchw.cuda", [["TENSOR", [1, 24, 208, 208], "float16"], ["TENSOR", [48, 24, 3, 3], "float16"], [2, 2], [1, 1, 1, 1], [1, 1], "float16"], {}], "config": {"index": 143995732, "code_hash": null, "entity": [["tile_f", "sp", [-1, 1, 4, 12]], ["tile_y", "sp", [-1, 1, 1, 13]], ["tile_x", "sp", [-1, 1, 26, 4]], ["tile_rc", "sp", [-1, 1]], ["tile_ry", "sp", [-1, 1]], ["tile_rx", "sp", [-1, 1]], ["auto_unroll_max_step", "ot", 1500], ["unroll_explicit", "ot", 1]]}, "result": [[0.02391265868965517], 0, 8.409713506698608, 1671382112.051464], "version": 0.2, "tvm_version": "0.11.dev0"}
{"input": ["cuda -keys=cuda,gpu -arch=sm_86 -max_num_threads=1024 -thread_warp_size=32", "conv2d_nchw.cuda", [["TENSOR", [1, 24, 208, 208], "float16"], ["TENSOR", [48, 24, 3, 3], "float16"], [2, 2], [1, 1, 1, 1], [1, 1], "float16"], {}], "config": {"index": 10235016, "code_hash": null, "entity": [["tile_f", "sp", [-1, 6, 8, 1]], ["tile_y", "sp", [-1, 1, 4, 13]], ["tile_x", "sp", [-1, 13, 1, 2]], ["tile_rc", "sp", [-1, 4]], ["tile_ry", "sp", [-1, 3]], ["tile_rx", "sp", [-1, 1]], ["auto_unroll_max_step", "ot", 0], ["unroll_explicit", "ot", 0]]}, "result": [[0.006236922931677019], 0, 2.8214664459228516, 1671382113.454952], "version": 0.2, "tvm_version": "0.11.dev0"}
{"input": ["cuda -keys=cuda,gpu -arch=sm_86 -max_num_threads=1024 -thread_warp_size=32", "conv2d_nchw.cuda", [["TENSOR", [1, 24, 208, 208], "float16"], ["TENSOR", [48, 24, 3, 3], "float16"], [2, 2], [1, 1, 1, 1], [1, 1], "float16"], {}], "config": {"index": 10852213, "code_hash": null, "entity": [["tile_f", "sp", [-1, 2, 2, 6]], ["tile_y", "sp", [-1, 1, 4, 26]], ["tile_x", "sp", [-1, 1, 2, 1]], ["tile_rc", "sp", [-1, 6]], ["tile_ry", "sp", [-1, 3]], ["tile_rx", "sp", [-1, 1]], ["auto_unroll_max_step", "ot", 0], ["unroll_explicit", "ot", 0]]}, "result": [[0.0023000408140043766], 0, 2.455167293548584, 1671382114.8721986], "version": 0.2, "tvm_version": "0.11.dev0"}
{"input": ["cuda -keys=cuda,gpu -arch=sm_86 -max_num_threads=1024 -thread_warp_size=32", "conv2d_nchw.cuda", [["TENSOR", [1, 24, 208, 208], "float16"], ["TENSOR", [48, 24, 3, 3], "float16"], [2, 2], [1, 1, 1, 1], [1, 1], "float16"], {}], "config": {"index": 58794199, "code_hash": null, "entity": [["tile_f", "sp", [-1, 16, 1, 3]], ["tile_y", "sp", [-1, 13, 2, 2]], ["tile_x", "sp", [-1, 2, 1, 4]], ["tile_rc", "sp", [-1, 2]], ["tile_ry", "sp", [-1, 1]], ["tile_rx", "sp", [-1, 1]], ["auto_unroll_max_step", "ot", 1500], ["unroll_explicit", "ot", 0]]}, "result": [[0.04019144380769231], 0, 4.8241119384765625, 1671382116.726321], "version": 0.2, "tvm_version": "0.11.dev0"}
{"input": ["cuda -keys=cuda,gpu -arch=sm_86 -max_num_threads=1024 -thread_warp_size=32", "conv2d_nchw.cuda", [["TENSOR", [1, 24, 208, 208], "float16"], ["TENSOR", [48, 24, 3, 3], "float16"], [2, 2], [1, 1, 1, 1], [1, 1], "float16"], {}], "config": {"index": 80643889, "code_hash": null, "entity": [["tile_f", "sp", [-1, 2, 1, 6]], ["tile_y", "sp", [-1, 1, 52, 1]], ["tile_x", "sp", [-1, 1, 1, 1]], ["tile_rc", "sp", [-1, 3]], ["tile_ry", "sp", [-1, 3]], ["tile_rx", "sp", [-1, 3]], ["auto_unroll_max_step", "ot", 1500], ["unroll_explicit", "ot", 0]]}, "result": [[0.0002860520817779961], 0, 2.0275542736053467, 1671382118.2557359], "version": 0.2, "tvm_version": "0.11.dev0"}
{"input": ["cuda -keys=cuda,gpu -arch=sm_86 -max_num_threads=1024 -thread_warp_size=32", "conv2d_nchw.cuda", [["TENSOR", [1, 24, 208, 208], "float16"], ["TENSOR", [48, 24, 3, 3], "float16"], [2, 2], [1, 1, 1, 1], [1, 1], "float16"], {}], "config": {"index": 159735001, "code_hash": null, "entity": [["tile_f", "sp", [-1, 3, 16, 1]], ["tile_y", "sp", [-1, 13, 1, 1]], ["tile_x", "sp", [-1, 4, 13, 1]], ["tile_rc", "sp", [-1, 3]], ["tile_ry", "sp", [-1, 1]], ["tile_rx", "sp", [-1, 3]], ["auto_unroll_max_step", "ot", 1500], ["unroll_explicit", "ot", 1]]}, "result": [[0.00017872670846262337], 0, 9.84992527961731, 1671382130.9039545], "version": 0.2, "tvm_version": "0.11.dev0"}
{"input": ["cuda -keys=cuda,gpu -arch=sm_86 -max_num_threads=1024 -thread_warp_size=32", "conv2d_nchw.cuda", [["TENSOR", [1, 24, 208, 208], "float16"], ["TENSOR", [48, 24, 3, 3], "float16"], [2, 2], [1, 1, 1, 1], [1, 1], "float16"], {}], "config": {"index": 31719307, "code_hash": null, "entity": [["tile_f", "sp", [-1, 1, 6, 2]], ["tile_y", "sp", [-1, 52, 1, 1]], ["tile_x", "sp", [-1, 4, 1, 2]], ["tile_rc", "sp", [-1, 4]], ["tile_ry", "sp", [-1, 1]], ["tile_rx", "sp", [-1, 1]], ["auto_unroll_max_step", "ot", 512], ["unroll_explicit", "ot", 0]]}, "result": [[0.012511928222222224], 0, 4.796452283859253, 1671382132.4180157], "version": 0.2, "tvm_version": "0.11.dev0"}
{"input": ["cuda -keys=cuda,gpu -arch=sm_86 -max_num_threads=1024 -thread_warp_size=32", "conv2d_nchw.cuda", [["TENSOR", [1, 24, 208, 208], "float16"], ["TENSOR", [48, 24, 3, 3], "float16"], [2, 2], [1, 1, 1, 1], [1, 1], "float16"], {}], "config": {"index": 82712594, "code_hash": null, "entity": [["tile_f", "sp", [-1, 2, 8, 1]], ["tile_y", "sp", [-1, 13, 1, 1]], ["tile_x", "sp", [-1, 2, 26, 1]], ["tile_rc", "sp", [-1, 6]], ["tile_ry", "sp", [-1, 3]], ["tile_rx", "sp", [-1, 3]], ["auto_unroll_max_step", "ot", 1500], ["unroll_explicit", "ot", 0]]}, "result": [[0.0004732067123224919], 0, 3.531338930130005, 1671382133.8743644], "version": 0.2, "tvm_version": "0.11.dev0"}
{"input": ["cuda -keys=cuda,gpu -arch=sm_86 -max_num_threads=1024 -thread_warp_size=32", "conv2d_nchw.cuda", [["TENSOR", [1, 24, 208, 208], "float16"], ["TENSOR", [48, 24, 3, 3], "float16"], [2, 2], [1, 1, 1, 1], [1, 1], "float16"], {}], "config": {"index": 123973415, "code_hash": null, "entity": [["tile_f", "sp", [-1, 3, 2, 2]], ["tile_y", "sp", [-1, 13, 1, 1]], ["tile_x", "sp", [-1, 1, 104, 1]], ["tile_rc", "sp", [-1, 3]], ["tile_ry", "sp", [-1, 3]], ["tile_rx", "sp", [-1, 1]], ["auto_unroll_max_step", "ot", 512], ["unroll_explicit", "ot", 1]]}, "result": [[0.0005404798483535528], 0, 4.982457160949707, 1671382139.4846325], "version": 0.2, "tvm_version": "0.11.dev0"}
{"input": ["cuda -keys=cuda,gpu -arch=sm_86 -max_num_threads=1024 -thread_warp_size=32", "conv2d_nchw.cuda", [["TENSOR", [1, 24, 208, 208], "float16"], ["TENSOR", [48, 24, 3, 3], "float16"], [2, 2], [1, 1, 1, 1], [1, 1], "float16"], {}], "config": {"index": 108926804, "code_hash": null, "entity": [["tile_f", "sp", [-1, 1, 4, 3]], ["tile_y", "sp", [-1, 1, 1, 4]], ["tile_x", "sp", [-1, 1, 26, 2]], ["tile_rc", "sp", [-1, 2]], ["tile_ry", "sp", [-1, 3]], ["tile_rx", "sp", [-1, 3]], ["auto_unroll_max_step", "ot", 0], ["unroll_explicit", "ot", 1]]}, "result": [[0.00014682592907371486], 0, 1.9080793857574463, 1671382141.05224], "version": 0.2, "tvm_version": "0.11.dev0"}
{"input": ["cuda -keys=cuda,gpu -arch=sm_86 -max_num_threads=1024 -thread_warp_size=32", "conv2d_nchw.cuda", [["TENSOR", [1, 24, 208, 208], "float16"], ["TENSOR", [48, 24, 3, 3], "float16"], [2, 2], [1, 1, 1, 1], [1, 1], "float16"], {}], "config": {"index": 14833391, "code_hash": null, "entity": [["tile_f", "sp", [-1, 8, 1, 6]], ["tile_y", "sp", [-1, 4, 1, 2]], ["tile_x", "sp", [-1, 4, 13, 2]], ["tile_rc", "sp", [-1, 1]], ["tile_ry", "sp", [-1, 1]], ["tile_rx", "sp", [-1, 3]], ["auto_unroll_max_step", "ot", 0], ["unroll_explicit", "ot", 0]]}, "result": [[0.008977487910614526], 0, 6.1131911277771, 1671382144.1238124], "version": 0.2, "tvm_version": "0.11.dev0"}
{"input": ["cuda -keys=cuda,gpu -arch=sm_86 -max_num_threads=1024 -thread_warp_size=32", "conv2d_nchw.cuda", [["TENSOR", [1, 24, 208, 208], "float16"], ["TENSOR", [48, 24, 3, 3], "float16"], [2, 2], [1, 1, 1, 1], [1, 1], "float16"], {}], "config": {"index": 47596627, "code_hash": null, "entity": [["tile_f", "sp", [-1, 1, 1, 12]], ["tile_y", "sp", [-1, 2, 13, 4]], ["tile_x", "sp", [-1, 2, 2, 1]], ["tile_rc", "sp", [-1, 8]], ["tile_ry", "sp", [-1, 1]], ["tile_rx", "sp", [-1, 3]], ["auto_unroll_max_step", "ot", 512], ["unroll_explicit", "ot", 0]]}, "result": [[0.0025398958227848107], 0, 2.1444129943847656, 1671382145.5458121], "version": 0.2, "tvm_version": "0.11.dev0"}
{"input": ["cuda -keys=cuda,gpu -arch=sm_86 -max_num_threads=1024 -thread_warp_size=32", "conv2d_nchw.cuda", [["TENSOR", [1, 24, 208, 208], "float16"], ["TENSOR", [48, 24, 3, 3], "float16"], [2, 2], [1, 1, 1, 1], [1, 1], "float16"], {}], "config": {"index": 116428639, "code_hash": null, "entity": [["tile_f", "sp", [-1, 2, 3, 1]], ["tile_y", "sp", [-1, 13, 1, 2]], ["tile_x", "sp", [-1, 1, 4, 26]], ["tile_rc", "sp", [-1, 2]], ["tile_ry", "sp", [-1, 1]], ["tile_rx", "sp", [-1, 1]], ["auto_unroll_max_step", "ot", 512], ["unroll_explicit", "ot", 1]]}, "result": [[0.044029164173913046], 0, 3.6565980911254883, 1671382147.3947995], "version": 0.2, "tvm_version": "0.11.dev0"}
{"input": ["cuda -keys=cuda,gpu -arch=sm_86 -max_num_threads=1024 -thread_warp_size=32", "conv2d_nchw.cuda", [["TENSOR", [1, 24, 208, 208], "float16"], ["TENSOR", [48, 24, 3, 3], "float16"], [2, 2], [1, 1, 1, 1], [1, 1], "float16"], {}], "config": {"index": 83677176, "code_hash": null, "entity": [["tile_f", "sp", [-1, 12, 2, 1]], ["tile_y", "sp", [-1, 1, 4, 1]], ["tile_x", "sp", [-1, 2, 1, 2]], ["tile_rc", "sp", [-1, 8]], ["tile_ry", "sp", [-1, 3]], ["tile_rx", "sp", [-1, 3]], ["auto_unroll_max_step", "ot", 1500], ["unroll_explicit", "ot", 0]]}, "result": [[0.000307864552836485], 0, 2.5343127250671387, 1671382148.8425333], "version": 0.2, "tvm_version": "0.11.dev0"}
{"input": ["cuda -keys=cuda,gpu -arch=sm_86 -max_num_threads=1024 -thread_warp_size=32", "conv2d_nchw.cuda", [["TENSOR", [1, 24, 208, 208], "float16"], ["TENSOR", [48, 24, 3, 3], "float16"], [2, 2], [1, 1, 1, 1], [1, 1], "float16"], {}], "config": {"index": 41783284, "code_hash": null, "entity": [["tile_f", "sp", [-1, 6, 1, 1]], ["tile_y", "sp", [-1, 1, 2, 4]], ["tile_x", "sp", [-1, 13, 1, 4]], ["tile_rc", "sp", [-1, 12]], ["tile_ry", "sp", [-1, 3]], ["tile_rx", "sp", [-1, 1]], ["auto_unroll_max_step", "ot", 512], ["unroll_explicit", "ot", 0]]}, "result": [[0.038475696269230766], 0, 4.721761703491211, 1671382150.6392877], "version": 0.2, "tvm_version": "0.11.dev0"}
{"input": ["cuda -keys=cuda,gpu -arch=sm_86 -max_num_threads=1024 -thread_warp_size=32", "conv2d_nchw.cuda", [["TENSOR", [1, 24, 208, 208], "float16"], ["TENSOR", [48, 24, 3, 3], "float16"], [2, 2], [1, 1, 1, 1], [1, 1], "float16"], {}], "config": {"index": 117893170, "code_hash": null, "entity": [["tile_f", "sp", [-1, 1, 2, 1]], ["tile_y", "sp", [-1, 1, 4, 1]], ["tile_x", "sp", [-1, 2, 26, 2]], ["tile_rc", "sp", [-1, 4]], ["tile_ry", "sp", [-1, 1]], ["tile_rx", "sp", [-1, 1]], ["auto_unroll_max_step", "ot", 512], ["unroll_explicit", "ot", 1]]}, "result": [[0.0012641687756264235], 0, 4.246796131134033, 1671382152.121196], "version": 0.2, "tvm_version": "0.11.dev0"}
{"input": ["cuda -keys=cuda,gpu -arch=sm_86 -max_num_threads=1024 -thread_warp_size=32", "conv2d_nchw.cuda", [["TENSOR", [1, 24, 208, 208], "float16"], ["TENSOR", [48, 24, 3, 3], "float16"], [2, 2], [1, 1, 1, 1], [1, 1], "float16"], {}], "config": {"index": 51968075, "code_hash": null, "entity": [["tile_f", "sp", [-1, 1, 1, 3]], ["tile_y", "sp", [-1, 1, 1, 1]], ["tile_x", "sp", [-1, 1, 1, 1]], ["tile_rc", "sp", [-1, 3]], ["tile_ry", "sp", [-1, 3]], ["tile_rx", "sp", [-1, 3]], ["auto_unroll_max_step", "ot", 512], ["unroll_explicit", "ot", 0]]}, "result": [[0.009376333522727274], 0, 2.840883255004883, 1671382177.2547624], "version": 0.2, "tvm_version": "0.11.dev0"}
{"input": ["cuda -keys=cuda,gpu -arch=sm_86 -max_num_threads=1024 -thread_warp_size=32", "conv2d_nchw.cuda", [["TENSOR", [1, 24, 208, 208], "float16"], ["TENSOR", [48, 24, 3, 3], "float16"], [2, 2], [1, 1, 1, 1], [1, 1], "float16"], {}], "config": {"index": 51968133, "code_hash": null, "entity": [["tile_f", "sp", [-1, 1, 1, 16]], ["tile_y", "sp", [-1, 1, 1, 1]], ["tile_x", "sp", [-1, 1, 1, 1]], ["tile_rc", "sp", [-1, 3]], ["tile_ry", "sp", [-1, 3]], ["tile_rx", "sp", [-1, 3]], ["auto_unroll_max_step", "ot", 512], ["unroll_explicit", "ot", 0]]}, "result": [[0.0098202585], 0, 2.510902166366577, 1671382178.7623398], "version": 0.2, "tvm_version": "0.11.dev0"}
{"input": ["cuda -keys=cuda,gpu -arch=sm_86 -max_num_threads=1024 -thread_warp_size=32", "conv2d_nchw.cuda", [["TENSOR", [1, 48, 104, 104], "float16"], ["TENSOR", [24, 48, 1, 1], "float16"], [1, 1], [0, 0, 0, 0], [1, 1], "float16"], {}], "config": {"index": 8578206, "code_hash": null, "entity": [["tile_f", "sp", [-1, 2, 6, 2]], ["tile_y", "sp", [-1, 1, 52, 1]], ["tile_x", "sp", [-1, 1, 1, 13]], ["tile_rc", "sp", [-1, 12]], ["tile_ry", "sp", [-1, 1]], ["tile_rx", "sp", [-1, 1]], ["auto_unroll_max_step", "ot", 512], ["unroll_explicit", "ot", 0]]}, "result": [[5.522468753145733e-05], 0, 2.839374303817749, 1671382190.5597422], "version": 0.2, "tvm_version": "0.11.dev0"}
{"input": ["cuda -keys=cuda,gpu -arch=sm_86 -max_num_threads=1024 -thread_warp_size=32", "conv2d_nchw.cuda", [["TENSOR", [1, 48, 104, 104], "float16"], ["TENSOR", [24, 48, 1, 1], "float16"], [1, 1], [0, 0, 0, 0], [1, 1], "float16"], {}], "config": {"index": 15978490, "code_hash": null, "entity": [["tile_f", "sp", [-1, 3, 2, 1]], ["tile_y", "sp", [-1, 26, 1, 4]], ["tile_x", "sp", [-1, 13, 4, 1]], ["tile_rc", "sp", [-1, 2]], ["tile_ry", "sp", [-1, 1]], ["tile_rx", "sp", [-1, 1]], ["auto_unroll_max_step", "ot", 0], ["unroll_explicit", "ot", 1]]}, "result": [[0.0022841909726027394], 0, 9.328641891479492, 1671382191.9233713], "version": 0.2, "tvm_version": "0.11.dev0"}
{"input": ["cuda -keys=cuda,gpu -arch=sm_86 -max_num_threads=1024 -thread_warp_size=32", "conv2d_nchw.cuda", [["TENSOR", [1, 48, 104, 104], "float16"], ["TENSOR", [24, 48, 1, 1], "float16"], [1, 1], [0, 0, 0, 0], [1, 1], "float16"], {}], "config": {"index": 10755349, "code_hash": null, "entity": [["tile_f", "sp", [-1, 4, 1, 6]], ["tile_y", "sp", [-1, 13, 4, 2]], ["tile_x", "sp", [-1, 1, 1, 1]], ["tile_rc", "sp", [-1, 2]], ["tile_ry", "sp", [-1, 1]], ["tile_rx", "sp", [-1, 1]], ["auto_unroll_max_step", "ot", 1500], ["unroll_explicit", "ot", 0]]}, "result": [[0.004079990124497992], 0, 4.054478168487549, 1671382193.3239973], "version": 0.2, "tvm_version": "0.11.dev0"}
{"input": ["cuda -keys=cuda,gpu -arch=sm_86 -max_num_threads=1024 -thread_warp_size=32", "conv2d_nchw.cuda", [["TENSOR", [1, 48, 104, 104], "float16"], ["TENSOR", [24, 48, 1, 1], "float16"], [1, 1], [0, 0, 0, 0], [1, 1], "float16"], {}], "config": {"index": 21023969, "code_hash": null, "entity": [["tile_f", "sp", [-1, 2, 1, 3]], ["tile_y", "sp", [-1, 1, 1, 104]], ["tile_x", "sp", [-1, 13, 1, 1]], ["tile_rc", "sp", [-1, 2]], ["tile_ry", "sp", [-1, 1]], ["tile_rx", "sp", [-1, 1]], ["auto_unroll_max_step", "ot", 512], ["unroll_explicit", "ot", 1]]}, "result": [[0.009838177427184467], 0, 2.2016491889953613, 1671382194.7847674], "version": 0.2, "tvm_version": "0.11.dev0"}
{"input": ["cuda -keys=cuda,gpu -arch=sm_86 -max_num_threads=1024 -thread_warp_size=32", "conv2d_nchw.cuda", [["TENSOR", [1, 48, 104, 104], "float16"], ["TENSOR", [24, 48, 1, 1], "float16"], [1, 1], [0, 0, 0, 0], [1, 1], "float16"], {}], "config": {"index": 10324245, "code_hash": null, "entity": [["tile_f", "sp", [-1, 8, 1, 1]], ["tile_y", "sp", [-1, 52, 2, 1]], ["tile_x", "sp", [-1, 52, 2, 1]], ["tile_rc", "sp", [-1, 1]], ["tile_ry", "sp", [-1, 1]], ["tile_rx", "sp", [-1, 1]], ["auto_unroll_max_step", "ot", 1500], ["unroll_explicit", "ot", 0]]}, "result": [[0.011024743373626375], 0, 4.363946199417114, 1671382196.2520952], "version": 0.2, "tvm_version": "0.11.dev0"}
{"input": ["cuda -keys=cuda,gpu -arch=sm_86 -max_num_threads=1024 -thread_warp_size=32", "conv2d_nchw.cuda", [["TENSOR", [1, 48, 104, 104], "float16"], ["TENSOR", [24, 48, 1, 1], "float16"], [1, 1], [0, 0, 0, 0], [1, 1], "float16"], {}], "config": {"index": 235308, "code_hash": null, "entity": [["tile_f", "sp", [-1, 2, 12, 1]], ["tile_y", "sp", [-1, 2, 1, 13]], ["tile_x", "sp", [-1, 1, 2, 2]], ["tile_rc", "sp", [-1, 1]], ["tile_ry", "sp", [-1, 1]], ["tile_rx", "sp", [-1, 1]], ["auto_unroll_max_step", "ot", 0], ["unroll_explicit", "ot", 0]]}, "result": [[2.9023225015765088e-05], 0, 1.8444607257843018, 1671382197.6415832], "version": 0.2, "tvm_version": "0.11.dev0"}
{"input": ["cuda -keys=cuda,gpu -arch=sm_86 -max_num_threads=1024 -thread_warp_size=32", "conv2d_nchw.cuda", [["TENSOR", [1, 48, 104, 104], "float16"], ["TENSOR", [24, 48, 1, 1], "float16"], [1, 1], [0, 0, 0, 0], [1, 1], "float16"], {}], "config": {"index": 7737905, "code_hash": null, "entity": [["tile_f", "sp", [-1, 2, 3, 4]], ["tile_y", "sp", [-1, 8, 1, 1]], ["tile_x", "sp", [-1, 2, 2, 1]], ["tile_rc", "sp", [-1, 8]], ["tile_ry", "sp", [-1, 1]], ["tile_rx", "sp", [-1, 1]], ["auto_unroll_max_step", "ot", 512], ["unroll_explicit", "ot", 0]]}, "result": [[5.522457422638018e-05], 0, 2.543947458267212, 1671382199.0764616], "version": 0.2, "tvm_version": "0.11.dev0"}
{"input": ["cuda -keys=cuda,gpu -arch=sm_86 -max_num_threads=1024 -thread_warp_size=32", "conv2d_nchw.cuda", [["TENSOR", [1, 48, 104, 104], "float16"], ["TENSOR", [24, 48, 1, 1], "float16"], [1, 1], [0, 0, 0, 0], [1, 1], "float16"], {}], "config": {"index": 346170, "code_hash": null, "entity": [["tile_f", "sp", [-1, 3, 2, 1]], ["tile_y", "sp", [-1, 104, 1, 1]], ["tile_x", "sp", [-1, 1, 13, 4]], ["tile_rc", "sp", [-1, 1]], ["tile_ry", "sp", [-1, 1]], ["tile_rx", "sp", [-1, 1]], ["auto_unroll_max_step", "ot", 0], ["unroll_explicit", "ot", 0]]}, "result": [[0.0005743232642578818], 0, 5.097893238067627, 1671382202.0400727], "version": 0.2, "tvm_version": "0.11.dev0"}
{"input": ["cuda -keys=cuda,gpu -arch=sm_86 -max_num_threads=1024 -thread_warp_size=32", "conv2d_nchw.cuda", [["TENSOR", [1, 48, 104, 104], "float16"], ["TENSOR", [24, 48, 1, 1], "float16"], [1, 1], [0, 0, 0, 0], [1, 1], "float16"], {}], "config": {"index": 3084063, "code_hash": null, "entity": [["tile_f", "sp", [-1, 3, 2, 4]], ["tile_y", "sp", [-1, 1, 1, 26]], ["tile_x", "sp", [-1, 2, 1, 1]], ["tile_rc", "sp", [-1, 12]], ["tile_ry", "sp", [-1, 1]], ["tile_rx", "sp", [-1, 1]], ["auto_unroll_max_step", "ot", 0], ["unroll_explicit", "ot", 0]]}, "result": [[0.0012287881108518086], 0, 2.93585205078125, 1671382203.4750383], "version": 0.2, "tvm_version": "0.11.dev0"}
{"input": ["cuda -keys=cuda,gpu -arch=sm_86 -max_num_threads=1024 -thread_warp_size=32", "conv2d_nchw.cuda", [["TENSOR", [1, 48, 104, 104], "float16"], ["TENSOR", [24, 48, 1, 1], "float16"], [1, 1], [0, 0, 0, 0], [1, 1], "float16"], {}], "config": {"index": 5843207, "code_hash": null, "entity": [["tile_f", "sp", [-1, 24, 1, 1]], ["tile_y", "sp", [-1, 1, 1, 1]], ["tile_x", "sp", [-1, 13, 1, 2]], ["tile_rc", "sp", [-1, 2]], ["tile_ry", "sp", [-1, 1]], ["tile_rx", "sp", [-1, 1]], ["auto_unroll_max_step", "ot", 512], ["unroll_explicit", "ot", 0]]}, "result": [[0.00740357118382353], 0, 3.9361448287963867, 1671382204.9147325], "version": 0.2, "tvm_version": "0.11.dev0"}
{"input": ["cuda -keys=cuda,gpu -arch=sm_86 -max_num_threads=1024 -thread_warp_size=32", "conv2d_nchw.cuda", [["TENSOR", [1, 48, 104, 104], "float16"], ["TENSOR", [24, 48, 1, 1], "float16"], [1, 1], [0, 0, 0, 0], [1, 1], "float16"], {}], "config": {"index": 26368650, "code_hash": null, "entity": [["tile_f", "sp", [-1, 3, 2, 1]], ["tile_y", "sp", [-1, 1, 2, 1]], ["tile_x", "sp", [-1, 1, 4, 2]], ["tile_rc", "sp", [-1, 2]], ["tile_ry", "sp", [-1, 1]], ["tile_rx", "sp", [-1, 1]], ["auto_unroll_max_step", "ot", 1500], ["unroll_explicit", "ot", 1]]}, "result": [[4.186225130450009e-05], 0, 2.529076337814331, 1671382206.4548085], "version": 0.2, "tvm_version": "0.11.dev0"}
{"input": ["cuda -keys=cuda,gpu -arch=sm_86 -max_num_threads=1024 -thread_warp_size=32", "conv2d_nchw.cuda", [["TENSOR", [1, 48, 104, 104], "float16"], ["TENSOR", [24, 48, 1, 1], "float16"], [1, 1], [0, 0, 0, 0], [1, 1], "float16"], {}], "config": {"index": 21431569, "code_hash": null, "entity": [["tile_f", "sp", [-1, 2, 1, 3]], ["tile_y", "sp", [-1, 1, 13, 4]], ["tile_x", "sp", [-1, 2, 4, 13]], ["tile_rc", "sp", [-1, 2]], ["tile_ry", "sp", [-1, 1]], ["tile_rx", "sp", [-1, 1]], ["auto_unroll_max_step", "ot", 512], ["unroll_explicit", "ot", 1]]}, "result": [[0.0003745104418348624], 0, 6.267709970474243, 1671382207.8232124], "version": 0.2, "tvm_version": "0.11.dev0"}
{"input": ["cuda -keys=cuda,gpu -arch=sm_86 -max_num_threads=1024 -thread_warp_size=32", "conv2d_nchw.cuda", [["TENSOR", [1, 48, 104, 104], "float16"], ["TENSOR", [24, 48, 1, 1], "float16"], [1, 1], [0, 0, 0, 0], [1, 1], "float16"], {}], "config": {"index": 23561765, "code_hash": null, "entity": [["tile_f", "sp", [-1, 8, 1, 1]], ["tile_y", "sp", [-1, 1, 13, 2]], ["tile_x", "sp", [-1, 2, 1, 1]], ["tile_rc", "sp", [-1, 12]], ["tile_ry", "sp", [-1, 1]], ["tile_rx", "sp", [-1, 1]], ["auto_unroll_max_step", "ot", 512], ["unroll_explicit", "ot", 1]]}, "result": [[5.477090820449071e-05], 0, 3.767437696456909, 1671382218.7244473], "version": 0.2, "tvm_version": "0.11.dev0"}
{"input": ["cuda -keys=cuda,gpu -arch=sm_86 -max_num_threads=1024 -thread_warp_size=32", "conv2d_nchw.cuda", [["TENSOR", [1, 48, 104, 104], "float16"], ["TENSOR", [24, 48, 1, 1], "float16"], [1, 1], [0, 0, 0, 0], [1, 1], "float16"], {}], "config": {"index": 15664846, "code_hash": null, "entity": [["tile_f", "sp", [-1, 2, 6, 2]], ["tile_y", "sp", [-1, 13, 1, 4]], ["tile_x", "sp", [-1, 1, 52, 2]], ["tile_rc", "sp", [-1, 1]], ["tile_ry", "sp", [-1, 1]], ["tile_rx", "sp", [-1, 1]], ["auto_unroll_max_step", "ot", 0], ["unroll_explicit", "ot", 1]]}, "result": [[0.0008208798908941755], 0, 3.3738415241241455, 1671382220.067368], "version": 0.2, "tvm_version": "0.11.dev0"}
{"input": ["cuda -keys=cuda,gpu -arch=sm_86 -max_num_threads=1024 -thread_warp_size=32", "conv2d_nchw.cuda", [["TENSOR", [1, 48, 104, 104], "float16"], ["TENSOR", [24, 48, 1, 1], "float16"], [1, 1], [0, 0, 0, 0], [1, 1], "float16"], {}], "config": {"index": 19655028, "code_hash": null, "entity": [["tile_f", "sp", [-1, 2, 1, 6]], ["tile_y", "sp", [-1, 104, 1, 1]], ["tile_x", "sp", [-1, 2, 1, 2]], ["tile_rc", "sp", [-1, 24]], ["tile_ry", "sp", [-1, 1]], ["tile_rx", "sp", [-1, 1]], ["auto_unroll_max_step", "ot", 0], ["unroll_explicit", "ot", 1]]}, "result": [[0.01578411196875], 0, 5.53911828994751, 1671382221.6029458], "version": 0.2, "tvm_version": "0.11.dev0"}
{"input": ["cuda -keys=cuda,gpu -arch=sm_86 -max_num_threads=1024 -thread_warp_size=32", "conv2d_nchw.cuda", [["TENSOR", [1, 48, 104, 104], "float16"], ["TENSOR", [24, 48, 1, 1], "float16"], [1, 1], [0, 0, 0, 0], [1, 1], "float16"], {}], "config": {"index": 2249135, "code_hash": null, "entity": [["tile_f", "sp", [-1, 2, 3, 1]], ["tile_y", "sp", [-1, 26, 1, 2]], ["tile_x", "sp", [-1, 2, 1, 2]], ["tile_rc", "sp", [-1, 6]], ["tile_ry", "sp", [-1, 1]], ["tile_rx", "sp", [-1, 1]], ["auto_unroll_max_step", "ot", 0], ["unroll_explicit", "ot", 0]]}, "result": [[0.0013473406082603254], 0, 3.678340435028076, 1671382223.046141], "version": 0.2, "tvm_version": "0.11.dev0"}
{"input": ["cuda -keys=cuda,gpu -arch=sm_86 -max_num_threads=1024 -thread_warp_size=32", "conv2d_nchw.cuda", [["TENSOR", [1, 48, 104, 104], "float16"], ["TENSOR", [24, 48, 1, 1], "float16"], [1, 1], [0, 0, 0, 0], [1, 1], "float16"], {}], "config": {"index": 13532800, "code_hash": null, "entity": [["tile_f", "sp", [-1, 1, 1, 1]], ["tile_y", "sp", [-1, 1, 4, 2]], ["tile_x", "sp", [-1, 26, 1, 2]], ["tile_rc", "sp", [-1, 12]], ["tile_ry", "sp", [-1, 1]], ["tile_rx", "sp", [-1, 1]], ["auto_unroll_max_step", "ot", 1500], ["unroll_explicit", "ot", 0]]}, "result": [[0.000544226255880941], 0, 5.076300621032715, 1671382224.5399365], "version": 0.2, "tvm_version": "0.11.dev0"}
{"input": ["cuda -keys=cuda,gpu -arch=sm_86 -max_num_threads=1024 -thread_warp_size=32", "conv2d_nchw.cuda", [["TENSOR", [1, 48, 104, 104], "float16"], ["TENSOR", [24, 48, 1, 1], "float16"], [1, 1], [0, 0, 0, 0], [1, 1], "float16"], {}], "config": {"index": 13677775, "code_hash": null, "entity": [["tile_f", "sp", [-1, 2, 3, 1]], ["tile_y", "sp", [-1, 26, 2, 1]], ["tile_x", "sp", [-1, 1, 1, 8]], ["tile_rc", "sp", [-1, 12]], ["tile_ry", "sp", [-1, 1]], ["tile_rx", "sp", [-1, 1]], ["auto_unroll_max_step", "ot", 1500], ["unroll_explicit", "ot", 0]]}, "result": [[0.0008321813866141733], 0, 3.2864840030670166, 1671382225.9616194], "version": 0.2, "tvm_version": "0.11.dev0"}
{"input": ["cuda -keys=cuda,gpu -arch=sm_86 -max_num_threads=1024 -thread_warp_size=32", "conv2d_nchw.cuda", [["TENSOR", [1, 48, 104, 104], "float16"], ["TENSOR", [24, 48, 1, 1], "float16"], [1, 1], [0, 0, 0, 0], [1, 1], "float16"], {}], "config": {"index": 12091770, "code_hash": null, "entity": [["tile_f", "sp", [-1, 3, 2, 1]], ["tile_y", "sp", [-1, 1, 52, 1]], ["tile_x", "sp", [-1, 2, 1, 4]], ["tile_rc", "sp", [-1, 4]], ["tile_ry", "sp", [-1, 1]], ["tile_rx", "sp", [-1, 1]], ["auto_unroll_max_step", "ot", 1500], ["unroll_explicit", "ot", 0]]}, "result": [[5.1497402049806714e-05], 0, 2.403339147567749, 1671382227.4612856], "version": 0.2, "tvm_version": "0.11.dev0"}
{"input": ["cuda -keys=cuda,gpu -arch=sm_86 -max_num_threads=1024 -thread_warp_size=32", "conv2d_nchw.cuda", [["TENSOR", [1, 48, 104, 104], "float16"], ["TENSOR", [24, 48, 1, 1], "float16"], [1, 1], [0, 0, 0, 0], [1, 1], "float16"], {}], "config": {"index": 13901208, "code_hash": null, "entity": [["tile_f", "sp", [-1, 1, 2, 1]], ["tile_y", "sp", [-1, 26, 1, 1]], ["tile_x", "sp", [-1, 26, 2, 1]], ["tile_rc", "sp", [-1, 16]], ["tile_ry", "sp", [-1, 1]], ["tile_rx", "sp", [-1, 1]], ["auto_unroll_max_step", "ot", 1500], ["unroll_explicit", "ot", 0]]}, "result": [[0.008724443782608695], 0, 4.847115993499756, 1671382228.9193616], "version": 0.2, "tvm_version": "0.11.dev0"}
{"input": ["cuda -keys=cuda,gpu -arch=sm_86 -max_num_threads=1024 -thread_warp_size=32", "conv2d_nchw.cuda", [["TENSOR", [1, 48, 104, 104], "float16"], ["TENSOR", [24, 48, 1, 1], "float16"], [1, 1], [0, 0, 0, 0], [1, 1], "float16"], {}], "config": {"index": 7657792, "code_hash": null, "entity": [["tile_f", "sp", [-1, 3, 1, 2]], ["tile_y", "sp", [-1, 1, 13, 2]], ["tile_x", "sp", [-1, 1, 1, 52]], ["tile_rc", "sp", [-1, 6]], ["tile_ry", "sp", [-1, 1]], ["tile_rx", "sp", [-1, 1]], ["auto_unroll_max_step", "ot", 512], ["unroll_explicit", "ot", 0]]}, "result": [[0.00036327828819672134], 0, 4.247066020965576, 1671382230.3873222], "version": 0.2, "tvm_version": "0.11.dev0"}
{"input": ["cuda -keys=cuda,gpu -arch=sm_86 -max_num_threads=1024 -thread_warp_size=32", "conv2d_nchw.cuda", [["TENSOR", [1, 48, 104, 104], "float16"], ["TENSOR", [24, 48, 1, 1], "float16"], [1, 1], [0, 0, 0, 0], [1, 1], "float16"], {}], "config": {"index": 12172862, "code_hash": null, "entity": [["tile_f", "sp", [-1, 1, 2, 4]], ["tile_y", "sp", [-1, 1, 1, 1]], ["tile_x", "sp", [-1, 4, 1, 13]], ["tile_rc", "sp", [-1, 4]], ["tile_ry", "sp", [-1, 1]], ["tile_rx", "sp", [-1, 1]], ["auto_unroll_max_step", "ot", 1500], ["unroll_explicit", "ot", 0]]}, "result": [[8.698235469425571e-05], 0, 3.266533613204956, 1671382231.862581], "version": 0.2, "tvm_version": "0.11.dev0"}
{"input": ["cuda -keys=cuda,gpu -arch=sm_86 -max_num_threads=1024 -thread_warp_size=32", "conv2d_nchw.cuda", [["TENSOR", [1, 48, 104, 104], "float16"], ["TENSOR", [24, 48, 1, 1], "float16"], [1, 1], [0, 0, 0, 0], [1, 1], "float16"], {}], "config": {"index": 30285469, "code_hash": null, "entity": [["tile_f", "sp", [-1, 1, 24, 1]], ["tile_y", "sp", [-1, 1, 2, 1]], ["tile_x", "sp", [-1, 26, 2, 1]], ["tile_rc", "sp", [-1, 48]], ["tile_ry", "sp", [-1, 1]], ["tile_rx", "sp", [-1, 1]], ["auto_unroll_max_step", "ot", 1500], ["unroll_explicit", "ot", 1]]}, "result": [[3.273891077286068e-05], 0, 9.467331409454346, 1671382233.3345828], "version": 0.2, "tvm_version": "0.11.dev0"}
{"input": ["cuda -keys=cuda,gpu -arch=sm_86 -max_num_threads=1024 -thread_warp_size=32", "conv2d_nchw.cuda", [["TENSOR", [1, 48, 104, 104], "float16"], ["TENSOR", [24, 48, 1, 1], "float16"], [1, 1], [0, 0, 0, 0], [1, 1], "float16"], {}], "config": {"index": 5735157, "code_hash": null, "entity": [["tile_f", "sp", [-1, 2, 2, 2]], ["tile_y", "sp", [-1, 2, 2, 1]], ["tile_x", "sp", [-1, 13, 4, 1]], ["tile_rc", "sp", [-1, 2]], ["tile_ry", "sp", [-1, 1]], ["tile_rx", "sp", [-1, 1]], ["auto_unroll_max_step", "ot", 512], ["unroll_explicit", "ot", 0]]}, "result": [[2.859337653002981e-05], 0, 3.557271718978882, 1671382246.043746], "version": 0.2, "tvm_version": "0.11.dev0"}
{"input": ["cuda -keys=cuda,gpu -arch=sm_86 -max_num_threads=1024 -thread_warp_size=32", "conv2d_nchw.cuda", [["TENSOR", [1, 48, 104, 104], "float16"], ["TENSOR", [24, 48, 1, 1], "float16"], [1, 1], [0, 0, 0, 0], [1, 1], "float16"], {}], "config": {"index": 28621103, "code_hash": null, "entity": [["tile_f", "sp", [-1, 3, 2, 4]], ["tile_y", "sp", [-1, 8, 1, 1]], ["tile_x", "sp", [-1, 4, 1, 26]], ["tile_rc", "sp", [-1, 8]], ["tile_ry", "sp", [-1, 1]], ["tile_rx", "sp", [-1, 1]], ["auto_unroll_max_step", "ot", 1500], ["unroll_explicit", "ot", 1]]}, "result": [[0.004345899790598291], 0, 3.371136426925659, 1671382247.419353], "version": 0.2, "tvm_version": "0.11.dev0"}
{"input": ["cuda -keys=cuda,gpu -arch=sm_86 -max_num_threads=1024 -thread_warp_size=32", "conv2d_nchw.cuda", [["TENSOR", [1, 48, 104, 104], "float16"], ["TENSOR", [24, 48, 1, 1], "float16"], [1, 1], [0, 0, 0, 0], [1, 1], "float16"], {}], "config": {"index": 2137839, "code_hash": null, "entity": [["tile_f", "sp", [-1, 1, 1, 24]], ["tile_y", "sp", [-1, 4, 1, 1]], ["tile_x", "sp", [-1, 1, 4, 1]], ["tile_rc", "sp", [-1, 6]], ["tile_ry", "sp", [-1, 1]], ["tile_rx", "sp", [-1, 1]], ["auto_unroll_max_step", "ot", 0], ["unroll_explicit", "ot", 0]]}, "result": [[6.232353156730388e-05], 0, 1.9849011898040771, 1671382248.8306193], "version": 0.2, "tvm_version": "0.11.dev0"}
{"input": ["cuda -keys=cuda,gpu -arch=sm_86 -max_num_threads=1024 -thread_warp_size=32", "conv2d_nchw.cuda", [["TENSOR", [1, 48, 104, 104], "float16"], ["TENSOR", [24, 48, 1, 1], "float16"], [1, 1], [0, 0, 0, 0], [1, 1], "float16"], {}], "config": {"index": 26842787, "code_hash": null, "entity": [["tile_f", "sp", [-1, 1, 1, 6]], ["tile_y", "sp", [-1, 1, 4, 1]], ["tile_x", "sp", [-1, 26, 1, 2]], ["tile_rc", "sp", [-1, 3]], ["tile_ry", "sp", [-1, 1]], ["tile_rx", "sp", [-1, 1]], ["auto_unroll_max_step", "ot", 1500], ["unroll_explicit", "ot", 1]]}, "result": [[0.002792563696969697], 0, 6.736556529998779, 1671382250.2203193], "version": 0.2, "tvm_version": "0.11.dev0"}
{"input": ["cuda -keys=cuda,gpu -arch=sm_86 -max_num_threads=1024 -thread_warp_size=32", "conv2d_nchw.cuda", [["TENSOR", [1, 48, 104, 104], "float16"], ["TENSOR", [24, 48, 1, 1], "float16"], [1, 1], [0, 0, 0, 0], [1, 1], "float16"], {}], "config": {"index": 25906615, "code_hash": null, "entity": [["tile_f", "sp", [-1, 1, 4, 3]], ["tile_y", "sp", [-1, 4, 1, 26]], ["tile_x", "sp", [-1, 1, 52, 2]], ["tile_rc", "sp", [-1, 1]], ["tile_ry", "sp", [-1, 1]], ["tile_rx", "sp", [-1, 1]], ["auto_unroll_max_step", "ot", 1500], ["unroll_explicit", "ot", 1]]}, "result": [[0.0014039626649305556], 0, 8.106639385223389, 1671382253.1879435], "version": 0.2, "tvm_version": "0.11.dev0"}
{"input": ["cuda -keys=cuda,gpu -arch=sm_86 -max_num_threads=1024 -thread_warp_size=32", "conv2d_nchw.cuda", [["TENSOR", [1, 48, 104, 104], "float16"], ["TENSOR", [24, 48, 1, 1], "float16"], [1, 1], [0, 0, 0, 0], [1, 1], "float16"], {}], "config": {"index": 6643337, "code_hash": null, "entity": [["tile_f", "sp", [-1, 1, 8, 3]], ["tile_y", "sp", [-1, 2, 1, 1]], ["tile_x", "sp", [-1, 1, 2, 52]], ["tile_rc", "sp", [-1, 3]], ["tile_ry", "sp", [-1, 1]], ["tile_rx", "sp", [-1, 1]], ["auto_unroll_max_step", "ot", 512], ["unroll_explicit", "ot", 0]]}, "result": [[4.589517638056928e-05], 0, 2.62923526763916, 1671382254.5631788], "version": 0.2, "tvm_version": "0.11.dev0"}
{"input": ["cuda -keys=cuda,gpu -arch=sm_86 -max_num_threads=1024 -thread_warp_size=32", "conv2d_nchw.cuda", [["TENSOR", [1, 48, 104, 104], "float16"], ["TENSOR", [24, 48, 1, 1], "float16"], [1, 1], [0, 0, 0, 0], [1, 1], "float16"], {}], "config": {"index": 20950854, "code_hash": null, "entity": [["tile_f", "sp", [-1, 4, 2, 3]], ["tile_y", "sp", [-1, 1, 26, 2]], ["tile_x", "sp", [-1, 1, 2, 26]], ["tile_rc", "sp", [-1, 1]], ["tile_ry", "sp", [-1, 1]], ["tile_rx", "sp", [-1, 1]], ["auto_unroll_max_step", "ot", 512], ["unroll_explicit", "ot", 1]]}, "result": [[0.0005481273567188343], 0, 5.152001142501831, 1671382255.8962874], "version": 0.2, "tvm_version": "0.11.dev0"}
